"",Job Function,Industry,Seniority,Job Description,Segment,female,male
74,Sales and Business Development,"Technology, Information and Internet",Executive,"Here at Beyond, we are passionate about helping vacation rental owners and managers grow their business. Backed by Bessemer Venture Partners, we have grown to the global leader of short term rental revenue management platforms. We attribute our success to our belief that the people are the most important part of a business, and our commitment to being a fantastic place to work.

It's with that in mind that Beyond is looking to add a Vice President of Sales to join our growing team. Reporting to the CEO, you will have the opportunity to lead our North American sales team. You'll serve as a strategic partner to our CEO, thinking through a long-term growth strategy as we continue to innovate, scale, and position ourselves as a thought leader within our industry.

Before reading further...

Beyond is passionate about diversity and cultivating our team's potential. If you're hungry for a good opportunity, but don't meet every point in this job description, please apply anyway!

As our VP of Sales, you'll be responsible for:

Leading a growing sales team comprised of Sales Manager, Account Executives, and BDRs
Auditing and improving market segmentation, territories, and compensation plans to ensure the team is set up for success
Equipping the team with processes and a playbook to empower the team to consistently meet their monthly revenue targets
Partnering with our product organization to establish channels for our internal teams to understand and prioritize market feedback to evolve our products
Working with the CEO to evolve commercial strategy, thinking through pricing, packaging, and targeting as we continue to lead our industry
Being a visible brand and culture ambassador, as well as, providing thought leadership and representing Beyond at industry events and conferences


So what kind of person are we looking for in this role? The person who will be successful in this role will be:

An inspirational leader: you'll ensure everyone on the team will understand the value of their contributions and their path to growth
Data-driven: you immerse yourself with metrics that matter, refining and socializing the data we use to measure the success of the team
Highly accountable: you are known for setting lofty yet achievable goals and holding yourself, your team, and leadership to execute on these goals
Comfortable in a fast-paced environment: you are eager and hungry to work hard, make a big impact, and thrive in a fast-paced environment
A strong collaborator: you easily build trust and credibility and enjoy partnering with the rest of the organization and leadership team, including product and marketing
Confident and humble: You are skilled and knowledgeable yet remain a lifelong learner with the desire to always improve yourself and your craft


Now that we've told you what the job looks like, here are the qualifications we're looking for in a candidate:

Deep experience successfully leading high-growth B2B SaaS sales organizations - establishing and meeting substantial revenue targets
Experience helping mature a sales motion past the early adopter phase is ideal
Deep experience leading and inspiring teams to achieve the above - is someone people would want to follow to their next job
Experience architecting high-performing teams - knows what it takes to support and grow high achievers, from comp plans to sales enablement
Comfortable as a player/coach - has a track record of closing high-impact deals while supporting their teams to do the same
A customer-first mentality, eager to work with our CEO on evolving our commercial strategy


So what can you expect after you apply? Your application will be personally reviewed by a member of the Beyond hiring team and if there is a match in your experience and the role you will:

Connect with the Executive Search firm running this search to set up an initial call to learn more about Beyond and address initial questions
Conduct a deep dive interview with the Executive Search firm
Interview with our CEO, CTO/Cofounder, and Managing Director of EMEA
Meet with our North American Sales leaders
Complete a Case Study and present it key stakeholders
Have final 1:1 Interviews with other members of our Leadership team


Company Values:

We are serious about our core values: We Care, We Are On the Same Team, We Inspire Trust, We Go Beyond, We Ship It. If those resonate with you, and you're ready to work with a team that lives and breathes those values, we want to hear from you.

Benefits:

Beyond offers a wide variety of benefits like: stock options, unlimited PTO, work from home office stipend, private health insurance and more! You can learn more about our benefits by visiting our careers site!

We Care about Diversity, Equity and Inclusion:

Beyond is committed to building a workplace that attracts humans of all genders, ethnicities, backgrounds, statuses and lifestyles. At our core, we care about our people and encourage every employee, partner and applicant to share their whole self with us. We are respectful of and empathetic towards different viewpoints, and believe that our ability to help short term rental managers succeed relies on us building a dynamic and diverse team. Whoever you are, you can Belong @ Beyond.

Please review our GDPR Statement here.
Show less ",1,0,0
75,Management and Manufacturing,Insurance,Executive,"Goodville Mutual Casualty Company, New Holland, PA, provides comprehensive property and casualty insurance products, exclusively through independent agents. Founded in 1926, Goodville Mutual’s mission is to conduct business by the biblical principles of love, justice, and integrity and offer products of the highest quality. Delivering excellent customer service, Goodville Mutual now serves eight states. Nationally recognized as a “Top 50 US Property & Casualty Company” by the Ward Group for over 12 years, Goodville Mutual is also rated A (Excellent) by A.M. Best. An employee centric organization, Goodville Mutual actively invests in fostering a workplace culture of trust and strives to leverage the unique talents of each team member.




Goodville Mutual Casualty Company is seeking a Chief Operating Officer (COO) to execute strategic initiatives, achieve corporate goals and growth objectives and champion workplace culture. The successful candidate will demonstrate a passion for developing people and advance the mission, vision, and values of Goodville Mutual. A member of the President’s Team, the COO will provide leadership throughout the organization by monitoring all service levels, ensuring metric driven operations and an exceptional member experience for all stakeholders. Utilizing data to make effective decisions, the COO will optimize systems, processes, and structures to ensure companywide efficiencies and a customer-centric focus. A track record of successfully implementing change throughout an organization combined with the ability to work closely with high performing teams is essential to the role.




COO Position Qualifications




Bachelor’s degree or equivalent experience, required; Advanced degree, a plus Minimum of five years of executive leadership experience in an operations role Strong understanding of comprehensive property and casualty insurance products and services, and/or experience in a highly regulated environment Successful track record of promoting and strengthening company culture and core values Excellent verbal and written communication skills Demonstrated community involvement, desired




Please forward resume and cover letter to: www.NorthGroupConsultants.com/jobs
Show less ",1,0,0.32
76,Management and Manufacturing,Restaurants,Executive,"Our Restaurant General Managers balance being a great leader with delivering WOW service to our guests. Krystal GMs understand the importance of providing great energy for restaurant teams and the guest, while focusing on restaurant operations. Our leaders focus their time in developing people, creating great guest experiences, being a brand champion, business planning and maintaining the facility.




Essential Responsibilities




Develop People




Lives People First promise to welcome, include, grow and celebrate each team member and consistently exhibits PRIDE values (Promote teamwork, Respect everyone, Impress customers, Deliver Results and Exemplify Integrity)




Creates a great energy in the restaurant and sets the team up for success
Empowers the team through Yes I Can
Communicates effectively and engages the team in regular huddles
Coaches and motivates the Shift Leaders, Assistant Managers and the team
Recruits and develops top grade talent
Demonstrates commitment to goals and inspires others to deliver excellent performance
Recognizes the team with U-Rock and Fresh, Friendly and Fast recognition tools
Serves those they lead through behaviors, actions and decisions




Create Great Guest Experiences




Creates a fresh, friendly and fast service experience so good the guest can’t wait to come back to Krystal




Serves as a role model to create WOW guest experiences
Sets clear expectations and creates a welcoming work environment
Takes actions to solve and celebrates guest feedback
Regularly observes the team and operations from the guest perspective and celebrates or coaches accordingly




Brand Champion




Serves as the face and voice of the brand in the restaurant and community




Serves as the local representative of Krystal to the community and grow sales by sponsoring local marketing or participating in events
Builds and leverages community relationships to drive business and maximize catering program opportunities in the community
Champions and implements company-wide promotions, product launches and product samplings
Ensures the team executes and measures the impact of local promotions




Business Planning




Maintains the balance between providing a high quality employee and guest experience, and achieving financial goals




Responsible for developing and maintaining Krystal 9 operating systems
Develops sales forecast and creates schedules to ensure Quality, Service and Cleanliness will be met
Monitors business: previous day numbers, schedules, cash shortage concerns, and HACCP Logs
Reviews inventory efficiencies to create product (truck) orders
Reviews inventory and evaluates food costs
Controls food and equipment inventory, conducts daily and weekly inventory counts and keeps inventory records
Creates, communicates, implements and follows up on operations and financial action plans.
Analyzes sales and labor results throughout and after each shift
Maintains Brand operating standards for product procedures, cleanliness standards and service expectations




Maintain Facility




Ensures the restaurant is a safe, sanitary and appealing place for everyone




Monitors and maintains compliance with health, safety, cleanliness, security and fire policies, standards and regulations.
Identifies problems, conducts high-level troubleshooting and seeks repair(maintenance) support for restaurant equipment to ensure equipment is operational




Required Knowledge, Skills And Abilities




Excellent people leadership and guest service skills required
Ability to work in a fast paced environment
Ability to communicate effectively with guests, team members and Above Restaurant Leaders
Ability to resolves issues in compliance with Krystal standards
Available to work all shifts, weekends and holidays




Education And Experience




Must have high school diploma or equivalent
Minimum of 3 years management experience




Physical Demands




Must be able to lift up to 50 pounds of force frequently to move objects
Ability to carry products/boxes and miscellaneous items weighing no more than 50 pounds
Consistently handles product preparation
Ability to kneel and follow proper lifting procedures
Consistently lifts for product preparation, stocking and inventory
Show less ",1,0,0
77,"Research, Analyst, and Information Technology",Hospitals and Health Care,Executive,"Sandstone Healthcare Group -




Must Reside near Salt Lake City, UT, or Las Vegas, NV




Skilled Nursing provider with facilities in Nevada, Utah, and Arizona seeks an RN VP of Clinical Operations. Must be an LTC SNF DON with multisite expertise to be considered.




Benefits




401(k)
Dental Insurance
Health insurance
Vision insurance




Responsibilities




As the VP of Clinical Operations, you are delegated the authority, responsibility, and accountability necessary for carrying out your assigned duties
Conducts facility reviews to assess compliance with Federal and State regulations related to the MCurrent licensure in State(s) where practicing
Prepares reports as identified
Review care plan dashboard monthly follow up as needed
Review MDS schedule monthly follow-up as needed
Run and follow up on the missing assessment report in Simple monthly
Review care management tracker monthly




Requirements




Current licensure in State(s) where practicing
Must be able to travel by plane and car to assigned work locations
LTC and SNF experience required
Travel requirements are heavy at 50%-75% of the normal work week
Must be able to read, write, speak, and understand the English language
Requires the ability to make independent decisions when circumstances warrant such action
Requires the ability to deal tactfully with personnel, residents, family members, visitors, government agencies/personnel, and the general public
Must be knowledgeable of RAI Guidelines, Medicare Reimbursement Rules, as well as state Medicaid laws, regulations, and guidelines that pertain to Skilled Nursing Facilities
Show less ",1,0,0
78,Management and Manufacturing,Internet Publishing,Executive,"The ideal candidate for the role of DLP Camps and Communities Leader will possess a strong sense of ownership and accountability, and be responsible for driving the successful execution of daily property operations, financial performance targets, compliance, talent acquisition, team member development & retention, customer & resident satisfaction, expense control and flawless execution of the portfolio’s business plan.




What you have already achieved: (Requirements)




10+ year property management experience (multi-family)
5+ years hospitality experience
RV camp experience required
Mobile home experience preferred
Food and Beverage experience preferred
High level proficiency with Excel and Google Suite
Ability to Travel




What you are great at: (Expectations)




Meet or exceed all key metrics and revenue targets set for the property management function
Responsible for the successful execution of daily property operations, financial performance, compliance, and asset preservation
Manage and develop team members to ensure the highest levels of resident satisfaction by “Delivering the WOW”
Drive the implementation tech stack for the property management platform
Achieve Opex ratio by monitoring budget and expenditure control
Monitor and review progress of all projects, ensuring they are delivered on time and within budget
Maintain positive working relationships with all internal and external stakeholders




What you're motivated by:




A fast pace. We’ve grown exponentially and new team members continue to join our DLP family.
A leadership team that trusts each other, communicates effectively, and is committed to helping team members grow, both personally and professionally.
Visionary, smart, and innovative CEO. Ours is the kind of leader you read about, hope to work with, and learn from.
A culture focused on developing and investing in team members - coaching, training, and supporting each other. We have a mantra of “Leaders made here” at DLP, focused on developing and growing leaders.




Our Mission:




At DLP Capital, we are committed to making an impact - whether it's through acquiring and developing real estate, building relationships, or empowering our clients with the tools they need to achieve their dreams. We deliver a suite of services including lending, investment funds management, and loan servicing in addition to an exclusive membership platform focused on scaling businesses and preserving wealth. We are proud to have been named on multiple Best Places to Work lists for more than six years, and have remained on the Inc. 5000 list of fastest-growing companies for 10 consecutive years.




Benefits and Perks:




Unlimited PTO, Hybrid schedule, health/dental/vision/life insurance, 401(k) matching, learning/educational incentives, Volunteer Time Off, well-being programs, company events, self improvement/productivity tools, & the incredible feeling of making a difference.




Equal Opportunity Employer:




We are an equal opportunity employer and all qualified applicants will receive consideration for employment without regard to race, color, religion, sex, sexual orientation, gender identity or expression, pregnancy, age, national origin, disability status, genetic information, protected veteran status, or any other characteristic protected by law.




Powered by JazzHR




yQihexxDAJ
Show less ",1,0,0
79,Business Development and Sales,Non-profit Organizations,Executive,"Come join our awesome team as an MDS Nurse at Maplewood Care Center. We are offering generous retention incentives of $8,000 for RN and $7,000.00 for LPN! Willing to train!




Pay up to $43.00




Maplewood Care Center is part of Volunteers of America National Services which serves as the Housing and Healthcare affiliate of the Volunteers of America parent organization.




MDS Nurse Job Highlights




Generous “refer a friend” bonuses
403(b) Retirement Plan;
Career scholarships;
Quality training, continuing career education and leadership programs;
Medical, Dental and Vision Insurance
Paid Time Off (Vacation, Holiday & Sick Days)




About The Job




The primary purpose of the MDS Nurse is to plan and organize the MDS/RAI process in coordination with the RAI/PPS Coordinator. Willing to train!




You will become a residents' rights advocate, educating each resident of their legal rights, as well as continuously monitoring, evaluating, and managing the care given to residents.




Essentials




Completes the minimum data set assessment (MDS) and Care Area Assessment (CAAS).
Ensure that care plans accurately reflect the cares and clinical monitoring provided.
Monitors regulatory compliance for completion of MDS/RAI process
Informs IDT members of validation errors as appropriate.
Follows the HCFA Correction Policy for corrections.




Required qualifications: To perform this job successfully, an individual must be able to perform each essential duty satisfactorily. The requirements listed below are representative of the knowledge, skill and/or ability required. Reasonable accommodations may be made to enable individuals with disabilities to perform the essential functions.




Current RN or LPN licensure in the sate of employment
Good problem solver with abilities to make independent judgments utilizing initiative, discretion and the nursing process as needed.
Demonstrates good organizational skills.
Excellent computer skills.
Ability to prioritize duties, and work independently.
Customer service oriented with knowledge of successful customer service techniques.
Ability to complete assigned duties within a constantly changing environment.
Team player with ability to function within interdisciplinary team.




Preferred Qualifications




Registered Nurse with previous long- term care experience with working knowledge of the RAI process.




Maplewood Care Center is a skilled nursing and memory care rehabilitation facility located in Maplewood, Minnesota, on the Homestead at Maplewood Campus. At our center, we are devoted to providing individualized, empathetic assistance to seniors in need of short-term or long-term care. The city of Maplewood is a short drive from St Paul and Minneapolis. We employ hardworking individuals who are unwavering in their commitment to ensuring our residents are receiving the quality care they deserve. They heavily contribute to the positive work culture we have at Maplewood Care Center, and the kindness and joy they bring to work every day always brings a smile to those who need it.




Our 2022 Great Place to Work survey results found that 87% of employees said their work has a special meaning: this is not “just a job”.




Take pride in helping others, and join us today!




At VOANS, we celebrate sharing, encouraging and embracing diversity. Equal employment opportunities are available to all without regard to race, color, religion, sex, pregnancy, national origin, age, physical and mental disability, marital status, parental status, sexual orientation, gender identity, gender expression, genetic information, military and veteran status, and any other characteristic protected by applicable law. We believe that blending individual strengths and unique personal differences nurtures and supports our organizations’ shared commitment to our mission and creates an inclusive and diverse environment where everyone feels valued and has the opportunity to do their personal best.




Volunteers of America National Services requires COVID vaccination for all employees, volunteers and contractors. We care for individuals who are most susceptible to advanced COVID illness and death. We are committed to providing the safest environment possible for those we work alongside, and for those we serve. We have a formal process for, and do consider religious and/or medical requests for exceptions.
Show less ",1,0,0
80,Project Management and Information Technology,Software Development,Executive,"For a financial client we need Program Manager. This position is based in Boston, MA or Covington, KY or Merrimack, NH. We are Primarily looking for W2 Candidates and not looking for Third Party Candidates.

The Expertise We Are Looking For

Bachelor's Degree required

5+ years client service or client/vendor relationship management experience

Understanding of the Health Savings Account (HSA) product and brokerage account opening experience is a plus

The Skills You Bring

Proven expertise working with large client (employer) relationships, leading discussions, responding to questions, and overcoming objections.

Strong experience advocating for the needs of clients.

Meticulous project/program management skills are needed to coordinate and complete several unrelated tasks in a timeline desired by the business.

Curious and analytical with a customer-centric approach to help overcome client objections and share alternatives to help improve alignment across Fidelity and our Clients.

Positive relationship building, interpersonal and influencing skills to stay in sync with team members across Fidelity.

Experience leading, influencing, and motivating colleagues without formal authority, and have a history of delivering extraordinary outcome for clients and the business.

The Value You Deliver

Ensure Fidelity's product offering remains aligned with industry regulations.

Support the success of continued Fidelity HSA account growth through bulk account opening solutions available to Workplace Clients.

Provide clear and timely follow-up to all client questions and concerns.

Define, refine, and communicate the progress of the initiative to Fidelity team members.

Discover and prioritize approach to client outreach which balances a positive client experience and timeliness of overall process.

Routinely engage Fidelity Legal, Risk and Compliance to discuss new account opening considerations, proposals and options requested by our Clients. Advocates for clients to ensure any novel solutions or exceptions follow industry regulations, are well-documented and are consistent with Fidelity policy & procedures.
Show less ",1,0.34,0.34
