"",Job Function,Industry,Seniority,Job Description,Segment,female,male
0,"General Business, Management, and Business Development",Entertainment Providers,Executive,"Every great story has a new beginning, and yours starts here.




Welcome to Warner Bros. Discovery... the stuff dreams are made of.




Who We Are...




When we say, ""the stuff dreams are made of,"" we're not just referring to the world of wizards, dragons and superheroes, or even to the wonders of Planet Earth. Behind WBD's vast portfolio of iconic content and beloved brands, are the storytellers bringing our characters to life, the creators bringing them to your living rooms and the dreamers creating what's next...




From brilliant creatives, to technology trailblazers, across the globe, WBD offers career defining opportunities, thoughtfully curated benefits, and the tools to explore and grow into your best selves. Here you are supported, here you are celebrated, here you can thrive.




Your New Role




Warner Bros. Discovery seeks a People & Culture Business Partner to support production across the Animation groups.




The Production People & Culture team provides hands-on People & Culture support to cast and crew working on productions across Warner Bros. Discovery content businesses. The People & Culture Partners on the Production People & Culture team will work primarily in production environments directly supporting the people that make our content. The goal is t o be a recognizable and trusted P&C Partner to all personnel working on a Warner Bros. Discovery production. As a trusted P&C Partner to production, the main objective is to ensure and support a respectful, inclusive, safe, and positive work environment, allowing people to thrive and do their best work.




Your Role Accountabilities




Initial People & Culture point of contact for production cast and crew; serves as on-set/on-site People & culture presence for productions, both locally and on distant location.
Responds to production-related inquiries regarding crew/cast concerns.
Provides advice, coaching, counseling, and training to proactively create/maintain an inclusive, respectful, and safe work environment.
Assesses production training needs and works with Production Learning to provide recommended training resources and sessions to cast and crew.
Embodies our culture through behavior and interactions, and champions inclusion and diversity on the set.
Conducts surveys to gauge cultural climate and makes recommendations for appropriate action based on findings.
Partners with People Relations, Labor Relations and Employment Legal to deliver People & Culture solutions on people related issues.
Partners with Safety and COVID Compliance Officers to support COVID policies and protocols, including tracking and tracing.
Keeps abreast of People & Culture trends/practices, legislation, and requirements to effectively manage and communicate to production workers.
Travels to productions on location when needed; last minute travel may be required.
Creates presentation decks, charts, graphs, and various materials, as needed.
Manages special projects, as assigned.




Qualifications & Experience




A Bachelor's Degree within a related field, preferred.
A minimum of 6 years of experience within Human Resources, preferably in a generalist, employee relations or training role, or a combination of the three.
Experience working in a television and/or film production environment, is highly desirable.
A collaborative leadership style with the ability to influence others into action and to think creatively about solutions.
Able to work independently and as part of a collaborative team.
Current knowledge of applicable federal and local legislation and regulations pertinent to production. populations, ensuring compliance.
High ethical standards with demonstrated experience handling highly sensitive information.
Passion for this business; driven to accomplish and meet objectives.
Ability to travel - 25% of the role.




The ideal candidate will be flexible, focused, with a 'can-do' attitude and the ability to thrive in a fast-growing and fast-paced challenging environment. They will have a collaborative leadership style with the ability to build relationships with cast and crew and influence others into action and to think creatively about solutions. They should be confident in communicating with all levels of production personnel, including, Producers, Directors, and high-profile cast.




How We Get Things Done...




This last bit is probably the most important! Here at WBD, our guiding principles are the core values by which we operate and are central to how we get things done. You can find them at www.wbd.com/guiding-principles/ along with some insights from the team on what they mean and how they show up in their day to day. We hope they resonate with you and look forward to discussing them during your interview.




The Legal Bits...




In compliance with local law, we are disclosing the compensation, or a range thereof, for roles in locations where legally required. $72,240.00 - $134,160.00 salary per year. Other rewards may include annual bonuses, short- and long-term incentives, and program-specific awards. In addition, Warner Bros. Discovery provides a variety of benefits to employees, including health insurance coverage, an employee wellness program, life and disability insurance, a retirement savings plan, paid holidays and paid time off (PTO).




Warner Bros. Discovery embraces the opportunity to build a workforce that reflects the diversity of our society and the world around us. Being an equal opportunity employer means that we take seriously our responsibility to consider qualified candidates on the basis of merit, without regard to race, color, religion, national origin, gender, sexual orientation, gender identity or expression, age, mental or physical disability, and genetic information, marital status, citizenship status, military status, protected veteran status or any other category protected by law.




If you're a qualified candidate with a disability and you need a reasonable accommodation in order to apply for this position, please contact us at recruitadmin@wbd.com.
Show less ",1,0,0.78
1,Human Resources,Medical Practices,Executive,"Overview

Dental Care Alliance is currently seeking dynamic leader on the forefront of Training & Development.  The ideal candidate will re-energize our programming to promote individual learning, development and engagement, while creating an environment that fosters the skill -building to ensure we positively impact the patient experience and drive business results. We are seeking a passionate people leader with a history of creating a culture of learning and development in a growing organization.  The Vice President is responsible for providing leadership and executing strategy in achieving DCA brand promise.

Responsibilities

Analyze the learning needs and assess skills gaps in the organization to refresh our learning strategy, update current programming , and ensure our training objectives align with organizational KPI's.
Plan, develop, and provide training and staff development programs, utilizing the latest industry trends, delivery methods and technologies.
Develop and organize training collateral , multimedia visual aids, and other educational materials.
Develop testing and evaluation procedures to ensure employees are adequately learning the desired lesson and skills.
Collaborate with Senior Leaders to support the organization’s values and company culture and embed them in critical organizational processes.
Will mentor, coach and provide guidance to support the learning objectives of the organization.
Will integrate new learning technologies into the organization.
Other duties as consistent with this role.

Work Environment

This candidate will operate remotely in their home office , or work on-site in our Sarasota, Florida Support Center.

Physical Demands

The physical demands described here are representative of those that must be met by an employee to successfully perform the essential functions of this job. While performing the duties of this job, the employee is regularly required to talk or hear . The employee frequently is required to stand; walk; use hands to finger, handle or feel; and reach with hands and arms. This position requires 30% - 40% travel. This position requires the ability to occasionally lift products and supplies, up to 20 pounds.

Competencies

Managing Change – Demonstrate support for innovation and for organizational changes to improve region’s success. Establish structures and processes to plan and manage implementation of change.
Strategic Mindset – Seeing ahead to future possibilities and translating them into breakthrough strategies. Anticipate future trends and implications accurately. Creates competitive strategies that show a clear connection between vision and action.
Attention to Communication – Ensure important information is shared with area and/or office managers as appropriate. Keep Regional VP informed about progress and problems to avoid surprises. Ensure regular and consistent communication takes place through multiple channels ( i.e. oral, written, etc.)
Manages Complexity – Making sense of complex, high quality and sometimes contradictory information to effectively solve problems. Acquires data from multiple and diverse sources when solving problems. Evaluates pros and cons, risks and benefits of different solution potions.
Forward Thinking – Ability to anticipate implications and consequences of situations and take appropriate action. Notice trends in the industry and develop plans to prepare for opportunities or problems.
Plans & Aligns – Planning and prioritizing work to meet commitments aligned with organizational goals. Sets objectives to align with broader organizational goals. Anticipates and adjusts effective contingency plans.
Communicates Effectively – Developing and delivering multi-mode communications that convey a clear understanding of the unique needs of different audiences. It is effective in a variety of communication settings: one-on-one, small and large groups or amount diverse styles and position levels. Provides timely and helpful information to others across the organization.
Action Oriented – Taking on new opportunities and tough challenges with a sense of urgency, and enthusiasm. Identifies and seizes new opportunities.
Collaborates – Building partnerships and working collaboratively with others to meet shared objectives. Partners with others to get work done. Gains trust and support of others

Qualifications

Qualifications/ Training:

Bachelor’s degree required; Master's related field preferred.
Training and development certifications, SHRM, Talent Development
7 years of experience in training and development required.
DDI, SHRM, AIHR, ICP-AHR, CPTM, COLF, APTD or other Talent Development/Training Certifications highly preferred
Dentistry or health-care experience preferred.
Experience in creating strong partnerships with leaders and the ability to influence without authority
Superior process improvement skills.
Ability to engage, internally and externally.
Excellent communication skills, including the confidence to engage with executive level audiences.
Show less ",1,0,0.15
2,Management and Manufacturing,Advertising Services,Executive,"The Company




ColorArt LLC, a Marketing.com company, is one of the nation's premier print and digital marketing groups. With more than 30 production facilities in the US and Canada (and growing!), we provide comprehensive digital marketing services, commercial printing, warehousing & fulfillment, direct mail marketing, sign manufacturing & fabrication, and promotional products.




We are expanding at warp speed and are adding to our team – from our sales office and shop floor locations to our remote online team members. We are a diverse, creative, and passionate crew who is always looking to discover and implement fresh, innovative ideas and make some pretty amazing things.




Job Summary




The Regional Vice President of Operations is responsible for strategically partnering with Leadership and overseeing department operations within a Region, ensuring efficiency at all times. This individual will be responsible for participating in creating the Company's Vision, Mission, and Goals, and implementing them in the areas where they are assigned.




The Regional Vice President of Operations is accountable for setting budgets and plans, forecasts, devising strategies to boost sales, and evaluating facility and department performances. As the Regional Vice President, they must monitor all business’s growth and progress in their region, encouraging them to reach new heights.




The Regional Vice President of Operations is responsible for upholding the profitability and values of the Company by leading business operations. These duties include consulting with Senior Leadership Personnel to determine business goals or initiatives, visiting with Directors or Department Managers to relay information about company needs and reviewing operational data to evaluate organizational performance and implementing actions to improve performance.




The Regional Vice President of Operations will report directly to the Chief Operating Officer and may serve as a liaison between the Chief Operating Officer and Mid-Management Leaders.




Roles And Responsibilities




Leading the Site Leaders and teams and operations of the Company.
Budgeting for multiple projects, including monitoring and controlling costs.
Work closely with Human Resources to implement and refine company policies and procedures.
Guiding, directing and evaluating the work of management and executive team members
Creating and implementing a strategic plan
Leveraging company output to improve ranking in the competitive field
Tackling unforeseen issues and troubleshooting
Representing the company for external and internal events
Monitoring the competitive landscape and attending industry events to stay abreast of new initiatives and ways to stay ahead
Identifying, training and developing leaders within the company and setting them on a path for management.
Assisting with Acquisition integrations to drive optimal efficiency




Basic Qualifications




Bachelor’s or master’s degree in business administration and/or company’s industry.
Excellent interpersonal and public speaking skills.
10 to 15 years of managerial experience.
Proven strategic planning and budgeting experience.
Demonstrated experience setting, monitoring and meeting quarterly and annual goals.
Experience building and scaling teams and systems.
Problem-solving skills.
An entrepreneurial spirit.




Preferred Skills




As a Senior Leader, the Regional Vice President of Operations will have a minimum of 10 years of experience as a Manager. Additionally, Excellent Public Speaking and Communication Skills along with a Professional Appearance and Demeanor are critical for this role.




Our Company offers a competitive salary and comprehensive benefits package including but not limited to medical, dental, vision, life insurance, short & long-term disability, 401k, PTO, and Company-paid holidays.




We’re an equal opportunity employer. All applicants will be considered for employment without attention to race, color, religion, sex, sexual orientation, gender identity, national origin, veteran or disability status.




Show less ",1,0,0.18
3,Management and Manufacturing,Advertising Services,Executive,"The Company




ColorArt LLC, a Marketing.com company, is one of the nation's premier print and digital marketing groups. With more than 30 production facilities in the US and Canada (and growing!), we provide comprehensive digital marketing services, commercial printing, warehousing & fulfillment, direct mail marketing, sign manufacturing & fabrication, and promotional products.




We are expanding at warp speed and are adding to our team – from our sales office and shop floor locations to our remote online team members. We are a diverse, creative, and passionate crew who is always looking to discover and implement fresh, innovative ideas and make some pretty amazing things.




Job Summary




The Regional Vice President of Operations is responsible for strategically partnering with Leadership and overseeing department operations within a Region, ensuring efficiency at all times. This individual will be responsible for participating in creating the Company's Vision, Mission, and Goals, and implementing them in the areas where they are assigned.




The Regional Vice President of Operations is accountable for setting budgets and plans, forecasts, devising strategies to boost sales, and evaluating facility and department performances. As the Regional Vice President, they must monitor all business’s growth and progress in their region, encouraging them to reach new heights.




The Regional Vice President of Operations is responsible for upholding the profitability and values of the Company by leading business operations. These duties include consulting with Senior Leadership Personnel to determine business goals or initiatives, visiting with Directors or Department Managers to relay information about company needs and reviewing operational data to evaluate organizational performance and implementing actions to improve performance.




The Regional Vice President of Operations will report directly to the Chief Operating Officer and may serve as a liaison between the Chief Operating Officer and Mid-Management Leaders.




Roles And Responsibilities




Leading the Site Leaders and teams and operations of the Company.
Budgeting for multiple projects, including monitoring and controlling costs.
Work closely with Human Resources to implement and refine company policies and procedures.
Guiding, directing and evaluating the work of management and executive team members
Creating and implementing a strategic plan
Leveraging company output to improve ranking in the competitive field
Tackling unforeseen issues and troubleshooting
Representing the company for external and internal events
Monitoring the competitive landscape and attending industry events to stay abreast of new initiatives and ways to stay ahead
Identifying, training and developing leaders within the company and setting them on a path for management.
Assisting with Acquisition integrations to drive optimal efficiency




Basic Qualifications




Bachelor’s or master’s degree in business administration and/or company’s industry.
Excellent interpersonal and public speaking skills.
10 to 15 years of managerial experience.
Proven strategic planning and budgeting experience.
Demonstrated experience setting, monitoring and meeting quarterly and annual goals.
Experience building and scaling teams and systems.
Problem-solving skills.
An entrepreneurial spirit.




Preferred Skills




As a Senior Leader, the Regional Vice President of Operations will have a minimum of 10 years of experience as a Manager. Additionally, Excellent Public Speaking and Communication Skills along with a Professional Appearance and Demeanor are critical for this role.




Our Company offers a competitive salary and comprehensive benefits package including but not limited to medical, dental, vision, life insurance, short & long-term disability, 401k, PTO, and Company-paid holidays.




We’re an equal opportunity employer. All applicants will be considered for employment without attention to race, color, religion, sex, sexual orientation, gender identity, national origin, veteran or disability status.




Show less ",1,0,0.18
4,Management and Manufacturing,Advertising Services,Executive,"The Company




ColorArt LLC, a Marketing.com company, is one of the nation's premier print and digital marketing groups. With more than 30 production facilities in the US and Canada (and growing!), we provide comprehensive digital marketing services, commercial printing, warehousing & fulfillment, direct mail marketing, sign manufacturing & fabrication, and promotional products.




We are expanding at warp speed and are adding to our team – from our sales office and shop floor locations to our remote online team members. We are a diverse, creative, and passionate crew who is always looking to discover and implement fresh, innovative ideas and make some pretty amazing things.




Job Summary




The Regional Vice President of Operations is responsible for strategically partnering with Leadership and overseeing department operations within a Region, ensuring efficiency at all times. This individual will be responsible for participating in creating the Company's Vision, Mission, and Goals, and implementing them in the areas where they are assigned.




The Regional Vice President of Operations is accountable for setting budgets and plans, forecasts, devising strategies to boost sales, and evaluating facility and department performances. As the Regional Vice President, they must monitor all business’s growth and progress in their region, encouraging them to reach new heights.




The Regional Vice President of Operations is responsible for upholding the profitability and values of the Company by leading business operations. These duties include consulting with Senior Leadership Personnel to determine business goals or initiatives, visiting with Directors or Department Managers to relay information about company needs and reviewing operational data to evaluate organizational performance and implementing actions to improve performance.




The Regional Vice President of Operations will report directly to the Chief Operating Officer and may serve as a liaison between the Chief Operating Officer and Mid-Management Leaders.




Roles And Responsibilities




Leading the Site Leaders and teams and operations of the Company.
Budgeting for multiple projects, including monitoring and controlling costs.
Work closely with Human Resources to implement and refine company policies and procedures.
Guiding, directing and evaluating the work of management and executive team members
Creating and implementing a strategic plan
Leveraging company output to improve ranking in the competitive field
Tackling unforeseen issues and troubleshooting
Representing the company for external and internal events
Monitoring the competitive landscape and attending industry events to stay abreast of new initiatives and ways to stay ahead
Identifying, training and developing leaders within the company and setting them on a path for management.
Assisting with Acquisition integrations to drive optimal efficiency




Basic Qualifications




Bachelor’s or master’s degree in business administration and/or company’s industry.
Excellent interpersonal and public speaking skills.
10 to 15 years of managerial experience.
Proven strategic planning and budgeting experience.
Demonstrated experience setting, monitoring and meeting quarterly and annual goals.
Experience building and scaling teams and systems.
Problem-solving skills.
An entrepreneurial spirit.




Preferred Skills




As a Senior Leader, the Regional Vice President of Operations will have a minimum of 10 years of experience as a Manager. Additionally, Excellent Public Speaking and Communication Skills along with a Professional Appearance and Demeanor are critical for this role.




Our Company offers a competitive salary and comprehensive benefits package including but not limited to medical, dental, vision, life insurance, short & long-term disability, 401k, PTO, and Company-paid holidays.




We’re an equal opportunity employer. All applicants will be considered for employment without attention to race, color, religion, sex, sexual orientation, gender identity, national origin, veteran or disability status.




Show less ",1,0,0.18
5,"Other, Information Technology, and Management",IT Services and IT Consulting,Executive,"Description




Contractor will provide heavy industrial services such as manual receiving of trailers at International DC (IDC) locations and building pallets of large items such as patio furniture and TV’s and Air Conditioners that require intense physical effort and may involve operation of MHE(Material Handling Equipment).




MHE may include manual or electric pallet jack.




This will typically require familiarity with a warehouse or distribution environment, ability to operate a pallet jack and ability to lift to 75 pounds, and good reading, writing, and communication skills.




May be sent home early on occasion depending on volume of workload .
Show less ",1,0,0
