"",Job Function,Industry,Seniority,Job Description,Segment,female,male
25,Information Technology,Government Administration,Executive,"Summary This position is located in the Department of Health and Human Services (DHHS), Administration for Children and Families (ACF), Office of Administration (OA), Office of the Chief Information Officer (OCIO). The mission of ACF focuses on improving the effectiveness and efficiency of programs designed to make measurable improvements in the economic and social well-being of children and families. Responsibilities ABOUT THE POSITION The CIO ensures IT governance and compliance are consistent and aligned with statutory, legislative and executive orders, in addition to agency directives, defines policy for existing and future technologies and their implications in support of the mission. Establishes high-level partnerships and collaborates with top agency officials, stakeholders from government agencies, private industry personnel and other customers to discuss and determine how to improve the quality of IT services. Transforms IT service delivery models to drive efficiency, lead strategic IT governance, and achieve goals by fostering innovation, prioritizing IT initiatives, and coordinating the deployment, management and IT systems across the organization. The CIO approves, prioritizes, and controls IT projects in relation to the selection, acquisition, development, and installation of major information systems. Assess and communicate risks associated with IT investments, while keeping current with trends and issues in the IT industry. Effectively define the scope of IT requirements and is responsible for ensuring the satisfaction for deliverables. Manages all IT systems to ensure compliance with the regulatory mandates of CISA, FISMA and FITARA on Cybersecurity. Requirements Conditions of Employment Qualifications Open to Federal Civil Service Status Candidates, Current SES and SES Reinstatement Eligibles, and SESCDP Graduates. SESCDP graduate candidates may also apply for noncompetitive consideration if applicable. As a basic requirement, applicants must demonstrate progressively responsible leadership experience that is indicative of senior executive level managerial capability and directly related to the skills and abilities outlined under the Mandatory Technical Qualifications and Executive Core Qualifications listed below. Typically, experience of this nature will have been gained at or above the equivalent of the GS-15 or its equivalent with state and local government, the private sector, or non-governmental organizations. Failure to meet this basic qualification requirement and all executive and technical qualification factors will automatically exclude you from further consideration. All candidates for SES positions with the Federal Government must demonstrate leadership experience indicative of senior executive level management capability. To meet the minimum qualification requirements for this position, you must show IN YOUR RESUME that you possess the Fundamental Competencies, Five Executive Core Qualifications (ECQs) and Job Specific Mandatory Technical Qualifications (MTQs) listed below. It is recommended that your resume emphasize levels of responsibility, scope and complexity of programs managed, and program accomplishments and results. Fundamental Competencies: Interpersonal Skills, Oral Communication, Integrity/Honesty, Written Communication, Continual Learning, and Public Service Motivation. Executive Core Qualifications (ECQs):




Leading Change: The ability to bring about strategic change, both within and outside the organization, to meet organizational goals. Inherent to this ECQ is the ability to establish an organizational vision and to implement it in a continuously changing environment.
Leading People: The ability to lead people toward meeting the organization's vision, mission, and goals. Inherent to this ECQ is the ability to provide an inclusive workplace that fosters the development of others, facilitates cooperation and teamwork, and supports constructive resolution of conflicts.
Results Driven: The ability to meet organizational goals and customer expectations. Inherent to this ECQ is the ability to make decisions that produce high-quality results by applying technical knowledge, analyzing problems, and calculating risks.
Business Acumen: The ability to manage human, financial, and information resources strategically.
Building Coalitions: The ability to build coalitions internally and with other Federal agencies, State and local governments, nonprofit and private sector organizations, foreign governments, or international organizations to achieve common goals. Mandatory Technical Qualifications (MTQs) This position also requires that you possess MTQs that represent knowledge, skills, and abilities essential for success in this role.
Demonstrated experience leading a complex IT organization and providing expertise in strategic planning, enterprise architecture, IT capital planning and investment control, IT governance, audit management, and meeting federal IT requirements and regulations.
Experience developing and communicating IT guidance and strategies to a wide variety of internal and external stakeholders, and engaging customers to obtain buy-in and financial and implementation support.
Expert knowledge of current and emerging trends in information technology, innovation, and data management to solve complex problems, improve operations, enhance services provided, and transform business processes.
Experience leading in a fast paced, crisis-prone environment, and deploying employee engagement strategies that heighten morale, collaboration and commitment to diversity, equity, inclusion, and accessibility (DEIA). It is STRONGLY recommended that you visit the following Office of Personnel Management (OPM) webpage for more information regarding the Fundamental Competencies and ECQs. https://www.opm.gov/policy-data-oversight/senior-executive-service/executive-core-qualifications/#url=Overview IF SELECTED, you will be required to complete an ECQ package by drafting narratives for each of the ECQs and be certified by an OPM Qualifications Review Board (QRB) in order to be placed in this position. If you are currently serving in a career SES appointment, are eligible for reinstatement into the SES, or have successfully completed an SES Candidate Development Program approved by the Office of Personnel Management (OPM), you WILL NOT need to draft the ECQs. Education This job does not have an education qualification requirement. Additional Information HHS has a critical preparedness and response mission: HHS protects the American people from health threats, researches emerging diseases, and mobilizes public health programs with domestic and international partners. In support of this mission, HHS offers its employees the opportunity to volunteer to become Federal Civilian Detailees and contribute their unique skills through voluntary temporary assignments to humanitarian emergencies or Departmental priorities countering new and emerging health, safety, and security threats. Salary for Senior Executive Service positions varies depending on qualifications. The annual salary range may be found at the top of this announcement. This position may be eligible for performance bonuses and performance based pay adjustments. Probationary Period: Selectee must serve a one-year probationary period unless previously completed one year the Senior Executive Service. Standards of Conduct/Financial Disclosure HHS inspires public confidence by maintaining high ethical principles, and all Federal Government employees are subject to the conflict of interest statutes and regulations, including the Standards of Ethical Conduct, that govern activities with outside organizations and reporting financial holdings. The Ethics in Government Act, PL 95-521 also requires the applicant selected for this position to submit a Public Financial Disclosure Report, OGE-278, prior to assuming the SES position, annually, and upon termination of employment. Security and Background Requirements If not previously completed, a background security investigation will be required for all appointees. Equal Opportunity Employment Equality is held as one of the most important values at HHS. Selection for this, and any other position, will be based solely on merit. HHS does not discriminate based on race, color, religion, sex, national origin, political affiliation, marital status, sexual orientation, physical or mental disability, age or membership or non-membership in an employee organization, or any other non-merit factors. If applying online poses a hardship to you, you may submit your application by contacting the HR Specialist listed at the end of the vacancy. Reasonable Accommodation Policy Statement Federal agencies must provide reasonable accommodation to applicants with disabilities where appropriate. Applicants requiring reasonable accommodation for any part of the application and hiring process should contact the HR Specialist listed at the end of the vacancy. Requests for reasonable accommodation will be made on a case-by-case basis. Veteran's Preference Veteran's Preference does not apply to the SES. Selective Service As a condition of employment, all male applicants born after December 31, 1959, must have registered for the selective service. If selected for this position, the applicant must sign a statement certifying his registration, or the applicant must demonstrate exempt status under the Selective Service Law.
Show less ",1,0,0.15
26,Other,Internet Publishing,Executive,"Job Summary




The Director of People at this Confidential SaaS Company has/is:




10+ years of experience in HR (including 3+ years of recruiting experience) with a proven track record of scaling the People Operations function within a B2B SaaS or tech, high-growth company
Experience developing proactive people operations strategies, driving culture and values, retaining talent, and managing employee lifecycle
Strong knowledge on guiding talent acquisition, employee career growth, performance management, and developing policies
Cross-functional people leader with the ability to establish and maintain meaningful relations across various departments and serving as a key member of the leadership team reporting to the CEO
Location: Atlanta, GA - ideally open to 1-2 days in office




Powered by JazzHR




qlWHf1R8HU
Show less ",1,0,0
27,Marketing and Sales,Higher Education,Executive,"At CSUN we aspire to continually grow as an inclusive, cooperative community!




CSUN strives to be a destination workplace, where everyone understands that they belong to a community that is vital in advancing student success and providing exemplary service to all stakeholders. We foster an environment of success, both for our students and our employees. We have a relentless passion for celebrating diversity, equity, and inclusion as well as being an employer of choice. You will also have the opportunity to realize your own personal goals and be recognized for the work you do and enjoy the unique value the CSUN community can offer. As a leader you will have the opportunity to thrive in a community in which our leaders share common traits as identified in our Leadership Principles https://www.csun.edu/leadership-principles . If this sounds like you, you've come to the right place.




Responsibilities




The Deputy Director of Athletics / Chief Revenue Officer serves as a member of the Athletics Department senior leadership team, as the Chief Revenue Officer for Athletics, leads a comprehensive revenue generation program, and manages all aspects of the fundraising programs for Athletics. The incumbent oversees sponsorships, ticketing, Name Image Likeness (NIL), and alumni relations, and is responsible for the strategic development and execution of initiatives within these areas.




Serve on Athletics Department executive and senior staffs in the overall management of the department.
Represents department in absence of Athletics Director
As Athletics Department’s designated second in command, work with campus and community leaders on all Athletics Department related matters.
Provide high level strategic counsel to Athletics Director
Lead a comprehensive development program that supports Athletics’ strategic priorities.
As a leader, demonstrates a commitment to student success that is mission aligned with the university’s vision, values and priorities. Establishes an ethical and collegial work environment, promoting a collaborative, accountable and inclusive team. Encourages a courageous and resilient solution-oriented environment by participating in new opportunities to further the mission of the university. Participates in developing initiatives that further support the campus mission with a service-oriented and catalytic mind set. Strengthens employees by being communicative and a talent builder that develops team attributes, furthering departmental goals.
Performs other duties as assigned.
NOTE: To view the full position description including all of the required qualifications copy and paste this link into your browser: https://bit.ly/3EsvAj3




Qualifications




Equivalent to graduation from an accredited four-year college or university with a Bachelor's degree in a job-related field.
Equivalent to five (5) years of experience as a head coach or administrator in intercollegiate athletics; with three of the five years in a supervisory or management role desired.




Knowledge, Skills, Abilities & Leadership




Ability to demonstrate a strategic vision for the day-to-day operations of a growing athletics department; marketing and sports information/digital media.
Demonstrated success in cultivation and closure of major gifts or lead annual gifts from benefactors.
Ability and specialized skills to: possess initiative and self-motivation; have exceptional verbal and written communication skills; and possess superior interpersonal skills; work in a fast-paced, results-oriented, and structured environment; be a self-starter, organized, creative, energetic, and assertive, and possess the ability to maintain a high degree of confidentiality.
Self-motivated and well organized is strongly preferred.
Lead diverse teams to support the operational mission and vision of employers by fostering an ethical, inclusive and collegial work environment.
Demonstrated ability to support ongoing improvement through courageous, resilient, and catalytic leadership.
Lead varying initiatives through a collaborative, service-oriented and communicative approach.
Demonstrated commitment to employee development, recognition, and accountability to further operational goals.




Pay, Benefits, & Work Schedule




Salary is commensurate with knowledge, skills, and experience. The University offers excellent fringe benefits.
The anticipated HIRING RANGE: $145,000 - $165,000, dependent upon qualifications and experience.
The individual hired for this role will physically work on-campus in Northridge. This is not a telecommute position.




General Information




This position is a sensitive position as designated by the CSU.
A background check (including a criminal records check) must be completed satisfactorily. Failure to satisfactorily complete the background check may affect the application status of applicants or continued employment of current CSU employees who apply for the position.
The person holding this position may be considered a 'limited reporter' under the California Child Abuse and Neglect Reporting Act and is required to comply with the requirements set forth in CSU Executive Order 1083 as a condition of employment.
In accordance with the California State University (CSU) Out-of-State Employment Policy, the CSU is a state entity whose business operations reside within the State of California and prohibits hiring employees to perform CSU-related work outside of California.
Candidates should apply by completing the CSUN on-line application. To submit an application and for more detailed information on the application and hiring process, please visit this link: www.csun.edu/careers
Review and review of applications will continue until position is filled.
CSU requires faculty, staff, and students who are accessing campus facilities to be immunized against COVID-19 or declare a medical or religious exemption from doing so. Any candidates advanced in a currently open search process should be prepared to comply with this requirement. To learn more visit our Matadors Forward site: https://www.csun.edu/matadors-forward/faculty-and-staff-fall-guidelines




Equal Employment Opportunity




CSUN is an Equal Opportunity Employer and prohibits discrimination on the basis of race, color, ethnicity, religion, national origin, age, gender, gender identity/expression, sexual orientation, genetic information, medical condition, marital status, veteran status, and disability. Our nondiscrimination policy is set forth in CSU Executive Order 1096. Reasonable accommodations will be provided for applicants with disabilities who self-disclose by contacting Recruitment Services at 818-677-2101.
Show less ",1,0,0.11
28,Marketing and Sales,Higher Education,Executive,"Bradley University




Vice President for Marketing and Communications




Application materials must be submitted using WittKieffer’s candidate portal at https://candidateportal.wittkieffer.com/login Please do not apply through Bradley University.




Bradley University seeks a transformational, innovative leader to serve as its next Vice President for Marketing and Communications (VPMC). This individual is the university's chief marketing and client officer and is responsible for advancing its marketing, branding, communications, and the client experience. Key priorities for the VPMC will be to manage the complex interplay of marketing and recruiting strategies; create marketing strategies and plans to win market share, build the Bradley brand, and provide all constituents a best-in-class experience; and develop a forward-thinking plan for marketing that will include innovative technology, the best use of data, and exceptional communication to build awareness of Bradley’s mission and attract more students and engaged constituents.




The ideal candidate must have the ability to be a strategic thinker, bringing forth new, innovative, and creative ideas, while also embracing data with an ability to translate it into actionable ideas. This individual must be able to use all available information to understand Bradley’s many audiences and use that knowledge to review and provide feedback on creative campaigns, growth tactics, and the full client lifecycle journey to ensure the institution is delivering the right experience and message to the right audience at the right time.




Critical to success will be the VPMC’s ability to grasp, embrace, and greatly extend the mission of Bradley as a keystone institution that is dedicated to the community it serves – from prospective students to alumni to community partners. The ability to enroll students from varying backgrounds and experiences, including traditional, transfer, international, and adult learners, will be importance. Of equal significance, the VPMC will possess a deep and authentic commitment to the values of diversity, equity, access, and inclusion, including a proven record of advocacy for those who are traditionally marginalized and underrepresented in higher education. The successful candidate will be an exceptional member of a senior team that values collaboration, inclusivity, and transparency.




Located in the historic West Bluff neighborhood, Bradley University is a mid-sized, private university in Peoria, Illinois, and offers students the opportunities and resources of a larger university and the personal attention and exceptional learning experiences of a smaller university. The university has been ranked by U.S. News and World Report in the top 10 of ""Most Innovative"", ""Best Value"", and ""Best Undergraduate Teaching"" schools. Bradley enrolls nearly 6,000 students (approximately 4,600 undergrads, 380 graduate students on campus, and 900 graduate students online) and employs approximately 900 people. The university has an annual operating budget of $161 million and an endowment of $350 million. This individual will join Bradley as the university advances a refreshed vision and its new strategic plan, which were adopted in July 2021 under the leadership of President Stephen Standifird.




WittKieffer is assisting Bradley University in this search. Applications should include, as separate documents, a letter of interest addressing the themes in the profile, available at www.wittkieffer.com , and resume. Applications will be reviewed on a rolling basis and candidates are encouraged to submit materials at their earliest opportunity.




Nominations and inquiries can be directed to Ryan Crawford, Melissa Fincher, and Jenna Brumleve at BradleyVPMC@wittkieffer.com .




Bradley University is an Affirmative Action/Equal Opportunity Employer. The administration, faculty and staff are committed to attracting qualified candidates from underrepresented groups.




Application materials must be submitted using WittKieffer’s candidate portal at https://candidateportal.wittkieffer.com/login Please do not apply through Bradley University.
Show less ",1,0,0
