,Job Function,Industry,Seniority,Job Description
23,Administrative,"Technology, Information and Internet",Not Applicable,"Who We Are:

Ride Health removes the transportation barriers that keep our most vulnerable populations from accessing health care. Ride Health partners with healthcare organizations and transportation providers to strengthen enterprise transportation programs and drive intelligent transitions of care. We blend technology and data with a human approach to break down access barriers and solve some of the biggest transportation challenges that care coordinators, providers, and payers face. Our platform maps out each patient’s unique needs and preferences for the best ride experience across clinical and social needs, ensuring greater access, improved efficiencies, lower costs, and better outcomes.

Who We’re Hiring:

Our Ride Monitor Agents watch over rides as they are scheduled, assigned to providers, and move through the process of communicating with and transporting passengers with a variety of social, medical, and family needs. Ride Monitors use our proprietary platform, third-party transportation software like Uber and Lyft, and business technology like Zendesk (task management), Jira (project management), and Excel to track the progress and performance of our Transportation Providers, monitor the status and safety of our passengers, and make sure reporting to our vendors and clients is accurate.

This is a fully remote position where you can work from home and have a tremendous positive impact on behalf of elderly and medically challenged people.

Success in this position will require exceptional communication skills, creative problem solving, and the ability to identify patterns that allow us to improve the service we offer.

This is a part time position Monday - Friday, 1:00pm - 5:00pm Eastern Time.

Requirements

Responsibilities:

Monitor Ride Health system event tickets to ensure appropriate scheduling, proper assignment, timely performance, and successful conclusion of the tens of thousands of rides that we complete each month.
Identify patterns in the data to help us improve our service and processes.
Accurately update ride statuses through their lifecycle, using information from multiple sources.
Communicate with Transportation Providers to schedule and recover rides with unique needs.
Monitor internal communications channels to identify and manage escalated service opportunities
NOTE: Candidates must have internet speed of 10 mbps and ability to hard-wire in via ethernet as needed


Competencies:

High School Diploma, or equivalent.
Fluency with standard business tools, like Microsoft Office, Google Apps, and software based telephone systems.
Attention to detail and a drive to see projects through to completion with quality.
Excellent written and spoken communication skills.
Creativity and ability to think outside the box.
Willingness and ability to work on and support a remote team environment.
A sense of humor and positive attitude.


Benefits

Competitive compensation $16 - $18 per hour
Career advancement opportunities
Fully remote - skip the commute
Paid Time Off
401k retirement savings plan with 4% fully vested employer match right out of the gate


PLEASE NOTE: Because of healthcare privacy regulations, candidates must reside in the United States to perform this job. Candidates must be permanently authorized to work in the United States. We are unable to provide sponsorship at this time.

Ride Health complies with the United States Department of Homeland Security (U.S.Citizenship and Immigration Services) to verify the employment eligibility of all persons hired to work in the United States. The company will provide the Social Security Administration (SSA) and, if necessary, the Department of Homeland Security (DHS), with information from each new employee's Form I-9 to confirm work authorization. The company maintains full compliance with all regulations set forth by the law and will utilize E-Verify to assist in ensuring a legal workforce. All hiring and recruitment at Ride Health is handled with a valid ‘@ridehealth.com’ only. If you receive a message from the sender whose domain is not @ridehealth.com, please beware that those communications are not authorized or coming from Ride Health.
Show less "
24,,,,
25,Supply Chain,"Technology, Information and Internet",Not Applicable,"Position Summary:

Samsung SDS plays a leading role in the global logistics market with unique logistics services. With its innovative IT technology, SDS developed the integrated logistics solution called “Cello” in 2010, started its logistics business in 2012 and expanded its logistics business with Business Process Outsourcing.

We are looking for an Employee Relations Specialist who designs and administers human resources policies and procedures that pertain to employee relations. Researches and analyzes data pertaining to human resources. Helps develop and implement programs aimed at increasing employee satisfaction. Identifies and analyzes complex employee relations issues and possible resolutions.

To learn more about Samsung SDS America, Inc. please visit www.CelloLogistics.com.

Responsibilities:

Identify complex employee relations issues or concerns and recommends appropriate actions to address and resolve those issues
Provides guidance and makes recommendations to leaders related to disciplinary procedures, performance improvement plans and employee relations matters
Reviews initial complains, conducts investigations, recommends corrective action, and provides summary reports as appropriate
Maintains timely and accurate documentation of employee relations issues and incidents in case management tool
Communicate on all HR related announcements and notifications with employees
Use innovative communications methods and channels to engage and encourage employees
Supervise and evaluate the efficiency of communication strategies and tactics for continuous improvement
Advises managers and employees on internal process regarding employee relations issues, dispute resolution, interpretation, and application of policies
Coordinate and participate in organizational culture improvement activities through the company bulletin board (Common SDSA) and the company SNS
Establish and manage organizational culture improvement activities suitable for each workplace
Apply knowledge of government regulations, professional best practices to all employee relation related functions and responsibilities
Ensures compliance with federal and state regulations
Provide general HR assistance as requested by the management and manage ad hoc requests
Manage to execute annual SCI(Samsung Culture Index) survey and provides analysis and summary reports
Perform other duties as assigned


Requirements

General Qualifications

Strong interpersonal, oral, and written communication skills in dealing proactively with all levels of internal and external management, vendor, or agency personnel.
Ability to convince others including stakeholder leadership, managers, staff, and vendors with opposing views to accept/approve plans, regulatory needs, or project recommendations.
Ability to plan, organize, and prioritize multiple and simultaneous Human Resources related projects and programs in a changing corporate environment.
Ability to make professional presentations and to communicate in writing, through e-mails and reports, or orally, complex matters to employees and managements
Ability to lead, motivate, and direct the activities of other employees in order to achieve objectives, project schedules, and team goals and to complete assignments within established time frames and specifications.
Positive, service-oriented attitude
Excellent written, verbal communication skills and attention to details
Strong analytical, problem solving and decision making skills
Presentation skills/ Poise/ Maturity/ Discretion in handling sensitive/ Confidential issues
Ability to work well independently


Education / Experience required:

7+ years of HR-related experience required
B.A. in HR-related field preferred
Corporate HR experience preferred


Technical Skills required:

Fluent in Microsoft Office
English Fluency Reading/Writing/Speaking (Intermediate level or better)
Computer savvy – HRIS system experience needed
HR certification is preferred


Samsung SDS America, Inc. is an equal opportunity employer. All qualified applicants will receive consideration for employment without regard to age, race, color, religion, sex, sexual orientation, gender identity or expression, national origin, disability, status as a protected veteran, marital status, genetic information, medical condition, or any other characteristic protected by law.

Benefits

Benefits: Medical, Dental, Vision, Prescription, 401k, Paid Time Off (PTO)
Show less "
26,Education and Training,Internet Publishing,Mid-Senior level,"OUR MISSION: Our mission is to inspire and empower all young people to take control of their future.




OUR VISION: We envision a world where everyone has access to an equitable path to success.




PROGRAM DESIGN: RTS facilitates a variety of youth programs including after-school, summer camps, retreats, conferences and summer employment opportunities reaching thousands of young people throughout NYC each year. RTS emphasizes the youth development practice of the Circle of Courage in all our programs; creating an environment of Belonging, where young people can build their Independence, find and develop their Mastery skill, and practice Generosity in their communities. At the core of our programs are staff training strategies that enable our young professionals to develop extraordinarily meaningful relationships with the young people in their care who we call Our Future Leaders because that is what they all are.




PRIMARY FUNCTION: The primary functions of the Campus Director are threefold: i) to ensure that the RTS mission and vision of positive youth development is carried into practice at programs, ii) to ensure that program staff are clear on program goals, are given the direction and support they need to achieve those goals, are given regular and meaningful feedback on their work, are valued as employees, and are given multiple opportunities to grow and learn, and iii) to build and maintain positive relationships with all key stakeholders.




ORGANIZATIONAL ROLE:




Supervisor: Senior Program Director
Supervises: Elementary and Middle School Program
Hours: Fulltime, Monday – Friday (10am–6pm)
Location: Upper West Side
Compensation: $58,500 – $60,000 per year




RESPONSIILITIES:




Oversee Elementary and Middle School Program.
Manage program projects and contracts.
Develop, train, and supervise program staff.
Maintain program enrollment and monitor rate of participation.
Manage staff evaluation process and conduct mid-year and end-year evaluations.
Maintain positive relationships with all stakeholders such as school administration, participants, and parents.
Work with the Education Department to ensure age-appropriate and engaging programming.
Work with the Operations Department to ensure proper paperwork, licensing, staffing, and supply budgets.
Work with the Senior Program Director to manage logistics and quality of program.
Ensure program database is updated weekly such as attendance, work scope, program schedule, etc.
Must obtain W-07 Fire and Emergency Drill Conductor (citywide) certificate (sponsored by RTS) within initial weeks of employment.
Perform other related duties and responsibilities as requested by the Senior Program Director.




QUALIFICATIONS:




A degree in Education or related field.
At least three years of experience in supervision and program development.
At least five years of direct experience in youth related field operating programs.
Proficient in MS Word, Excel, Power Point, and Google Docs.
Great interpersonal skills and knowledge of DOH/DOE/DYCD regulations.




Powered by JazzHR




JtwEpFI32n
Show less "
27,,,,
28,Customer Service,"Technology, Information and Internet",Not Applicable,"El Encanto, A Belmond Hotel, has been meticulously restored to capture all the romance and glamour that endeared it to both the local Santa Barbara community and visitors alike. Ninety-two quintessential, California-styled suites and bungalows dot the lush, terraced grounds featuring seven-acres of gloriously landscaped gardens with sweeping views of Santa Barbara and the Pacific Ocean. Original architectural features have been lovingly restored, including the historic, trellis-lined Arbor and Lily Pond. Modern additions to the expansive outdoor zero-edge pool and a new beautifully appointed boutique spa enhance the journey for today’s luxury-seeking guest.

We are seeking an engaging Guest Service Agent to be responsible for the welcoming and departing of hotel guests in a courteously and efficient manner, processing payments according to establish hotel procedures, and providing information for any guest or visitor inquiry. It is important that confidentiality of guest and hotel information is protected and that reservation calls and inquiries directed to the hotel are handled in a warm and capable manner.

Requirements

This position requires a minimum of one year of related experience, preferably in a luxury hotel setting. This polished communication and clear decision maker must possess fluency in English. Any foreign language fluency such as Spanish, French, Japanese or German is a plus. Also required is the ability to provide legible communication and directions, strong attention to detail, the ability to remain stationary at assigned posts for extended periods of time, and the ability to work well under pressure for any walk-ins or departures within any given period of time. Must be proficient with math calculations. Computer experience with hotel software is a plus. Opera PMS is a strong plus.

Benefits

El Encanto offers a full array of benefits, including medical, dental and vision coverage. In addition, the company pays for basic life and AD&D as well as short term disability. Team members can choose additional coverage to include voluntary life/AD&D, spouse life/AD&D, dependent life, critical care, hospital indemnity, accident and flexible spending.

The Company offers paid time off, sick pay, a 401(k) program with Company matching, and an employee assistance program. Team members enjoy free cafeteria meals and discounts on food and beverage, spa treatments, and retail boutique items.

The Discovering Belmond program offers complimentary accommodation for team members while on leisure travel outside their region at any Belmond hotel and resort. It also offers food and beverage at a discounted rate. In addition to the complimentary offerings, discounted rates are available for safaris, trains and cruises.
Show less "
29,Engineering and Information Technology,Veterinary Services,Entry level,"The Virtual Care Technician acts as the direct contact for clients seeking advice and guidance through the “live chat” function within the myVCA mobile application. Virtual Care Technicians are responsible for providing an excellent experience to clients, making them feel valued and affirmed, and providing sound and relevant medical guidance. Technicians also help with other administrative-related queries. The position is part-time and available to credentialed veterinary technicians who have the time and ability to engage with clients, virtually, from home. Full-time hours may become available in the future.




Essential Responsibilities And Tasks




Receives and responds to live chats from VCA clients with questions or concerns about their pet utilizing professional, accurate and appropriate terminology when conversing with clients
Determines responses based on inquiries regarding the client concern or patient issue utilizing established decision support models
Obtains brief patient history and gathers triage information to determine and deliver appropriate medical guidance, makes recommendations on education or potential home care and timeframe on when/if an appointment should be made at a VCA hospital, and based on assessment, documents client / patient needs and medical considerations regarding the conversation to provide best-quality care if patient requires an in-hospital visit
When necessary, helps to field administrative client chats and responds to queries related to billing/invoicing, CareClub and other administrative topics
Seeks and communicates opportunities to provide better client service via live chat, with a passionate interest in delivering better client experiences and quality patient care
Attends team meetings or reviews the team meeting recording within 48 hours; team meetings occur multiple times per month. Reads emails pertaining to live chat protocols, scheduling, updates, etc. daily
Fulfill other related duties as assigned




Education/Experience




3+ years’ experience as CVT in a clinical setting with a proven track record of successful client interactions
Current and unrestricted license to practice as a credentialed veterinary technician in the state of practice; hired Virtual Care Technicians must maintain their credentialed status and remain in good standing with the national and state boards, as applicable
Basic computer skills
Ability to read, write, and speak English
Ability to work weekends, holidays, variable shifts




Preferred Skills And Qualifications




Bachelor’s Degree
Strong written communication skills
Ability to demonstrate empathy for and patience and understanding with clients under difficult circumstances
Comfort using technology and communicating clearly via text/chat messaging
Demonstrated passion for excellent client service and accurate, quality medical outcomes
Ability to make decisions independently, problem solve, and take the initiative
Comfort with autonomy
Ability to exercise self-discipline and accountability




Additional Information




[Required for CA, NY, WA, CO only]: Compensation is negotiable based on education, experience, and other relevant credentials. The US base salary range for this full-time position is $17.72 - $27.10 / hourly. Our salary ranges are determined by role, level, and location. Your recruiter can share more about the specific salary range for your preferred location during the hiring process. Please note that the compensation details listed in US role postings reflect the base salary only.




If you are a current associate, you need to apply through our internal career site. Please log into Workday and click on the Career worklet on the landing page or search for Find Jobs.




Benefits: We offer competitive compensation along with a comprehensive benefits package, including medical, dental, vision and paid vacation/sick days, 401(k), generous employee pet discounts and more!




The information in this position description indicates the general nature and level of work to be performed. It is not designed to be interpreted as a comprehensive inventory of all duties, responsibilities, and qualifications required of associates assigned to this job. Management reserves the right to revise the job description or require that other tasks be performed when the circumstances of the job change (for example, emergencies, change in personnel, workload, or technical development)




We are proud to be an Equal Opportunity Employer - Veterans / Disabled. For a complete EEO statement please see our career page at vcacareers.com
Show less "
