,Job Function,Industry,Seniority,Job Description
79,Management and Manufacturing,Retail Groceries,Entry level,"Join our Winning Team today and start your ownership journey!




WinCo Foods is a rapidly growing family of over 135 grocery stores, complete with our own distribution centers and transportation network. We’re proud to operate across 10 states west of the Rockies with more than 20,000 employee owners.




At WinCo Foods we act like owners – because we are! We believe, as the Low Price Grocery Leader, that we make the lives of the communities where we operate better by giving them the best possible prices to feed their families and by focusing on the success, well-being and diversity of our employee owners.




Currently, WinCo is the third largest Employee-Owned company in the United States. WinCo has more than 500 millionaire employee-owners in our Employee Stock Ownership Plan (ESOP). Once eligible, you can start your journey to ownership with an annual gift of stock equaling 20% of what you make each year. (ESOP available at most locations and subject to vesting)




WinCo Foods offers the very best benefits in the industry, with low cost, high quality medical benefits with rates as low as $40 a month, enrollment in our ESOP after 6 months, eligible for 6 paid holidays after 6 months, sick leave, and paid vacation after one year (amount based on hours worked), career advancement opportunities, competitive wages, employee assistance program, discount program – and even voluntary benefits like Pet Insurance!




Job Summary




Scales, mixes and bakes various bakery goods. Maintains proper inventory levels of products and ensures the cleanliness and appearance of the bakery department meets standards. Consistently provides friendly, courteous service to internal and external customers. Performs other related work.




Typical Duties And Responsibilities




Seeks opportunities to welcome, engage, serve and thank customers. Maintains an atmosphere of friendly, enthusiastic customer service with an emphasis of taking care of the customer.
Produce bakery products for retail stores.
Operate and clean equipment and work area. Maintains clean, safe and sanitary bakery area and equipment.
Package all fresh products following all packaging /handling procedures.
Ensure quality of goods by following code.
Mixes icing or other toppings by scaling and measuring ingredients, operating a mixer, reading the recipe, occasionally lifting 50 lbs. bags of sugar, shortening, and flour.
Dumps icing or other toppings into large storage containers.
Sets-up cakes by taking liner off, putting icing between layers of numerous items (i.e., 50 cakes at a time).
Ices cakes by taking icing out of the container, combining the icing onto the cake, lifting buckets, bordering, placing specific decorations, etc. for numerous items (i.e., 50 cakes at a time).
Packages cakes by placing in box.
Labels bakery items by inputting data into DiGi machine for scanning, placing a label on container, etc.
Displays products on shelves by placing them in an appealing manner and using FIFO for rotation.
Takes orders by phone and in person from customers. Special orders by following orders from customers; using an air brush machine, tubes, tips, etc.
Personalizes cakes by writing the desired words of the customer.
Faces merchandise.
Maintains an atmosphere of enthusiastic customer awareness with an emphasis on providing fast, friendly customer service.
Engages in suggestive selling and other sales techniques in person, over the telephone and over the in-store intercom.
Displays goods by following packaging/handling procedures. Follows company guidelines for setting up and maintaining stock, cleanliness and appeal of product show cases, display tables, and special displays; proper signing procedures, etc.
Assists customers with inquiries (i.e., special orders for cakes and other bakery items) by knowing current pricing, ingredients, availability of product, advertised merchandise, etc.
Ensures quality of goods by following code dating procedures and legal regulations or labeling and packaging for all in-store bakery products.
Ensures quantity of goods is available by keeping manager informed of stock levels, accurately filling out inventory and production sheets as scheduled.
Produce breads/rolls by mixing recipes. Setting up racks and pans, setting up machines, operating machines, lifting product, measuring ingredients, operating oven, proof box. Pushing and pulling racks.
Clean work area using pressure hose, floor brush, squeegee, wiping off all work tables, scales utensils.
Produce croissants. Folding by hand, proofing and baking.
Opens and closes bakery according to company procedures.
Performs other duties as assigned or needed.




Requirements




Ability to




Consistently provide friendly, courteous service to internal and external customers.
Work varied hours primarily between the hours of 300 am to 1000 pm in a 24/7 operation; including night, weekends and holidays. Pushing and pulling approximately 100 lb. of product at a time on rack.
Lift objects (i.e., mix) of various dimensions chest high up to 50 lbs.
Conduct visual inspections, read and follow production guides, recipes and product labels, log production quantities, temperature readings, etc. on proper forms.
Catch breads, put product onto trays for baking, operate kitchen utensils and equipment with manual dexterity and hand /eye coordination.
Maintain composure in dealing with customers and co-workers.
Reach overhead to place product on racks.
Stand, walk and move rapidly for extended periods of time.
Bend, stoop, balance, crouch, push, pull, lift, grasp, feel, perform repetitive movement, and reach frequently.
Handle bakery ingredients.
Perform basic math (add, subtract, divide and multiple) and compute weights and measures.
Perform duties with mental alertness involving potential hazards with respect to baking procedures, equipment, and work aides.
Respond to audible timers on baking equipment.
Perform around equipment and product emitting heat (approximately 465 degrees).
Follow safety and sanitation procedures and department policies. Use cleaning chemicals and handle related food products.
Perform primary duties with efficiency and accuracy. Effectively manage time to ensure that deadlines are met. Prioritize and perform a variety of simultaneous tasks (multi-tasking).
Wear hats, hairnets, gloves, and other personal protective equipment as required.
Check labels and packaging of all manufactured products.
Communicate (hearing & speech) effectively with customers to receive orders and perform customer relation skills.
Communicate in writing to others and read and follow instructions.
Work in a team-oriented, collaborative environment with a strong customer service orientation.
Operate kitchen utensils and equipment with manual dexterity, speed, accuracy and hand/eye coordination.
Demonstrate knowledge of product content and perishability, safety and sanitation procedures and department policies and government regulations.
Must be 18 years of age or older.




Additional Requirements




Food Handlers Certification (Per State Laws)




Machines and Equipment Operated




Ovens, proof box, mixers, bread sheeter, flour dump bins, floor scrubber, dishwasher, rack washer, pallet jack, microwave,20pt divider,36pt divider, donut filler unit, airbrush ,date gun, scan gun, and DIGI printer, label machine and ink jet printer.




The above statements are intended to describe the general nature of work performed by the employees assigned to this job. All employees must comply with Company policies and applicable laws. The responsibilities, duties and qualifications required of personnel may vary.




As WinCo Foods continues to grow, our diversity—from our variety of perspectives and wide range of experiences—is essential to our strategy and success. We are committed to continue to cultivate and celebrate an inclusive environment in which all employees are valued and respected regardless of their race, color, religion, sex, sexual orientation, gender identity, national origin, veteran, or disability status.
Show less "
80,Management and Manufacturing,Retail Groceries,Entry level,"Join our Winning Team today and start your ownership journey!




WinCo Foods is a rapidly growing family of over 135 grocery stores, complete with our own distribution centers and transportation network. We’re proud to operate across 10 states west of the Rockies with more than 20,000 employee owners.




At WinCo Foods we act like owners – because we are! We believe, as the Low Price Grocery Leader, that we make the lives of the communities where we operate better by giving them the best possible prices to feed their families and by focusing on the success, well-being and diversity of our employee owners.




Currently, WinCo is the third largest Employee-Owned company in the United States. WinCo has more than 500 millionaire employee-owners in our Employee Stock Ownership Plan (ESOP). Once eligible, you can start your journey to ownership with an annual gift of stock equaling 20% of what you make each year. (ESOP available at most locations and subject to vesting)




WinCo Foods offers the very best benefits in the industry, with low cost, high quality medical benefits with rates as low as $40 a month, enrollment in our ESOP after 6 months, eligible for 6 paid holidays after 6 months, sick leave, and paid vacation after one year (amount based on hours worked), career advancement opportunities, competitive wages, employee assistance program, discount program – and even voluntary benefits like Pet Insurance!




Job Summary




Scales, mixes and bakes various bakery goods. Maintains proper inventory levels of products and ensures the cleanliness and appearance of the bakery department meets standards. Consistently provides friendly, courteous service to internal and external customers. Performs other related work.




Typical Duties And Responsibilities




Seeks opportunities to welcome, engage, serve and thank customers. Maintains an atmosphere of friendly, enthusiastic customer service with an emphasis of taking care of the customer.
Produce bakery products for retail stores.
Operate and clean equipment and work area. Maintains clean, safe and sanitary bakery area and equipment.
Package all fresh products following all packaging /handling procedures.
Ensure quality of goods by following code.
Mixes icing or other toppings by scaling and measuring ingredients, operating a mixer, reading the recipe, occasionally lifting 50 lbs. bags of sugar, shortening, and flour.
Dumps icing or other toppings into large storage containers.
Sets-up cakes by taking liner off, putting icing between layers of numerous items (i.e., 50 cakes at a time).
Ices cakes by taking icing out of the container, combining the icing onto the cake, lifting buckets, bordering, placing specific decorations, etc. for numerous items (i.e., 50 cakes at a time).
Packages cakes by placing in box.
Labels bakery items by inputting data into DiGi machine for scanning, placing a label on container, etc.
Displays products on shelves by placing them in an appealing manner and using FIFO for rotation.
Takes orders by phone and in person from customers. Special orders by following orders from customers; using an air brush machine, tubes, tips, etc.
Personalizes cakes by writing the desired words of the customer.
Faces merchandise.
Maintains an atmosphere of enthusiastic customer awareness with an emphasis on providing fast, friendly customer service.
Engages in suggestive selling and other sales techniques in person, over the telephone and over the in-store intercom.
Displays goods by following packaging/handling procedures. Follows company guidelines for setting up and maintaining stock, cleanliness and appeal of product show cases, display tables, and special displays; proper signing procedures, etc.
Assists customers with inquiries (i.e., special orders for cakes and other bakery items) by knowing current pricing, ingredients, availability of product, advertised merchandise, etc.
Ensures quality of goods by following code dating procedures and legal regulations or labeling and packaging for all in-store bakery products.
Ensures quantity of goods is available by keeping manager informed of stock levels, accurately filling out inventory and production sheets as scheduled.
Produce breads/rolls by mixing recipes. Setting up racks and pans, setting up machines, operating machines, lifting product, measuring ingredients, operating oven, proof box. Pushing and pulling racks.
Clean work area using pressure hose, floor brush, squeegee, wiping off all work tables, scales utensils.
Produce croissants. Folding by hand, proofing and baking.
Opens and closes bakery according to company procedures.
Performs other duties as assigned or needed.




Requirements




Ability to




Consistently provide friendly, courteous service to internal and external customers.
Work varied hours primarily between the hours of 300 am to 1000 pm in a 24/7 operation; including night, weekends and holidays. Pushing and pulling approximately 100 lb. of product at a time on rack.
Lift objects (i.e., mix) of various dimensions chest high up to 50 lbs.
Conduct visual inspections, read and follow production guides, recipes and product labels, log production quantities, temperature readings, etc. on proper forms.
Catch breads, put product onto trays for baking, operate kitchen utensils and equipment with manual dexterity and hand /eye coordination.
Maintain composure in dealing with customers and co-workers.
Reach overhead to place product on racks.
Stand, walk and move rapidly for extended periods of time.
Bend, stoop, balance, crouch, push, pull, lift, grasp, feel, perform repetitive movement, and reach frequently.
Handle bakery ingredients.
Perform basic math (add, subtract, divide and multiple) and compute weights and measures.
Perform duties with mental alertness involving potential hazards with respect to baking procedures, equipment, and work aides.
Respond to audible timers on baking equipment.
Perform around equipment and product emitting heat (approximately 465 degrees).
Follow safety and sanitation procedures and department policies. Use cleaning chemicals and handle related food products.
Perform primary duties with efficiency and accuracy. Effectively manage time to ensure that deadlines are met. Prioritize and perform a variety of simultaneous tasks (multi-tasking).
Wear hats, hairnets, gloves, and other personal protective equipment as required.
Check labels and packaging of all manufactured products.
Communicate (hearing & speech) effectively with customers to receive orders and perform customer relation skills.
Communicate in writing to others and read and follow instructions.
Work in a team-oriented, collaborative environment with a strong customer service orientation.
Operate kitchen utensils and equipment with manual dexterity, speed, accuracy and hand/eye coordination.
Demonstrate knowledge of product content and perishability, safety and sanitation procedures and department policies and government regulations.
Must be 18 years of age or older.




Additional Requirements




Food Handlers Certification (Per State Laws)




Machines and Equipment Operated




Ovens, proof box, mixers, bread sheeter, flour dump bins, floor scrubber, dishwasher, rack washer, pallet jack, microwave,20pt divider,36pt divider, donut filler unit, airbrush ,date gun, scan gun, and DIGI printer, label machine and ink jet printer.




The above statements are intended to describe the general nature of work performed by the employees assigned to this job. All employees must comply with Company policies and applicable laws. The responsibilities, duties and qualifications required of personnel may vary.




As WinCo Foods continues to grow, our diversity—from our variety of perspectives and wide range of experiences—is essential to our strategy and success. We are committed to continue to cultivate and celebrate an inclusive environment in which all employees are valued and respected regardless of their race, color, religion, sex, sexual orientation, gender identity, national origin, veteran, or disability status.
Show less "
81,Human Resources,Wholesale,Mid-Senior level,"Job Details

Description

This position provides frontline, day-to-day support in administering human resources policies and programs covering a broad range of HR topics, including employee relations & support, training & development, benefits administration and HR initiatives to support business strategies.

Essential Functions/Primary Responsibilities

Coach and guide leaders on employee relations issues such as performance, employee concerns, and conflict resolution
Counsel employees on matters relating to their employment at the company
Assume lead investigative role for reported concerns, as well as corrective actions, and terminations
Assist in company annual and mid-year review process
Conduct benefit meetings with new hires and assist in Open Enrollment Process
Manage employee wellness program
Coordinate resolution of all benefit related employee issues
Assist in maintaining the company's compliance with various governmental regulations affecting employment (i.e., EEO, FLSA, ADA, etc.)
Assist in creating a curriculum to facilitate strategic training based on the organization’s goals and objectives
Plan and conduct in-house training classes that are job-specific and company-specific
Support company-sponsored employee events and programs (Company Newsletter, monthly engagement events, anniversary certificates)
Coordinate employee engagement surveys and assist in the development of action plans based on the results
Create onboarding procedures for all departments
Maintain and update New Hire Orientation for all new hires
Support and administer the onboarding processes of new employees and facilitate 30-60-90 day check-in surveys with employees after orientation
Conduct Exit Interviews and Stay Meetings
Manage worker’s compensation including completing paperwork related to claims and appeals
Act as recruiting and payroll backup when needed

Qualifications & Requirements

Bachelor's degree in Human Resources or Business related field
Minimum 3+ years experience in HR
Manufacturing background preferred
Show less "
82,Other,Retail,Mid-Senior level,"Job Details

Description

AT SHOE PALACE WE RUN. WE SELL. WE HAVE FUN! DO YOU HAVE WHAT IT TAKES?

The Role

Are you a natural leader? Do you like to help others be successful? The role of an AM is primarily based around leading your team to a successful day. You are on the front line ensuring every customer receives the best customer experience possible. Come grow with us!

Here’s what a day at work may look like…

Assist the manager in making sure your store operates at a high level
Take ownership while managing location
Evaluate employee performance and help coach to improve
Make sure customers are always receiving the ultimate experience
Learn and maintain up-to-date product knowledge
Keep a clean, neat, and organized store

About You…

18+ years old
Must have OPEN AVAILABILITY DURING THE WEEKENDS
Previous experience in retail, customer service, or other related fields
Be a dynamic and outgoing individual with leadership skills
Must be driven!
Does talking to everyone just come naturally? Awesome!

It would be great but not completely necessary to have...

Experience in selling Athletic Shoes a plus.
Experience working with a growing company

What We Bring To The Table…

Flexible schedule
You like discounts? We got you!
Growth!
Exciting work environment

Retail is not dead… come and see it!

Shoe Palace is one of the most-trusted athletic footwear and apparel retail chains in the United States. What began as a small, family business in 1993 has now grown into an extremely popular chain of stores and an online retail site — shoepalace.com.

At Shoe Palace, we all roll up our sleeves to pitch in and do whatever it takes to stay on top. Each day is a little different, it's what keeps us on our toes and excited to come to work every day.We are seeking self-motivated individuals who are dynamic thinkers and outstanding communicators who will thrive in an entrepreneurial environment and want to grow with Shoe Palace Corporation. Our team members are bright, professional, enthusiastic, and able to quickly apply their skills to diverse situations.
Show less "
83,Other,Retail,Entry level,"Overview




1st Shift Customer Service Enthusiasts Wanted!




We're looking for a hardworking, enthusiastic part-time team player who wants to be the heartbeat of a dynamic family-owned business.




Responsibilities




Why Blarney Castle? We’re the heartbeat of retail C-Store operations in Michigan! We’re family-owned and have grown up in Michigan since our founding in 1933. Today we’re delighted to have over 1,400 smart, experienced and fun team members across the state, all with one purpose in mind – building great customer experiences one person at a time. You can be a large part of that success by joining our team in this role!




Your Role As a customer service enthusiast, a.k.a Customer Service Associate, you’re the point person for ensuring an exceptional customer experience. You will be able to unlock your inner creativity by doing things like greeting customers and helping them with purchases, building product displays that entice customer engagement, and building your career as part of Michigan’s great C-Store team. You also get to contribute to a fun work environment along the way! You should also be prepared to stock shelves, exercise your basic math skills, handle cash and credit payments. keep the store clean and beautiful along with responsibly selling alcohol, tobacco and lottery products. Be ready to be flexible, because the business needs are always changing! Your role will be a fun and fast paced position, and if you enjoy these things we can’t wait to meet you!




Do We Have Benefits? You bet! Our part-time team members enjoy Dental and Vision insurance coverages. We also offer Tuition Assistance and our Employee Assistance Plan.




Your Skills You must be at least 18 years old, and be able to stand, bend, and reach along with occasionally lifting up to 50 lbs. We’re also going to look closely at your ability to communicate and build a relationship throughout the time we get to know one another.
Show less "
84,Administrative,Retail,Entry level,"Receptionist




Compensation $15-18/hour




The success of General RV Center is rooted in our exceptional team, which has been growing since 1962. Our sustained growth has been fueled by our family values and passion for the RV lifestyle. Today, General RV Center stands as the Nation’s Largest Family-Owned RV Dealer, with locations nationwide and a global presence through our Internet Sales team.




What’s in it for you? When you join our team, you become part of the General RV family. It’s more than a job – it’s the opportunity to build a career, make a difference, and be part of an exciting industry. If you’re looking for a place to call home, we want to hear from you!




Greet showroom customers and direct them to the appropriate department.
Answer incoming phone calls and manage the store multi-line phone system.
Input customer data into customer management system.
Provide customers with company information, store hours, and answer general questions.
Work directly with store management in controlling customer flow.
Conduct general administrative duties.
Other duties assigned by management.
High School Diploma or equivalent.
Prior office experience is a preferred.
Must have excellent organizational skills.
Able to work in a team setting in a fast-paced office environment .
Proficient working knowledge of Outlook and computers.
Strong communication skills, verbal and written.
Ability to multitask and complete tasks in a timely and efficient manner.
Reliable and strong work ethic. Professional appearance is a must.




PERKS




General RV offers a comprehensive benefits package that includes medical, dental, vision, life insurance options, paid vacations and a 401k with company matching.




About General RV




General RV was founded when Abe Baidas converted a Detroit gas station into a small RV sales and manufacturing facility in 1962. From those humble roots, we’ve grown into the nation’s premier RV dealer. We’ve helped millions of families experience the RV lifestyle. With the support of our talented employees, General RV now operates fourteen Supercenters in seven states in addition to an inspection facility in Indiana. We are proud of our history and are now in the third generation of family ownership. Since 2014, General RV Center has been named by Crain's Detroit as one of Michigan's largest and fastest growing privately held companies.




#IND3
Show less "
