"",Job Function,Industry,Job Description,Segment,female,male
71,Science,Research Services and Biotechnology Research,"Job Description

A leading Biotech company is actively seeking a motivated candidate to fill their remote Sourcing Specialist role. The role is an initial 6-month contract with opportunity to extend/ convert to FTE.

Primary activities for this position include support for the Pharmaceutical & Preclinical Sciences category spend, contract management (negotiations, execution, and processing of purchasing requisitions/orders), market analysis, RFx development, negotiation planning, cost analysis, and support category strategy implementation activities.







Requirements

Bachelor’s degree from 4-year College or University.
2-3 Years of specific Procurement or Sourcing experience in R&D spend categories, ideally within a biotech environment.
Solid understanding of basic Strategic Sourcing process steps and contracting process; ideally with 1-3 years of past experience in a Sourcing and/or Sourcing Analyst role.
Proficient in Microsoft Office, working knowledge of ERP systems, and sourcing tools Proven negotiation and supplier management skills.
Strong analytical capabilities (data analysis and benchmarking research) as well as PowerPoint skills (generate compelling and powerful presentations).
Basic understanding of Continuous Improvement tools (including Pareto Charts, Flow Diagrams, etc.).







Responsibilities

Drafting and negotiation of various agreements (service agreements, confidentially agreement, project statements/work orders, consulting agreements, etc.).
Processing purchasing requisitions/orders and providing backend support as needed.
Support specific sourcing activities, including but not limited to, RFx documentation, compilation of supplier inputs, and high-level analysis of results.
Define and implement sourcing strategies for the Research subcategory portfolio and will work on delivering cost reductions for spend areas such as lab supplies, capital equipment, vivarium, global CRO services/FTE outsourcing and similar Research-related subcategories.
Support the Supplier Performance/Relationship Management process for Research Category.







*If you think you are right for this role please apply with an up to date CV*

Show less ",1,0,0.35
72,Marketing and Sales,Hospitals and Health Care,"Are you ready to be part of our team of superstars? We are looking for a passionate Digital Marketing Intern to join our growing Marketing Team at Hudson Health.

About Hudson Health

Hudson Health (Medical + Wellness + Mind + Life), formerly Hudson Medical Group was established in 2010 as a modern, fully-integrated medical practice that offers a diverse ecosystem of cutting-edge treatments across pain management, functional medicine, wellness, interventional mental health, and regenerative medicine. Unique in its east- meets-west approach to healing, Hudson Health creates an experiential and holistic healing journey for each patient in its Tribeca and West Village locations. Our team of dedicated board-certified doctors and wellness providers bring expertise in 10+ diverse specialties. Our practitioners work collaboratively to tailor comprehensive treatment plans based on The Hudson Method, a care algorithm that has been perfected over the course of 12+ years treating 50K patients.

Requirements

Requirement:

Hudson Health is currently seeking a passionate and tenacious Marketing Intern to assist in managing all cross-functional marketing initiatives. S/He will assist the Marketing Team with the execution and performance optimization of Hudson Health's marketing strategy and programs. The Marketing Intern will work with team members to assist in the development of the marketing calendar, content creation and metrics reporting. The ideal candidate is passionate about marketing and healthcare, is both creative and data-driven, and ideally has both marketing and healthcare industry experience.

Responsibilities

Collect quantitative and qualitative data from marketing campaigns

Perform market analysis and research on competition

Analyze consumer insights to help plan effective social media marketing campaigns

Optimize postings for SEO and keyword analysis, maximizing clicks to drive consumers to website

Staying informed on industry trends, competitive landscapes and new technologies impacting digital marketing

Identifying trends and opportunities, as well as translating analysis into actionable plans

Work with the team to manage day-to-day marketing activities (content creation, email, banner ads) and analyze campaign effectiveness; lead competitive intelligence and analysis

Support the marketing team in daily administrative tasks

Provide support to community engagement events

Desired Experience

Previous internship in marketing or content creation

Experience with Google Ads (previously Google AdWords) and other digital advertising platforms a big plus

Interest in Digital, Integrated and Content Marketing preferred

Desired Skills

Highly motivated team player with outstanding organizational and problem-solving ability

Proven ability to communicate and collaborate effectively across teams

Creative and resourceful problem solver with strong attention to detail

Ability to work independently with little direction when required

Strong written and verbal communication skills

Ability to commit part-time or full-time

Education/Certification

Pursuing a Bachelor’s Degree in marketing, advertisement or another related field

College credit available

If you are ready to apply, please send your resume and application to (url removed). We look forward to receiving your application.
Show less ",1,0,0.44
73,Management and Manufacturing,Hospitals and Health Care,"About Us

At Cooper University Health Care, our commitment to providing extraordinary health care begins with our team. Our extraordinary professionals are continuously discovering clinical innovations and enhanced access to the most up-to-date facilities, equipment, technologies and research protocols. We have a commitment to its employees by providing competitive rates and compensation, a comprehensive employee benefits programs, attractive working conditions, and the chance to build and explore a career opportunity by offering professional development.

Discover why Cooper University Health Care is the employer of choice in South Jersey.

Short Description

Accountable for the management of clinical and business operations of assigned sites, including the delivery of quality clinical services, improving patient experience, materials management, , software implementations, regulatory compliance, equipment maintenance, environment of care, and facility management, making themselves or designee available after hours for emergent issues such as facility or operational issues due to weather or other unforeseen curcumstances.
Supports the strategic direction of Ambulatory Operations as well as the Institute’s growth playbook by operationalizing new programs and growth initiatives.
Exemplifies the Cooper University Health Care core values of inclusion, compassion and excellence.
Partners with physicians, clinical personnel and administrative leadership within their assigned areas of the health system to remove barriers to success and achieve local and organizational goals.
Provides strong, effective, goal-oriented leadership to direct and indirect reports
Establishes, cascades and meets goals, objectives, policies, procedures and systems for all operational areas within span of control.
Develops, coordinates, and maintains standardized work procedures and policies to improve efficiency and effectiveness across Ambulatory Operations.
Coaches, develops, educates, mentors, and holds accountable direct reports as well as fosters an environment of trust throughout their areas of responsibility .
Hardwires and validates leadership tools such as leader rounding on patients, employees, and providers. And practices reward and recognize of key behaviors
Creates quarterly goal action plans focused on meeting annual role-specific and organizationally driven goals.
Performs data reporting and analysis to drive decision-making within span of control geared towards meeting organizational goals.
Participates in professional development activites and maintain professional affliations.
Performs all related duties and/or special projects as assigned/required.

Experience Required

Minimum 3 years experience in a healthcare leadership, manager level or above. A combination of education, experience and background may also be considered.

Skill in exercising a high degree of leadership, initiative, judgment, discretion, and decision-making to achieve both local and organization objectives.

Demonstrated experience in improvement of assigned areas outcomes through creative and sustainable tactics

Knowledge and ability to utilize electronic health record in order to monitor key practice statistics, patient access metrics and clinic operations

Excellent organizational, written and verbal communication skills, comfort in communication with all levels of personnel .

Demonstrated excellence in customer service and patient experience and operational improvement within the ambulatory setting.

Strong knowledge of principles and practices of business/medical administration, management and relationship management

Working knowledge of regulatory requirements in an ambulatory setting in the realm of HIPAA, , scheduling and billing.

Education Requirements

Bachelor’s degree; Master’s degree preferred.

Special Requirements

Preferred: Certified medical practice executive (CMPE) and/or American College of Healthcare Executives (ACHE
Show less ",1,0,0.19
74,Management and Manufacturing,Hospitals and Health Care,"Are you ready to love your job again?

Join The Arbor Company and discover a work family where you are treated with respect. We are recognized by our team members as a Great Place To Work® and we are honored to be one of only 20 companies on Fortune Magazine’s “Best Workplaces in Aging Services"" list.

Arbor People feel the love every day because we provide:

Free Meal for Each Work Shift
Employee Assistance Program – Wellness Resources for You and Your Family
Competitive Pay Rates
Paid Time Off for Full Time and Part Time Staff, Plus the Ability to Turn Your PTO Into Cash
Options To Get Paid on Your Own Schedule
Certified Great Place to Work
Pathways For Growth Opportunities
Diversity, Equity and Inclusion Training
Tuition Assistance
Student Loan Repayment Assistance
Access To Emergency Financial Assistance
Access To Health, Dental, Vision Insurance
401K with Employer Matching Contributions


As a Housekeeper/Cleaner at The Arbor Company, your work matters. Here’s why:

You provide daily cleaning in resident apartments
You work as a team player with our housekeeping department to keep the common areas clean and inviting
You communicate daily with the supervisor about supplies and inventory


You’ll be great on this team because you have:

High school diploma or equivalent


Our people and our residents are at the center of our universe. We can’t wait to meet you!

The Arbor Company provides equal employment opportunities to all employees and applicants for employment and prohibits discrimination and harassment of any type without regard to race, color, religion, age, sex, national origin, disability status, genetics, protected veteran status, sexual orientation, gender identity or expression, or any other characteristic protected by federal, state, or local laws.
Show less ",1,0,0
75,Administrative,Hospitals and Health Care,"Position Description




The Client Coordinator works with clients, patients and active caregivers to identify open shifts, availability, and coordinate schedules. The Client Coordinator understands the needs, requirements, and preferences of all client types (patients, facilities, referral sources, caregivers, and staff) and optimizes staffing ratios. Through daily interaction with clients and caregivers, the Client Coordinator builds relationships with clientele to foster additional business opportunities.




Essential Duties And Responsibilities




Builds relationships with Maxim clients and active caregivers to understand their scheduling needs, requirements, and preferences
Coordinates and confirms schedule with clients and active caregivers
Records caregivers’ correspondence, needs, availability, and schedule in system of record
Ensures all placements adhere to applicable compliance and contract requirements
Partners with Business Development Manager, Clinicians, Recruiters, and Field Support staff to debrief on staffing shortages, client satisfaction, and business development opportunities
Performs on-call as needed or assigned
Assists with other duties as needed




Minimum Requirements




High School degree or equivalent required, some completed college coursework preferred
One year work experience in a team environment
Must meet all federal, state, and local requirements
Proficiency in MS Office, Internet, and email
Must be energetic, highly motivated, and able to work in a fast-paced environment
Must be highly organized, detail oriented, and have exceptional planning and problem solving skills
Excellent verbal and written communication skills




Wage/Salary Information




$19.50 - $25 per hour, plus $2000 annual bonus potential




Benefits




Medical/Prescription, Dental, Vision, Health Advocacy (company paid if enrolled Medical), Health Advocate Employee Assistance Program, Health Savings Account , 401(k), 401(k) Company Match, Profit Sharing, Short Term Disability, Long Term Disability, Primary Caregiver Leave, Parental Leave, Life and Basic Accidental Death and Dismemberment Insurance, Voluntary Life and Accidental Death and Dismemberment Insurance, Hospital Expense Protection Plan, Critical Illness Insurance, Accident Insurance, Dependent Care Flexible Spending Account, Home and Auto Insurance, Pet Insurance, Transportation Benefits, CommonBond, Educational Assistance Program, College Partnership Program, Paid Time Off/Company Holidays




Benefits




At Maxim Healthcare Services, we firmly believe that our employees are the heartbeat of our organization and we are happy to offer the following benefits:




Competitive pay & weekly paychecks
Health, dental, vision, and life insurance
401(k) savings plan
Awards and recognition programs




About Maxim Healthcare Services




Maxim Healthcare Services has been making a difference in the lives of our patients, caregivers, employees and communities for more than 30 years. We offer private duty nursing, skilled nursing, physical rehabilitation, companion care, respite care and behavioral care for individuals with chronic and acute illnesses and disabilities. Our commitment to quality customer service, compassionate patient care, and filling critical healthcare needs makes us a trusted partner wherever care is needed.




Maxim Healthcare Services is an equal opportunity/affirmative action employer. All qualified applicants will receive consideration for employment without regard to sex, gender identity, sexual orientation, race, color, religion, national origin, disability, protected Veteran status, age, or any other characteristic protected by law.
Show less ",1,0.21,0
76,Sales and Management,Hospitals and Health Care,"Company : Allegheny Health Network Job Description :

GENERAL OVERVIEW:

Abstracts clinical data from medical records in accordance with regulatory and administrative reporting requirements.

ESSENTIAL RESPONSIBILITIES:

Abstracts key clinical findings accurately and in a timely manner and performs direct data entry for inclusion into an aggregate database to meet the requirements of the state, internal use, third party payer requirements and external quality improvement participation based on guidelines. (80%)
Performs system functions and report running as needed. (10%)
Participates in ongoing data quality studies to ensure an accurate database. (10%)
Performs other duties as assigned or required.


QUALIFICATIONS:

Minimum

High school diploma or equivalent.


Preferred

Associate's Degree.
Successful completion of college-level courses in Anatomy & Physiology and Medical Terminology.
Registered Health Information Technician (RHIT), Registered Health Information Administrator (RHIA).
Minimum 1 year abstracting experience preferred. Minimum 1 year medical record experience.
Proficient in the use of computer systems to include GroupWise, Microsoft Office, mainframes and the electronic medical record.


Disclaimer: The job description has been designed to indicate the general nature and essential duties and responsibilities of work performed by employees within this job title. It may not contain a comprehensive inventory of all duties, responsibilities, and qualifications required of employees to do this job.

Compliance Requirement : This job adheres to the ethical and legal standards and behavioral expectations as set forth in the code of business conduct and company policies.

As a component of job responsibilities, employees may have access to covered information, cardholder data, or other confidential customer information that must be protected at all times. In connection with this, all employees must comply with both the Health Insurance Portability Accountability Act of 1996 (HIPAA) as described in the Notice of Privacy Practices and Privacy Policies and Procedures as well as all data security guidelines established within the Company’s Handbook of Privacy Policies and Practices and Information Security Policy.

Furthermore, it is every employee’s responsibility to comply with the company’s Code of Business Conduct. This includes but is not limited to adherence to applicable federal and state laws, rules, and regulations as well as company policies and training requirements.

Highmark Health and its affiliates prohibit discrimination against qualified individuals based on their status as protected veterans or individuals with disabilities, and prohibit discrimination against all individuals based on their race, color, age, religion, sex, national origin, sexual orientation/gender identity or any other category protected by applicable federal, state or local law. Highmark Health and its affiliates take affirmative action to employ and advance in employment individuals without regard to race, color, age, religion, sex, national origin, sexual orientation/gender identity, protected veteran status or disability.

EEO is The Law

Equal Opportunity Employer Minorities/Women/Protected Veterans/Disabled/Sexual Orientation/Gender Identity ( https://www.eeoc.gov/sites/default/files/migrated_files/employers/poster_screen_reader_optimized.pdf )

We endeavor to make this site accessible to any and all users. If you would like to contact us regarding the accessibility of our website or need assistance completing the application process, please contact number below.

For accommodation requests, please contact HR Services Online at HRServices@highmarkhealth.org

California Consumer Privacy Act Employees, Contractors, and Applicants Notice
Show less ",1,0.19,0
77,Customer Service,Consumer Services and Biotechnology Research,"Buyer



Assignment length - 3 months



Location - San Diego, CA (Hybrid)



Pay rate - $36.50







Key Responsibilities:



Ensure that all requisitions and other purchase documents comply with established processes, policies, and procedures,
Review supplier capabilities, pricing and secure the most favorable pricing and purchase terms available,
Monitor and expedite open orders and manage open orders, as necessary,
Identify, implement, and execute ideas for cost savings,
Maintain strong collaboration with internal customers to ensure products and services are delivered at the right price, quantity, quality, and time,
Work closely with Finance to ensure invoices discrepancy resolution and continuous improvement of document flow,
Work closely with supply base to ensure successful order confirmations,
Advocate and enforce the Global Purchasing Policy,
& Maintain methodology and tools for ongoing performance









Skills:



Creative, adaptive to new situations,
Exceptional customer service skills and experience,
Bioscience background preferred,
Experience with MRP, SAP and Ariba preferred,
High attention to detail and ability to balance multiple priorities simultaneously,
Proven ability to negotiate,
Intermediate level skills with Microsoft Office,
Excellent interpersonal and verbal communication skills,
& Effective verbal, written and presentation skills.






































...



Show less ",1,0,0
78,"Consulting, Information Technology, and Sales",Hospitals and Health Care,"Description:

Lay the groundwork for a dynamic future with an industry leader. At Kaiser Permanente, youll forge lasting relationships with colleagues across the organization while enjoying the opportunity to grow your experience and hone your expertise on assignments that have real impact. Our interns have worked on everything from analyzing financial software and developing new marketing strategies, to designing mobile apps and helping clinicians improve care delivery. We want you to get the most out of your time here and will give you projects that challenge you to think freely, question thoroughly, and explore deeply.

Internship Location:

This role is scheduled to be 100% remote. While remote, finalists MUST reside in one of the following states to be eligible for employment with Kaiser Permanente: CA, OR, WA, HI, CO, GA, MD, VA, CT, DC, or IL.

Department Description:

The Office of the Chief Health Officer oversees enterprise-wide Community Health to support our communities to live healthier lives through grants and partnerships, efforts to address social determinants of health in our member populations through Social Health, and our Medicaid line of business.

Intern Projects:

Interns will be given an overview of our initiatives and programs with an opportunity to partner with one of our leaders to move work forward. Interns will be expected to assist with producing internal and external communication and presentations.

Target Majors:

Public Health; Public Relations and Communications; Health Care Administration

Target Skillset:

Applicants should be detail-oriented, comfortable using Microsoft Office (including Excel, PowerPoint), design skills a plus, knowledge or interest in public or community health, excellent written and verbal communication skills.

Essential Responsibilities:

Contributing to a designated project or initiative to meet a KP business objective.
Report development and analytics.
Project management - planning, execution, and measurement.
Learning new applications needed to complete assignments or support the execution of business objectives.
Job shadowing in other functional areas.
Performing additional duties as required.


Basic Qualifications:

Experience

N/A


Education

Pursuing a graduate degree or have completed a graduate program from an accredited university within the last year.
Bachelors degree required.


License, Certification, Registration

N/A


Additional Requirements:

Aptitude to perform data and process analytics and formulating solutions.
Working knowledge of MS Word, Excel, PowerPoint.


Preferred Qualifications:

Ability to learn quickly and experience producing high quality work in short periods of time.
3.0 GPA or above
Advanced analytical and problem-solving skills
Proven ability to build effective working relationships as well as strong interpersonal skills
Excellent verbal and written communication skills
Show less ",1,0.24,0.24
79,Health Care Provider,Medical Practices,"CCMA duties will include the Following: *Provides nursing triage services and health advice for patients over the phone. Evaluates, assesses, and documents patients' questions or concerns. *Recording vital signs, assisting physician during patient examination, collection and preparation of lab specimens, and administering vaccines to patients. *Maintains safe and clean working environment by complying with procedures, rules, and regulations. *Protects patients and employees by adhering to infection-control policies and protocols, medication administration and storage procedures, and controlled substance regulations. Full-time positions are available with some rotating Saturday shifts and rotating open and close shifts. Work schedules are 8- hour shifts. We have 4 office locations including Fairfax, Herndon, Great Falls and Aldie. Some travel required on an ""as needed"" basis. Company Description A Pediatric practice of over 32 years in Northern Virginia seeking applicants for the Clinical Medical Assistant position.




A Pediatric practice of over 32 years in Northern Virginia seeking applicants for the Clinical Medical Assistant position.
Show less ",1,0,0
