"",Job Function,Industry,Job Description,Segment,female,male
42,Human Resources,Hospitals and Health Care,"WhyMaxim Healthcare?




Whenyou work at Maxim, you’re part of a network of more than 175 local offices thathave deep roots in each of the communities we serve, while still leveraging theresources and security of one of the largest and oldest healthcare staffing andservices companies in the nation. We believe our employees are ourgreatest asset. It is because of the talented healthcare professionals andsupport staff we employ that we are able to provide a variety of services tomeet and respond to the needs of our clients and patients.




As a Recruiter you will be makinga difference in the lives of your fellow team members, our caregivers, ourpatients and our clients. You will...




Develop and execute recruitmentstrategies to attract, screen, and hire quality healthcare professionals
Utilize various recruitment toolsand methods to source and attract a pool of qualified and diverse candidates
Manage caregivers and field staffwhile on assignment
Develop and maintain relationshipswith active clients, patients, and referral sources
Build and cultivate relationshipswith industry contacts to gain industry knowledge, referrals, and businessdevelopment leads




Workingat Maxim and why you will love it…




Weare a team of driven, compassionate people who push each other to developpersonally and professionally. At Maxim, you can expect a competitive workenvironment. To ensure your success, you will take part ina comprehensive training program, surrounded bya culture of servant leadership that encourages everyone tohelp develop themselves and others. Maxim promotes from within; themajority of the people who start as a Recruiter advance into our sales careerpath and leadership roles. We offer a competitive compensation package whichincludes a base salary plus uncapped commission potential along with anunmatched benefit package!




Wage/Salary Information




As a Recruiter Trainee: (first 3 months in the role) you will be paid an hourly rate of $25.24.




As a Recruiter 1:(after you successfully complete 3months of training) you will become a salaried employee and will be paid anannual base salary of $50,000 plus weekly commission with a Cost of LivingAdjustment of $7,500.00 annually.




Benefits




Medical/Prescription, Dental, Vision, Health Advocacy (company paid if enrolled Medical), Health Advocate Employee Assistance Program, Health Savings Account , 401(k), 401(k) Company Match, Profit Sharing, Short Term Disability, Long Term Disability, Primary Caregiver Leave, Parental Leave, Life and Basic Accidental Death and Dismemberment Insurance, Voluntary Life and Accidental Death and Dismemberment Insurance, Hospital Expense Protection Plan, Critical Illness Insurance, Accident Insurance, Dependent Care Flexible Spending Account, Home and Auto Insurance, Pet Insurance, Transportation Benefits, CommonBond, Educational Assistance Program, College Partnership Program, Paid Time Off/Company Holidays




Benefits




At Maxim Healthcare Services, we firmly believe that our employees are the heartbeat of our organization and we are happy to offer the following benefits:




Competitive pay & weekly paychecks
Health, dental, vision, and life insurance
401(k) savings plan
Awards and recognition programs




About Maxim Healthcare Services




Maxim Healthcare Services has been making a difference in the lives of our patients, caregivers, employees and communities for more than 30 years. We offer private duty nursing, skilled nursing, physical rehabilitation, companion care, respite care and behavioral care for individuals with chronic and acute illnesses and disabilities. Our commitment to quality customer service, compassionate patient care, and filling critical healthcare needs makes us a trusted partner wherever care is needed.




Maxim Healthcare Services is an equal opportunity/affirmative action employer. All qualified applicants will receive consideration for employment without regard to sex, gender identity, sexual orientation, race, color, religion, national origin, disability, protected Veteran status, age, or any other characteristic protected by law.
Show less ",1,0,0
43,Marketing and Sales,Hospitals and Health Care,"Steer Health transforms healthcare with the industry's most widely adopted AI-powered patient experience and growth.

At Steer Health, we’re creating the next-generation consumer engagement experiences with solutions spanning care communication, patient engagement, scheduling, smart notifications, and more.

We’re growing rapidly and are seeking a highly motivated, experienced Growth Marketing Coordinator to advance our Marketing efforts and help establish Steer Health as the leader in the space.

If you have growth Marketing experience and you're excited to have an impact on a platform used by some of the biggest names in the healthcare industry, we want to meet you! You’ll be building growth strategies for an amazing product offering in a growing market, working with a team of experienced Marketers, product managers, engineers, and designers.

As a Growth Marketing Coordinator on Steer Health, you will be responsible for developing and executing growth strategies, analyzing and optimizing marketing campaigns, and driving customer engagement. Your focus will be on identifying growth opportunities, creating excellent campaigns, and ensuring your campaigns make an impact on lead generation and client acquisition. The successful candidate should have a passion for data-driven marketing, customer segmentation, and developing innovative growth strategies.

Requirements

You're able to manage SEO/SEM, marketing database, email, social media and/or display advertising campaigns.

You're highly creative and have experience in identifying target audiences and devising digital campaigns that engage and convert.
You can optimize landing pages and user funnels.
You are skilled in experimentation.
You have a solid knowledge of website analytics tools.
You have a working knowledge of Google Ads and social media advertising.
You have strong analytical skills.
You see exciting marketing possibilities in new technologies and emerging trends.
Show less ",1,0,0
44,Management and Manufacturing,Hospitals and Health Care,"Come rise above with Yona! Our employees are instrumental in maintaining a happy, healthy, and clean environment for the residents. We depend on our team members to be highly motivated, committed, and compassionate individuals who share our vision and work together to attain it. Our work environment encourages responsibility for personal growth and promotes pride in each employee. You will play an essential role in providing warm and friendly hospitality to all the residents, visitors, and coworkers. Yona is looking for a housekeeper to join the team! Experience is not required, but preferred.

Benefits Of Yona

Comprehensive medical, dental, and vison insurance
Employer paid life insurance
401(k) plan
Competitive paid time off
Employee assistance program
Wages on demand
Discount & wellness programs
Career growth


Responsibilities:

Cleans and restocks all assigned areas such as resident rooms, bathrooms, offices, clinical areas, conference rooms, nurses’ stations, stairwells, etc., according to departmental standards and guidelines
Maintains work assignment sheets for daily duties in assigned areas
Follows safe workplace practices according to regulatory guidelines
Follows departmental procedures for the daily cleaning procedures and any additional steps as outlined on the job assignment
Performs other related duties as assigned


Requirements:

Ability to follow written and oral instructions concerning the mixing of cleaning compounds, liquids, disinfecting solutions, etc
Ability to work independently
Possess flexibility, integrity, and a strong work ethic
Ability to work effectively with the residents and personnel
Must provide a criminal background check
Housekeeping experience is a plus


This posting in no way states or implies that these are the only duties to be performed by the employee occupying this position. Candidates/employees may be required to follow other job-related instructions and to perform other job-related duties as requested, subject to all applicable state and federal laws.

Certain job functions described herein may be subject to possible modification in accordance with applicable state and federal laws.

Yona provides equal employment opportunities to all employees and applicants for employment and prohibits discrimination and harassment of any type without regard to race, color, religion, age, sex, national origin, disability status, genetics, protected veteran status, sexual orientation, gender identity or expression, or any other characteristic protected by federal, state or local laws.
Show less ",1,0,0
45,"Research, Analyst, and Information Technology",Hospitals and Health Care,"Overview

The Research Assistant I for the Department of Neuropsychology will be responsible for: scoring parent- and self-report clinical questionnaires; maintenance of existing research databases and development of new databases and data linking procedures; design and maintenance of online data collection systems and databases for individual studies occurring within the Neuropsychology department; querying databases to generate limited data sets for investigators and assist with preliminary data analysis to support evidence-based clinical practice and clinical research projects. The Research Assistant I will assist with manuscript preparation, grant support, and Institutional Review Board (IRB) submissions.

Responsibilities

Assist with a wide variety of research activities, including: study recruitment and data collection, study protocol implementation, organization of study activities and materials, and interaction with other members of the study team as well as participants and their families.
Organize, tabulate, and summarize data sets for statistical analysis by department clinicians and research faculty, and assist with preliminary data analysis.
Design, develop, and maintain effective online data collection systems using appropriate software (e.g., Qualtrics, SharePoint) for studies within the Neuropsychology Department, including generating and distributing summary reports of responses.
Create databases and generate data forms in accordance with clinic needs and research study design, ensuring that databases and all data records are stored according to HIPAA and IRB requirements.
Prepare and submit materials for IRB applications and renewals.
Score parent- and self-report clinical and research questionnaires completed in the course of the department's operations.


Qualifications

EDUCATION:

BA/BS in Psychology or related field is required.
Coursework in research methods and statistics is required.


EXPERIENCE:

Previous experience working in human subjects research preferred.
Must have experience with basic statistical analysis.
Must have experience creating and managing databases.
Show less ",1,0,0
46,Human Resources,Hospitals and Health Care,"WhyMaxim Healthcare?




Whenyou work at Maxim, you’re part of a network of more than 175 local offices thathave deep roots in each of the communities we serve, while still leveraging theresources and security of one of the largest and oldest healthcare staffing andservices companies in the nation. We believe our employees are ourgreatest asset. It is because of the talented healthcare professionals andsupport staff we employ that we are able to provide a variety of services tomeet and respond to the needs of our clients and patients.




As a Recruiter you will be makinga difference in the lives of your fellow team members, our caregivers, ourpatients and our clients. You will...




Develop and execute recruitmentstrategies to attract, screen, and hire quality healthcare professionals
Utilize various recruitment toolsand methods to source and attract a pool of qualified and diverse candidates
Manage caregivers and field staffwhile on assignment
Develop and maintain relationshipswith active clients, patients, and referral sources
Build and cultivate relationshipswith industry contacts to gain industry knowledge, referrals, and businessdevelopment leads




Workingat Maxim and why you will love it…




Weare a team of driven, compassionate people who push each other to developpersonally and professionally. At Maxim, you can expect a competitive workenvironment. To ensure your success, you will take part ina comprehensive training program, surrounded bya culture of servant leadership that encourages everyone tohelp develop themselves and others. Maxim promotes from within; themajority of the people who start as a Recruiter advance into our sales careerpath and leadership roles. We offer a competitive compensation package whichincludes a base salary plus uncapped commission potential along with anunmatched benefit package!




Wage/Salary Information




As a Recruiter Trainee: (first 3 months in the role) you will be paid an hourly rate between $21.64 and $26.44 per hour.




As a Recruiter 1:(after you successfully complete 3months of training) you will become a salaried employee and will be paid anannual base salary of $50,000 plus weekly commission with a Cost of LivingAdjustment of $X.




Benefits




Medical/Prescription, Dental, Vision, Health Advocacy (company paid if enrolled Medical), Health Advocate Employee Assistance Program, Health Savings Account , 401(k), 401(k) Company Match, Profit Sharing, Short Term Disability, Long Term Disability, Primary Caregiver Leave, Parental Leave, Life and Basic Accidental Death and Dismemberment Insurance, Voluntary Life and Accidental Death and Dismemberment Insurance, Hospital Expense Protection Plan, Critical Illness Insurance, Accident Insurance, Dependent Care Flexible Spending Account, Home and Auto Insurance, Pet Insurance, Transportation Benefits, CommonBond, Educational Assistance Program, College Partnership Program, Paid Time Off/Company Holidays




Benefits




At Maxim Healthcare Services, we firmly believe that our employees are the heartbeat of our organization and we are happy to offer the following benefits:




Competitive pay & weekly paychecks
Health, dental, vision, and life insurance
401(k) savings plan
Awards and recognition programs




About Maxim Healthcare Services




Maxim Healthcare Services has been making a difference in the lives of our patients, caregivers, employees and communities for more than 30 years. We offer private duty nursing, skilled nursing, physical rehabilitation, companion care, respite care and behavioral care for individuals with chronic and acute illnesses and disabilities. Our commitment to quality customer service, compassionate patient care, and filling critical healthcare needs makes us a trusted partner wherever care is needed.




Maxim Healthcare Services is an equal opportunity/affirmative action employer. All qualified applicants will receive consideration for employment without regard to sex, gender identity, sexual orientation, race, color, religion, national origin, disability, protected Veteran status, age, or any other characteristic protected by law.
Show less ",1,0,0
47,Marketing and Sales,Wellness and Fitness Services and Hospitals and Health Care,"Benefits

$10,000 Tuition Reimbursement per year ($5,700 part-time)
$6,000 Student Loan Repayment ($3,000 part-time)
$1,000 Professional Development per year ($500 part-time)
$250 Wellbeing Fund per year($125 for part-time)
Annual Employee Merit Increase and Incentive Bonus
Paid time off and Holiday pay

Description

The Marketing Specialist reflects the mission, vision, and values of NM, adheres to the organization’s Code of Ethics and Corporate Compliance Program, and complies with all relevant policies, procedures, guidelines and all other regulatory and accreditation standards.

The Marketing Specialist is an important individual contributor to Marketing. They are expected to be collaborative, results driven, organized with a keen attention to detail, ability to multi-task, and deliver flawless execution of their projects. The Marketing Specialist will work with a range of clients within and beyond NM.

The Marketing Specialist is an important individual contributor within the Marketing division. They support the manager/team in identified projects that often include multi-tasking various projects with the ability to anticipate and communicate needs of the project with the manager. The Marketing Specialist creates building blocks of NM’s marketing plans and, in doing so, learns fundamentals of strategic marketing. They are expected to be collaborative, results driven and deliver flawless execution of their projects

The Marketing Specialist supports the manager in the execution of assigned/identified projects:

Understands the scope and objectives of assigned projects and delivers against those objectives.
Develops key elements of the marketing plan and/or the creation of marketing materials.
Supports strong internal client relationships by understanding internal client needs, delivering high quality materials/plans, and effectively managing feedback.

Qualifications

Required:

Bachelor’s degree or 4 years of comparable experience.
An additional 2-3 years of experience in related field.
Must have exceptional interpersonal skills with a proactive and constructive attitude.

Preferred

Understanding of healthcare industry and academic medical centers.
Agency or client-side healthcare marketing experience/internship.
Undergraduate degree in Marketing or related field.

Equal Opportunity

Northwestern Medicine is an affirmative action/equal opportunity employer and does not discriminate in hiring or employment on the basis of age, sex, race, color, religion, national origin, gender identity, veteran status, disability, sexual orientation or any other protected status.
Show less ",1,0,0.28
48,Administrative,Hospitals and Health Care,"Position Description




The Client Coordinator works with clients, patients and active caregivers to identify open shifts, availability, and coordinate schedules. The Client Coordinator understands the needs, requirements, and preferences of all client types (patients, facilities, referral sources, caregivers, and staff) and optimizes staffing ratios. Through daily interaction with clients and caregivers, the Client Coordinator builds relationships with clientele to foster additional business opportunities.




Essential Duties And Responsibilities




Builds relationships with Maxim clients and active caregivers to understand their scheduling needs, requirements, and preferences
Coordinates and confirms schedule with clients and active caregivers
Records caregivers’ correspondence, needs, availability, and schedule in system of record
Ensures all placements adhere to applicable compliance and contract requirements
Partners with Business Development Manager, Clinicians, Recruiters, and Field Support staff to debrief on staffing shortages, client satisfaction, and business development opportunities
Performs on-call as needed or assigned
Assists with other duties as needed




Minimum Requirements




High School degree or equivalent required, some completed college coursework preferred
One year work experience in a team environment
Must meet all federal, state, and local requirements
Proficiency in MS Office, Internet, and email
Must be energetic, highly motivated, and able to work in a fast-paced environment
Must be highly organized, detail oriented, and have exceptional planning and problem solving skills
Excellent verbal and written communication skills




Wage/Salary Information




$19.50 - $25 per hour, plus $2000 annual bonus potential




Benefits




Medical/Prescription, Dental, Vision, Health Advocacy (company paid if enrolled Medical), Health Advocate Employee Assistance Program, Health Savings Account , 401(k), 401(k) Company Match, Profit Sharing, Short Term Disability, Long Term Disability, Primary Caregiver Leave, Parental Leave, Life and Basic Accidental Death and Dismemberment Insurance, Voluntary Life and Accidental Death and Dismemberment Insurance, Hospital Expense Protection Plan, Critical Illness Insurance, Accident Insurance, Dependent Care Flexible Spending Account, Home and Auto Insurance, Pet Insurance, Transportation Benefits, CommonBond, Educational Assistance Program, College Partnership Program, Paid Time Off/Company Holidays




Benefits




At Maxim Healthcare Services, we firmly believe that our employees are the heartbeat of our organization and we are happy to offer the following benefits:




Competitive pay & weekly paychecks
Health, dental, vision, and life insurance
401(k) savings plan
Awards and recognition programs




About Maxim Healthcare Services




Maxim Healthcare Services has been making a difference in the lives of our patients, caregivers, employees and communities for more than 30 years. We offer private duty nursing, skilled nursing, physical rehabilitation, companion care, respite care and behavioral care for individuals with chronic and acute illnesses and disabilities. Our commitment to quality customer service, compassionate patient care, and filling critical healthcare needs makes us a trusted partner wherever care is needed.




Maxim Healthcare Services is an equal opportunity/affirmative action employer. All qualified applicants will receive consideration for employment without regard to sex, gender identity, sexual orientation, race, color, religion, national origin, disability, protected Veteran status, age, or any other characteristic protected by law.
Show less ",1,0.21,0
