"",Job Function,Industry,Job Description,Segment,female,male
0,Administrative,Hospitals and Health Care,"At UnitedHealthcare, we’re simplifying the health care experience, creating healthier communities and removing barriers to quality care. The work you do here impacts the lives of millions of people for the better. Come build the health care system of tomorrow, making it more responsive, affordable and equitable. Ready to make a difference? Join us and start doing your life's best work.(sm)

The Sr. Administrative Assistant role will provide a wide variety of administrative support to senior leaders in the UnitedHealthcare Provider Service organization. This role provides critical support including travel arrangements, maintaining calendars, tracking expenses, onsite meeting coordination and planning, presentation facilitation, coordinating business segment liaison duties and other duties as assigned.

You’ll enjoy the flexibility to work remotely * from anywhere within the U.S. as you take on some tough challenges.

Primary Responsibilities

Create/maintain executive calendars/coordinate meetings avoiding scheduling conflicts
Create and prepare meeting materials using Microsoft Office (PowerPoint presentations, agendas) using UHC branding resources and ensure distribution to appropriate individuals in a timely manner
Plan, schedule, organize logistics, setup resources and technology of large and/or offsite events, using internal resources as needed (conference rooms, food, Telepresence)
Make travel arrangements (airline, hotel, ground transportation, office space assignment)
Coordinate, and/or facilitate meetings as needed (e.g., manage PowerPoint deck; ensure time schedules are adhered to; assist with technology; document notes / follow-ups)
Post documents (meeting notes, PowerPoint decks) onto relevant systems (SharePoint) and communication boards
Maintain and distribute lists and documents as needed (organizational charts, email, distribution lists, contacts)
Perform Business Segment Liaison (BSL) activities, as needed (hardware/software acquisition/disposal, new employee onboarding, transfers, terminations)
Maintain sensitive or confidential information in accordance with internal policies and procedures
Establish relationships and collaborate with internal and/or external resource personnel to facilitate duties
Provide coverage for internal team members as needed
Performs mass shipping and mail distribution in coordination with internal resources as needed
Enter and submit purchase orders into relevant systems (e.g., ARIBA) to purchase office supplies from pre-approved vendors
Manage/monitor/procure office supplies, goods and services (e.g., process/reconcile invoices, travel and other expenses, payments, and/or reimbursements)
Performs all other related duties as assigned

You’ll be rewarded and recognized for your performance in an environment that will challenge you and give you clear direction on what it takes to succeed in your role as well as provide development for other roles you may be interested in.

Required Qualifications

High school diploma/GED
2+ years of experience supporting senior leaders in an administrative capacity in a fast-paced environment
Experience successfully managing multiple priorities
Proficiency using Microsoft Office (Outlook, Word, Excel, PowerPoint)

Preferred Qualifications

Some college coursework or business vocational school education
Experience as a Business Segment Liaison (BSL) coordinating office moves including hardware and software requisitions, travel arrangements, new hire onboarding and other office management responsibilities
Proven solid attention to detail and excellent organizational skills
Proven ability to maintain professionalism and a positive service attitude at all times
Proven excellent people and communication skills

Careers with UnitedHealthcare. Work with a Fortune 5 organization that’s serving millions of people as we transform health care with bold ideas. Bring your energy for driving change for the better. Help us improve health access and outcomes for everyone, as we work to advance health equity, connecting people with the care they need to feel their best. As an industry leader, our commitment to improving lives is second to none.

California, Colorado, Connecticut, Nevada, New York, Rhode Island, or Washington Residents Only: The salary range for California, Colorado, Connecticut, Nevada, New York, Rhode Island or Washington residents is $18.80 to $36.78. Pay is based on several factors including but not limited to education, work experience, certifications, etc. In addition to your salary, UnitedHealth Group offers benefits such as, a comprehensive benefits package, incentive and recognition programs, equity stock purchase and 401k contribution (all benefits are subject to eligibility requirements). No matter where or when you begin a career with UnitedHealth Group, you’ll find a far-reaching choice of benefits and incentives.

All employees working remotely will be required to adhere to UnitedHealth Group’s Telecommuter Policy

At UnitedHealth Group, our mission is to help people live healthier lives and make the health system work better for everyone. We believe everyone–of every race, gender, sexuality, age, location and income–deserves the opportunity to live their healthiest life. Today, however, there are still far too many barriers to good health which are disproportionately experienced by people of color, historically marginalized groups and those with lower incomes. We are committed to mitigating our impact on the environment and enabling and delivering equitable care that addresses health disparities and improves health outcomes - an enterprise priority reflected in our mission.

Diversity creates a healthier atmosphere: UnitedHealth Group is an Equal Employment Opportunity/Affirmative Action employer and all qualified applicants will receive consideration for employment without regard to race, color, religion, sex, age, national origin, protected veteran status, disability status, sexual orientation, gender identity or expression, marital status, genetic information, or any other characteristic protected by law.

UnitedHealth Group is a drug-free workplace. Candidates are required to pass a drug test before beginning employment.
Show less ",1,0,0.12
1,"Marketing, Product Management, and Training","Veterinary Services, Non-profit Organizations, and Hospitals and Health Care","Destination Pet




We're Reimagining Pet Health and Well-Being.




United by our Destination Pet values, our 1,200+ employees work together every day to deliver high-quality care for pets and a better customer experience for pet owners.




Our Mission




Elevate the love and lives of Pet families.

We consider it a privilege to serve as the trusted partner in a pet’s health and well-being, and our mission is rooted in service. Service to pets, to our customers, our partners, and our employees.

Our founders have more than a century of combined experience and innovation in the pet services industry. As veterans of the animal care business, we understand the need for better care and services, and a clean, simple integration of those services. From veterinary care to day care, boarding, training, and grooming, we give great pet parents the tools and resources they need, at a level of sophistication we'd want for our own pets.




Our Values

We are One Pack who works together and are: Pet obsessed We love your pets like our own. We are passionate, whole-hearted, compassionate and connected.
Trustworthy partnersWe do the right thing, we mean what we say, and we do what we promise.
We value integrity, honesty, transparency, and accountability.
Creative innovators
We move fast, and we take smart risks to enhance pet care - every day.
We are strategic, fun, authentic, and we try and learn.




Role Overview:




The Customer Experience Program and Training Manager will be responsible for creating strategies to improve customer experience and program processes. We are searching for a trusted partner who is an excellent communicator and critical thinker and knows how to ask the right questions to move programs forward.




This person is comfortable in sometimes uncertain situations that require finding solutions to complex problems and thinks both like a trainer (always considers audience and voice of the customer) and project manager (can track deliverables, engage stakeholders, etc.).




Working cross-functionally, this person will drive programs and initiatives integral to the company’s success to include NPS (and increasing response rates), Secret Shop, CX integration of new centers, experience of vet & pet marketing campaigns, and more. Additionally, the right candidate will be a great wordsmith, as writing scripts, talking points, and training content is necessary for the role.




Key Responsibilities:




Be Strategic and Innovative – You will assist in driving the innovation and strategic approach around the customer experience, supporting cross functional teams to solve problems based on client insights.
Be the Voice of the Customer – Drive NPS, secret shops, negative review response, and understand insights from social listening by partnering cross-functionally.
Training Program Content & Development - Create custom content to support business objectives and crisis response to include role-play programs, scripts, and other materials to reflect Journey Map and Secret Shop results.
Support Center Onboarding – Support new centers by scheduling, tracking, and providing key training for newly launched centers with excellent project management skills.
Support the Crisis Management – Support our brand/PR department in a crisis by responding to specific situations with cross-functional engagement and content development while anticipating impact on customer experience.
Be Collaborative – Work with Director and cross-functionally with Marketing, Operations, IT and Finance to ensure alignment of Customer Experience’s strategy, direction, and impact.
Be a Strong Storyteller – You can convey compelling and concise narratives with complex analytical insights and data.

We're Looking for Someone With:

Required: bachelor’s degree or higher
Required: 3+ years of customer experience in direct-to-consumer business including training development, VOC programs, project management, and team management
Required: Analytical, with experience exploring data and patterns
Experience with direct reports and team leadership
At least intermediate-level skills: PowerPoint and Excel
Excellent communication skills: written and verbal
Has a passion for delivering high-quality care for pets and better customer experience for pet parents
Loves story telling on behalf of a customer
A strong desire to execute, drive impact, deliver with excellence and demonstrate urgency
Experience working cross functionally and interacting with partners at all levels
Believes in enabling and empowering their teams but can dive into the details and get tactical if that’s what the business needs




What you will get:

Health, vision, dental, long & short-term disability, and Life insurance
A Startup mentality company with stable funding.
Set paths to leadership opportunities
A healthy work-life balance with flexible & set schedule opportunities.
401k and Match
Pet Care discounts, Free Petcare Insurance.
Generous PTO
Opportunity to grow your career with a network of like-minded professionals
Show less ",1,0,0.14
2,"Project Management, Advertising, and Marketing",Advertising Services and Hospitals and Health Care,"At YuzuYello (an IPG Health Company) we build brighter worlds for people who need them. The patient experiences we design work because they’re inspired by the people we serve.

We’re seeking a Director of Patient Experience who not only is experienced in one-on-one patient interactions, ambassador management, experience navigation and HIPAA compliance but also, who believes in our mission of finding inspiration in the stories and experiences of people (patients) who know first-hand what it’s like to live with a disease and/or be on a specific pharmaceutical treatment.







JOB SUMMARY

The Director of Patient Experience is responsible for the day-to-day patient (ambassador) relationship, while supervising her/his patient experience team and their resources. This role will specifically support the building and execution of programs that recruit and engage patients to co-create with and share their experiences across a wide variety of opportunities. These opportunities include but are not limited to print and video testimonials, peer-to-peer mentorship programs, live speaking events, event attendance, and ongoing advisory panels in both unbranded and branded environments. The goal is to give patients a voice so they can become Advocates for themselves and Ambassadors for pharmaceutical brands.




Compassion, empathy, emotional awareness, confidentiality, and harmony are all essential characteristics required for this role as engaging with patients, caregivers and patient advocacy groups in unique situations will occur on an ongoing basis. Being open, comfortable, collaborative, and discerning during what can be health-focused conversations is also essential. Due to the sensitive nature of this work, collecting patients stories & experiences while remaining HIPPA compliant, it is critical that this individual is able to communicate clearly, be highly collaborative and prioritize organization.




This individual will be responsible for the continuous engagement of inspirations (also known as patients and ambassadors) on their accounts while also ensuring seamless, inspirational communications with the YuzuYello team and our client partners. With a firm understanding of the brand's strategy and marketing objectives, the mission of the Director or Patient Experience is to guide the inspirations, internal and client teams through the ins-and-outs of different opportunities, through clear expectation setting, thoughtful and transparent communications and proper protection of PHI. Additionally, this individual will be required to provide input into the development and management of SOWs, budgetary and staffing resources, inspiration honoraria and expenses as well as HIPAA compliant systems. An entrepreneurial spirit is a must as is deep collaboration as a contributing member to developing new and optimizing existing processes.







JOB DUTIES & REPSONSBILITIES

Main-point-of-contact to inspirations and advocacy partners with response times within 24 hours of contact
Management of Forms & Contracts including Eligibility, Opt-in, Physician Verification and Consent to ensure inspirations are the right brand and opportunity fit and informed of their commitments
Management of Honoraria & Expenses for Inspirations for their participation in opportunities and events inclusive of travel reimbursement
Opportunity Management with inspiration selection and expectation setting
Inspiration Engagement Lead manages the logistics and communications regarding recruitment, scheduling, screening, activities and opportunities
Onsite navigator guiding inspirations through the logistics of events (virtual and in-person)
Database Tracking Compliantly tracking every inspiration interaction and activity and reporting of Adverse Event (AE’s ) as Inspirations share them
Team Management on patient experience and inspiration story integration for advocate and ambassador programs.







EXPERIENCE

8 years Relevant Industry Experience Preferred
2 years Supervisory Experience Preferred
Experience in managing Ambassador programs including:
Recruitment approaches and execution
Honorarium processing
Contracting
Patient relationship building and navigation
Direct interface with patients, caregivers and advocacy organizations is a bonus







ABOUT US

YuzuYello is the patient experience services agency that designs and promotes patient support programs. We are comprised of a diverse team of specialists dedicated to helping brands exceed their patients' expectations. Our behavioral and learning strategists, service designers, and content creators bring to life experiences that exceed expectations. Together we can create learning, access, and adherence solutions that radically improve patient outlooks and business outcomes.

Learn more here: https://www.yuzuyello.com







STATEMENT OF UNDERSTANDING

We are providing you with this job description as a guideline for your role. Based on your team, your role may vary slightly and you may perform

other duties or have other responsibilities that are dictated by business needs. However, if you think that there are elements of this job description

that are inaccurate, please speak with your manager and/or HR Partner.

In addition, this job description is not intended to include modifications consistent with providing reasonable accommodation for a disability.




Salary

$115,000 - $132,250 annually.

The salary range for this position is noted within this job posting. Where an employee or prospective employee is paid within this range will depend on, among other factors, actual ranges for current/former employees in the subject position; market considerations; budgetary considerations; tenure and standing with the company (applicable to current employees); as well as the employee’s/applicant’s background, pertinent experience, and qualifications.

Show less ",1,0.12,0.12
3,Quality Assurance,Hospitals and Health Care,"Description

Access Point has an exciting opportunity for a Quality Assurance Analyst to join our team.

If you’re passionate about serving others and have a desire to make an impact, Access Point may be for you.

Come join our dynamic group of talented team members who all share the desire to create innovative products and solutions that fuel healthcare transformation. This is an exciting and fast-paced opportunity for smart, motivated, caring people to join a fast growing organization with plenty of opportunity to advance.

We are always looking for people inspired to help us in our mission. If you are someone who wants to change the lives of patients, drive success for our partners and be part of a team driven to improve care, see what opportunities we have for you.

Position Summary

The Quality Analyst is responsible for evaluating telephone calls, email responses and SAP transactions for accuracy and conformance to quality standards. The Quality Analyst reports results of evaluations to appropriate leaders and stakeholders on a weekly or monthly basis as required.

Essential Functions

Monitors and evaluates the quality of inbound and/or outbound telephone calls, email interactions and SAP systems transactions.
Consistently completes target number of interaction evaluations and ensure each is completed thoroughly and in a timely manner.
Provides continuous review and enhancement of established customer service quality standards. Recommends modifications where appropriate.
Provides ongoing feedback to department leadership regarding identified performance and/or inefficiency issues, training opportunities, and recommended system and process modifications.
Completes special projects and analysis as requested by leadership.
Develop quality policies and procedures and update as needed.

Knowledge/Skills/Abilities

Proficient in Microsoft Office, SAP Framework and Cisco
Ability to work flexible hours as needed
Results oriented with ability to manage change
Ability to meet deadlines on a consistent basis
Strong communication skills – both written and verbal
High attention to detail
Approximate percent of time required to travel: Negligible

Benefits

Competitive pay and benefits including 401k, paid time off, employee illness benefit (EIB), medical, dental, vision.

Additional Information

Lifepoint Health is committed to providing Equal Employment Opportunities for all applicants and employees and complies with all applicable laws prohibiting discrimination against any employee or applicant for employment because of color, race, sex, age, religion, national origin, disability, genetic information, gender identity, sexual orientation, veterans' status or any other basis protected by applicable federal, state or local law.

Qualifications

Education:

High School Diploma Required. Bachelor’s Degree Preferred.

Licenses/Certification: Lean certification preferred.

Experience

A minimum of 1 year experience with SAP Framework required.
Prior quality review/analysis experience preferred.
1-3 years customer service experience in a support or call center environment.
464556
Show less ",1,0,0.23
