"",Job Function,Industry,Job Description,Segment,female,male
22,Human Resources,Hospitals and Health Care,"Are you an experienced Human Resources professional? Do you enjoy engaging with employees throughout their career with the facility? We have an excellent opportunity for an HR coordinator with a proven dedication to providing superb customer service! You will provide human resources support at the facility level for all employees.

At Ciena Healthcare, we take care of you too, with an attractive benefit package including:

Competitive pay,
Life Insurance,
401K with matching funds
Health insurance,
AFLAC
Tuition Reimbursement


In addition, we will help you advance your career with tuition reimbursement, discounts and other support.

You will join an experienced, hard-working team that values communication and strong teamwork abilities.

Responsibilities may include:

Conducts recruitment and onboarding efforts, including pre-employment process for new hires
Tracks turnover and other HR statistics.
Assists with new hire orientation and staff training
Completes termination paperwork.
Assists with handbook, policy and contract (if applicable) interpretation.
Responds to and follows up with unemployment claims; attends hearings as necessary
Assists Department Managers and Administrator with employee retention planning.
Provides FMLA, Cobra and workers compensation administration and follow up.


Education and/or Experience:

Minimum high school diploma or equivalent’ some college or technical training preferred.
Minimum 3 years experience in Human Resources, preferably in the long term care setting.


Covid 19 vaccination or acceptable exemption required

About Ciena Healthcare

Ciena Healthcare is Michigan’s largest provider of skilled nursing and rehabilitation care services.

We serve our residents with compassion, concern, and excellence, believing that every one of them is a unique person who deserves our best each day that we care for them. If you have a passion for improving the lives of those around you and working with others who feel the same way, Ciena is the place for you!
Show less ",1,0,0
23,Other,Hospitals and Health Care,"Company Description




Renowned as the academic flagship of the University of Maryland Medical System, our Magnet®-designated facility is a nationally recognized, academic medical center with opportunities across the continuum of care. Come join UMMC and discover the atmosphere where talents and ideas come together to enhance patient care and advance the science of nursing. Located in downtown Baltimore near the Inner Harbor and Camden Yards, you won’t find a more vibrant place to work!




Job Description




General Summary




Under general supervision, performs analyses on a variety of sample types. Maintains proper records and utilizes independent judgement to generate acceptable test results. Responsible for quality, efficiency and safety in the performance of laboratory functions. Serves as a fully effective and participative member of the multidisciplinary patient care services team.




Principal Responsibilities And Tasks




The following statements are intended to describe the general nature and level of work being performed by people assigned to this classification. They are not to be construed as an exhaustive list of all job duties performed by personnel so classified.




Independently performs waived, moderate and high complexity testing using manual and automated processes. Complies and participates with all regulatory agency guidelines (CLIA 88, TJC, CAP, FDA, etc.) and addresses concerns as needed.
Independently identifies and resolves analytical problems, troubleshoots equipment issues and takes corrective action in evaluating testing procedures, patient results and specimen integrity; seeks guidance when necessary.
Independently troubleshoots and resolves problems and documents corrective actions.
Independently reviews and records quality control and determines the acceptability of testing, patient results, and instrument function by applying the principles of QA/QC daily.
Responds to clinical and customer concerns, independently resolves customer issues in a confidential manner, employing integrity and discretion.
Attends/Leads mandatory education, training, and in-service meetings specific to department.
Assists with development and modification of procedures and assumes additional responsibilities when appropriate.
Performs duties as assigned related to the job description.




Qualifications




Education and Experience




Bachelor’s degree in Medical Technology, biology or related sciences or an Associate Degree in Medical Laboratory Technology or related field or completion of Military Laboratory Technician program with experience required.
0-1 years (bachelor’s degree) preferred; minimum of 3 years of clinical laboratory experience (Associates in MLT or related science or Military Training) required.
ASCP or equivalent preferred.




Knowledge, Skills And Abilities




Proficient knowledge of clinical laboratory processes, analytical procedures, and various laboratory equipment including routine maintenance and calibration.
Effective verbal and written communication skills.
Ability to perform basic computer skills which would be used in a laboratory setting.
Ability to perform mathematical and statistical operations for recording and evaluating lab results. Ability to follow detailed written or verbal instructions accurately.
Ability to handle potentially infectious materials, such as blood and body fluid specimens, observing proper safety regulations and procedures.
Ability to demonstrate knowledge and skills necessary to provide care appropriate to the patient population(s) served. Ability to demonstrate knowledge of the principles of growth and development over the life span and ability to assess data reflective of the patient's requirements relative to his or her population-specific and age specific needs




Additional Information




All your information will be kept confidential according to EEO guidelines.
Show less ",1,0.19,0.57
24,Management and Manufacturing,Hospitals and Health Care,"Maxim Healthcare Group is currently seeking an Operations Manager. The Operations Manager is responsible for successfully managing and leading the complete operations of a Maxim branch office. The Operations Manager has an integral role in the ongoing education of clients, physicians, case managers and community members regarding the functions and benefits of health care services. Additionally, the Operations Manager leads the quality improvement process, program development, and contracting with new customers while maintaining compliance with all reimbursement guidelines, as well as, Maxim policy and procedures.




Essential Duties And Responsibilities




Consistently models and manages the Company’s Mission, Vision and Values and the philosophy of customer service and compliance
Adheres to and promotes Company Policies and Procedures
May serve as a member of the Governing Body and Professional Advisory Board
Consistently evaluates services and programs, annual review of Policy and Procedure manual and submission of Annual Program Evaluation reports to the Governing Body and other entities as required
Responsible for fiscal planning, budgeting, and management with the office teams to maintain adequate cost controls ensuring the provision of adequate staffing, services, and resources
Capable of proactively selling the complete range of Maxim’s services to current and potential clients, customers, and local healthcare facilities
Builds relationships and effectively communicates with patients, referral sources, case managers, physicians, other members of the health care team, and community members
Creates and executes strategic business development plans
Responsible for developing and leading the overall Recruitment strategy
Responsible for maintaining and driving excellence in technology platforms
Responsible for public information materials and activities including advertisements and brochures that the agency uses to represent itself to the community
Responsible for updating appropriate area departments
Responsible for establishing and maintaining an ongoing Quality Improvement Program
Responsible for implementing ongoing process improvement
Responsible for completion of all required reports and corrective action plans
Promotes and ensures attainment of assigned clinical and operational metrics
Oversees hiring, on-boarding and maintenance of requirements for qualified personnel
Responsible for compliant management of patient care from referral through discharge
Oversees the handling of patient and employee complaints and is responsible for timely responses to grievances, identify discharge planning needs when applicable
Responsible for oversight of on-call activities so that a qualified person is available at all times in person or via telecommunications during operating hours when patients are receiving or requesting services and participates in on-call activities where necessary
Designates, in writing, a qualified person to act in his/her absence. If not a Registered Nurse, will consult with AVPCO to appoint a qualified Clinical Manager to oversee the clinical management of the offices (when applicable)
Provides ongoing development support for direct reports and others and provide opportunities for growth and improvement
Maintains involvement in and participation with state regulatory agencies and appropriate professional associations
Responsible for ongoing compliance with all current federal, state, and local regulations, Company policies and procedures, accrediting organization standards, and reimbursement guidelines
Responsible for oversight of revenue cycle management
Ensures that services are in compliance with ongoing contractual obligations
May serve in the capacity of office administrator, appointed by and reporting to the Governing Body, and responsible for all day-to-day operations of the office. Those duties include ensuring that a clinical manager and operations manager is available during all operating hours; and ensuring that the office employs qualified personnel. In addition, if serving in the role of administrator, ensures that a qualified Alternate Administrator is selected and approved by the Governing Body to fulfill the role in the absence of the Administrator
Performs other duties as assigned/necessary




Minimum Requirements




Bachelor’s Degree in Business/Marketing/Communications/Provider Relations (check state specific), and/or graduate of an accredited school of nursing, BSN preferred
If a Registered Nurse, must be licensed to practice in all states assigned
Preferred two (2) years of training and experience in health service administration and/or Public Health or Home Health Nursing
Preferred one (1) year of supervisory or administrative experience in home health care or related health care programs
Knowledge of home care requirements and third-party reimbursement
Ability to effectively elicit/provide information to and from appropriate individuals (including, but not limited to, supervisors, co-workers, clients) via strong communication skills; proficiency in the English language may be required
Computer proficiency including Microsoft Office suite (Word, Excel, etc)Any other requirements mandated by applicable federal, state or local laws
State Requirements: Arizona-Three (3) years of administrative or supervisory experience, including two (2)years in health care
Delaware-The Administrator is referred to as the “Director”. A Baccalaureate Degree in Health or health-related field required.
Oklahoma-The Administrator must obtain and maintain the certificate to act as a home care administrator
Rhode Island-A physician may act as an administrator. If the administrator is not a nurse, the nursing service must be under the direction of a RN who is licensed in the state and who shall be responsible to the administrator for the management of professional services, standards of practice and other related professional aspects of patient care services
Tennessee-If not a Registered Nurse, must have one year of supervisory experience in home health care or related health program.
Texas-The administrator may be a physician or a RN licensed in the state or an individual with education and experience in health care and one year of relevant experience. The administrator may also be a licensed therapist or licensed nursing home administrator with at least one year of management or supervisory experience in health related setting or an individual with a high school diploma or GED and at least two years of management or supervisory experience in a health related setting.
Virginia-The administrator must be an employee of the agency and may not be an independent contractor. The administrator may serve as the clinical director as long as the individual meets the qualifications for and can fulfill the responsibilities of both job titles.
Wisconsin- A physician, RN or a person with training and experience in healthcare administration and at least one year of supervisory or administrative experience in home health care or related health program.




#Homecare




Benefits




At Maxim Healthcare Services, we firmly believe that our employees are the heartbeat of our organization and we are happy to offer the following benefits:




Competitive pay & weekly paychecks
Health, dental, vision, and life insurance
401(k) savings plan
Awards and recognition programs




About Maxim Healthcare Services




Maxim Healthcare Services has been making a difference in the lives of our patients, caregivers, employees and communities for more than 30 years. We offer private duty nursing, skilled nursing, physical rehabilitation, companion care, respite care and behavioral care for individuals with chronic and acute illnesses and disabilities. Our commitment to quality customer service, compassionate patient care, and filling critical healthcare needs makes us a trusted partner wherever care is needed.




Maxim Healthcare Services is an equal opportunity/affirmative action employer. All qualified applicants will receive consideration for employment without regard to sex, gender identity, sexual orientation, race, color, religion, national origin, disability, protected Veteran status, age, or any other characteristic protected by law.
Show less ",1,0.09,0.17
25,Other,Hospitals and Health Care,"Company Description




When we say “our community” we mean it.




UMMC Midtown Campus, one of two campuses of the University of Maryland Medical Center, has had a long history of working to keep our community healthy and has grown to become a trusted teaching hospital for medical and surgical care in Baltimore City.




Located in Baltimore’s cultural center near the historic Mount Vernon neighborhood, UMMC Midtown Campus is a 180-bed, community teaching hospital with a focus on helping people manage chronic diseases, including diabetes, hypertension, pulmonary conditions, and infectious diseases.




Job Description




General Summary




Under general supervision, assesses, plans, implements and evaluates the diabetes education program at the Joslin Diabetes Center at UMMS. Plans and conducts continuing education programs in diabetes for allied professionals and the general public. Functions as a resource for patients and other healthcare professionals within and outside the Medical Center.




Principal Responsibilities And Tasks




The following statements are intended to describe the general nature and level of work being performed by people assigned to this classification. They are not to be construed as an exhaustive list of all job duties performed by personnel so classified.




Applies clinical process and education of patients and families including assessing needs of patient, formulating an educational plan, implementing the plan, and revision as needed.
Communicates information and coordinates patient care with appropriate members of the health care team.
Proficiently utilizes a variety of educational approaches including one-on-one instruction, group classes, and audio-visual presentations.
Delivers educational services in both inpatient and outpatient settings.
Assists with support groups and continuing education programs for patients and community.
Acts as a resource in diabetes related issues for health care professional, patients and their families.
Maintains a positive relationship with staff, patients, physicians, and hospital personnel.
Assists in medical management of patients in accordance with policies and procedures.
Coordinates participation in research programs and studies, as assigned.
Ensures that the clinical education components of the program meet the quality assurance standards as established the Center and hospital.
Participates in referral development activities that contribute to the growth of the practice.
Follows appropriate policies, procedures and lesson plans, as provided by the Joslin Center - Boston, and assists with review and revision on an annual or as-needed basis.
Attends educational programs and seminars focusing on the management of diabetes and related problems, and diabetes education.
Performs related duties as required.




Qualifications




A Bachelor’s degree in healthcare related discipline or equivalent is required.
Certification as a Diabetic Educator (CDE) is preferred.
A minimum of two years experience in diabetes care and education is required. One year in a community health or ambulatory care setting is preferred.
Ability to demonstrate knowledge and skills necessary to provide care appropriate to the age of the patients served on the assigned unit. The individual must demonstrate knowledge of the principles of growth and development over the life span and possess the ability to assess data reflective of the patient’s requirements relative to his or her age-specific needs and to provide the care needed as described in the unit/area/department policies and procedures.
Highly effective verbal and written communication skills are necessary in order to educate patients and their families and work with medical, nursing and management staff. Must have demonstrated ability in public speaking.




Working Conditions




Weekend, shift work, holiday, evening, on-call, and overtime may be required.
Work is primarily performed in a standard office environment, but also requires contact and work with staff in a clinical setting.




Patient Safety




Ensures patient safety in the performance of job functions and through participation in hospital, department or unit patient safety initiatives.




Takes action to correct observed risks to patient safety.
Reports adverse events and near misses to appropriate management authority.
Implements policies, procedure, and standards consistently in the performance of assigned duties.
Develops effective working relationships and maintains good communication with other team members.
Identifies possible risks in processes, procedures, devices and communicates the same to those in charge.
Show less ",1,0.15,0.3
26,Human Resources,Non-profit Organizations and Mental Health Care,"The Child Mind Institute is seeking a Learning Manager for the Youth Mental Health Academy (YMHA). The Learning Manager will assure that the internship and curriculum experiences helps students develop the passion, knowledge, skills, attitudes and work habits to pursue a career in the mental health field. Responsibilities include program planning, development, and evaluation; related class instruction; on the job instruction to provide students with a quality program experience. YMHA is being developed and operated through a contract to CMI from the State of California, initially for a three-year period beginning in 2023.




The YMHA is a unique, exciting, multifaceted program with the goal of identifying underrepresented ethnoracially minoritized and disadvantaged high school students and helping them realize their potential to join the workforce with careers in mental health clinical practice and research. High school-aged participants in the YMHA will be provided a range of workshops, internships, immersive mentoring, and networking opportunities. To succeed at this goal will require creativity, imagination, and energy to build novel opportunities and services in California, with the possibility of a very broad impact on and transforming child and adolescent mental health. In addition, this position provides the opportunity to engage with a broad range of clinicians, policy-makers, researchers, and community leaders.




The Learning Manager will work with YMHA Leadership to manage the day-to-day operations of the Curriculum, Internships, and Peer Mentoring Core. They will have responsibility for operations of the core, including assisting in curriculum design, planning, program implementation, compliance, and mentor and student engagement.




The Learning Manager must have the ability to multi-task in a high-energy environment. The ideal candidate will have extensive experience managing programs that have been built from the ground up and a willingness to travel throughout California to monitor quality of the implementation.

Reporting to the Project Manager, YMHA, this is an exempt, full-time position based in Los Angeles.




The Child Mind Institute is proud to be named a Great Place to Work-Certified company! Our competitive compensation and benefits include medical insurance, 401(k) with match, flexible work schedules, paid parental leave, dependent care and discounted tickets and entertainment perks program. For more information about our benefits, please visit our employee benefits website.




Responsibilities will include, but are not limited to:

Assist in planning, developing and implementing strategic goals and program initiatives
Oversee the creation of a project based, mental health curriculum that inspires students and builds their confidence to develop mental health related careers.
Design content that deepens participant knowledge of mental health and utilizes best instructional practices.
Apply knowledge of instructional system design, available technology and youth learning theory to propose, design and develop learning solutions that are cost-effective and meet business learner needs
Develop and implement systems and processes for effective coordination and delivery of in person and distance learning course implementation across multiple modalities.
Manage and distribute course materials needed to attend and engage in learning programs.
Partner with subject matter experts and other stakeholders to provide input for training content
Coordinate the selection and development of instructional materials. Digital resources and implementation of internship curriculum.
Research, identify, and process new sources of career/work related opportunities and career readiness.




Qualifications:

Minimum 4 years of curriculum/program experience
Bachelor's degree required
Experience with BIPOC and LGBTQ youth population required
Prior experience with community-focused and/or educational initiatives preferred
Exceptional interpersonal, communication (written, verbal) and collaboration skills
Demonstrated management and organizational skills
Demonstrated strategic, critical thinking and problem-solving skills
Comfortable in a fast-paced environment and able to adjust workload based upon changing priorities
Able to share in morale building and group support to achieve goals and objectives




The anticipated salary range for this position is $68,032 - $95,000 annually. Salary is based on a range of factors that include relevant experience, knowledge, skills, other job-related qualifications, and geography.




Special Considerations:

All new hires must be vaccinated and must stay up to date with vaccines against the COVID-19 virus unless they have been granted a reasonable accommodation for religion or disability. If you are offered employment with CMI, this requirement must be met by your date of hire, unless a reasonable accommodation for exemption is received and approved by CMI.




The Child Mind Institute is an equal opportunity employer and does not discriminate in employment based on race, religion (including religious dress and grooming practices), color, sex/gender (including pregnancy, childbirth, breastfeeding or related medical conditions), sex stereotype, gender identity/gender expression/transgender (including whether or not you are transitioning or have transitioned) and sexual orientation; national origin (including language use restrictions and possession of a driver's license issued to persons unable to prove their presence in the United States is authorized under federal law [Vehicle Code section 12801.9]); ancestry, physical or mental disability, medical condition, genetic information/characteristics, marital status/registered domestic partner status, age (40 and over), sexual orientation, military or veteran status, or any other basis protected by federal, state or local law or ordinance or regulation.

Show less ",1,0,0.12
