,Job Function,Industry,Seniority,Job Description,Segment,female,male
40,Manufacturing,"Transportation, Logistics, Supply Chain and Storage",Entry level,"Come be a part of something bigger!




Here Are Just Some Of The Great Benefits We Offer




Benchmark | Pyramid is a strong believer in offering our employees Work-Life Effectiveness through, practices, policies, and programs to help our employees achieve success at both work and home.




Full Time employees have access to Medical and Dental insurance to fit your needs
Benchmark University (You can grow both personally and professionally through on-line webinars and self-study courses)
401K match (Let us help you build your financial future)
Companywide Hotel Room Discounts (Who doesn’t love to get away)
Paid Time Off
Employee Assistance Program (We are here to support you)
Employee family events (bring the kids!)
Partnerships and discounts with major retailers such as AT&T, Verizon and Dish to name a few
Many more, please inquire for more details
INSERT PROPERTY SPECIFIC INFORMATION (i.e. Resort Marketing Details, Sign-On Bonus, Property Specific Benefits, etc..)




What You Will Have An Opportunity To Do




We are looking for a highly motivated individuals to join our team as a PBX Operator. The ideal candidate uses their engaging personality to create a memorable first impression for our guests as they call the resort/hotel. While answering the phones, the PBX Operator is a source of knowledge for the guest for everything about the hotel, its amenities, and the local area.




If you enjoy engaging with people from all over the world and making meaningful connections, as well as taking steps to “WOW” people, we want you! This is a tremendous opportunity for a driven person to grow a career in hospitality with a world-class property.




Your Role




To answer incoming calls within 3 rings and to direct calls throughout the resort providing courteous guest service, using guest name and responding promptly to guest questions, complaints or requests.
To dispatch all guest calls through radios or devices to the appropriate departments
Become fully familiar with the resort's outlets and services available to the guests and be able to provide accurate information on guest services at all times.
To obtain updated information daily on resort events and be able to accurately answer inquiries about these events.
Understand how to operate accurately the resort telephone system SMS system to provide maximum courteous and efficient telephone service to all customers.
To log and clear all guest calls into the HOT SOS system. Call back system to clear all calls (using guest name)
To follow up with all guest calls and complaints (using guests name)
Be able to perform concierge duties including restaurant reservations, resort activities, off property attractions
To Log and store all guest packages following all procedures
Maintain the PBX area in a neat and orderly manner.
Be familiar with the resort's emergency procedures to pay a key role in the event of an emergency.




What are we looking for?




High school diploma or equivalent
A strong desire to make an impact on other people
An outgoing and engaging personality
Computer skills
Excellent verbal and written communication skills
Ability to work in a fast-paced setting
Ability to stand for the duration of the shift
Must be available to work various shifts including weekends and holidays




Benchmark Hospitality is an equal opportunity employer. We celebrate diversity and are committed to creating an inclusive environment for all employees.




Actual compensation packages are based on a wide array of factors unique to each candidate, including but not limited to skill set, years & depth of experience, certifications and specific office location. This may differ in other locations due to cost of labor considerations.
Show less ",1,0,0
41,Management and Manufacturing,Truck Transportation,Mid-Senior level,"United Routes, a nationwide automotive logistics firm is looking to hire an account manager to join their team. We are a fast-growing, energetic company dedicated to vehicle & specialized shipping. We offer an excellent benefits package including an industry-leading PTO schedule along with medical benefits. The ideal candidate is an experienced professional with a strong motivation to drive results. Preferred: Prior experience within the General Freight or Automotive Logistics industry Base Salary $40,000 - $55,000 (Plus Commission) Candidate requirements: * Minimum 2 years experience in account management or sales position * Friendly, professional and positive attitude * Strong ability to problem-solve in complex situations * Strong computer skills (experience with CRM's, Gsuite and/or MS Suite) * High level of interpersonal and written communication skills * Ability to be a team player and adjust according to company needs * Strong sense of urgency Job Description: * Develop a deep understanding of client's core objectives and challenges * Maintain strong, long-lasting client relationships * Act as an advocate for your assigned portfolio and work with internal departments to ensure that client needs are understood * Generate revenue growth by negotiating RFQ's with existing clients * Develop your current portfolio by identifying additional transport opportunities * Schedule (and travel for) in-person meetings/dinners/entertainment/events (Temporarily paused) * Respond to existing customer demands in a high paced environment in and out of office hours * Manage current customer requests when incumbent Sales Rep. is/are unavailable * Collaborate with internal operations team to ensure a smooth process for your clients Please reply with resume Company Description We are a fast-growing, energetic company dedicated to vehicle & specialized logistics.




We are a fast-growing, energetic company dedicated to vehicle & specialized logistics.
Show less ",1,0.37,0
42,Other,Maritime Transportation,Not Applicable,"Job Summary: Rio Controls & Hydraulics is looking for an experienced hydraulic technician with potential growth into a supervisor or management role of your own location in Staten Island. Currently we have a healthy book of business with one mid level technician and looking to bring in experienced hands on hydraulic technician to help in growing the business. Great small company environment. We currently have 5 locations around the nation where we support each other location as needed. Each location operates autonomously. Management in each location is responsible to meet budget goals and quality standards without corporate interference. Must be a self starter, motivated, operate with integrity and fairness and be customer orientated. Great Compensation! Responsibilities: * Installation, maintenance and repair of hydraulic systems and components * Read blueprints and diagrams while troubleshooting and diagnosing problems * Perform preventative maintenance to avoid operational failures of hydraulic systems * Welding, metal fabrication and electrical assembly * Provide drawing review and suggestions to investigate and repair of hydraulic equipment * Disassemble and reassembly hydraulic components * Operate drill press, lathe, grinders, or other machines to modify parts Qualifications: * Experience in fabrication and assembly/repair of hydraulic systems * Ability to effectively read hydraulic schematics. * Experience with different hydraulic components, both service and troubleshooting * Experience with replacing seals and repair of hydraulic cylinders * Must be willing to work odd hours in a non - climate control and onboard towboats, tugboats, offshore supply vessel, 24-7-365 Perks: * Cell phone provided * Company Truck provided Company Description Rio Marine is a leader in the marine industry, offering comprehensive services from electrical and barge maintenance to hydraulics and electronics. With our team of over 185 expert service technicians on call 24/7, we are committed to providing fast and responsive service that reduces downtime while helping you maintain your equipment with minimal effort. Our experienced professionals handle all marine needs, from small jobs like basic repairs or upgrades to complex tasks such as full refits and installations. We offer a full range of products and services to meet your specifications. From vessel maintenance to hydraulic systems and more, Rio Marine has you covered for whatever new construction, maintenance, or repair job you need to be done.




Rio Marine is a leader in the marine industry, offering comprehensive services from electrical and barge maintenance to hydraulics and electronics. With our team of over 185 expert service technicians on call 24/7, we are committed to providing fast and responsive service that reduces downtime while helping you maintain your equipment with minimal effort. Our experienced professionals handle all marine needs, from small jobs like basic repairs or upgrades to complex tasks such as full refits and installations. We offer a full range of products and services to meet your specifications. From vessel maintenance to hydraulic systems and more, Rio Marine has you covered for whatever new construction, maintenance, or repair job you need to be done.
Show less ",1,0,0
43,Strategy/Planning and Information Technology,"Transportation, Logistics, Supply Chain and Storage",Executive,"About Barrett Distribution

Since 1941, Barrett Distribution has provided customized third-party logistics, omni-channel distribution, and direct-to-consumer fulfillment services for customers in a variety of industries. Our growing company is home to over 1400 employees throughout the United States, with key logistics centers in Greater Boston, New Jersey, New York, Baltimore, Memphis, Dallas, and California.

At Barrett, we truly value our employees and culture, and realize that the way to attract and retain the very best workforce is by providing competitive compensation, excellent benefits and a gain-share program that every employee participates in.

If you’re skilled at what you do, thrive in collaborative, team-first environments, and are looking for a home in a company that promotes from within and invests in its employees, Barrett Distribution is the place for you!

The compensation range for this position is $170K to $190K, depending on experience.

Summary

The General Manager, reporting to the Regional VP of Operations, is responsible for overall management of the operation and facility(s). Will oversee all business activities, support staff development, enhance efficiency, drive sales and improve revenue, maintain relationships with clients, enhance the organization's image, and meet overall growth objectives.

Principal Duties And Responsibilities

Consistently applies Barrett’s core values of Always Better, Utmost Integrity, Dedication to the Customer, I am an Owner, and Open and Honest relationships in all interactions and decision making. Is responsible in knowing and acting in accordance with Barrett’s vision to WOW our customers, partners, and fellow employees with every interaction.

Accountable for the safe, efficient, and economical operation of the warehouse in the areas of staffing, warehouse operations, maintenance of the facility and equipment, implementation of safety, security, housekeeping and sanitation programs, budgeting, customer service and inventory control.
Provide leadership and strategic visions to the operation by daily oversight of all facets of the operation as well as developing quarterly, annual and long-range plans for the operation.
Effectively communicate the company’s vison and strategic annual objectives to all staff members.
Communicate with Regional VP of Operations of issues affecting costs, service capabilities, effectiveness and efficiencies, as well as issues noted during Performance Improvement audits.
Responsible for building and achieving P&L, SLAs, and KPI goals for facility; responsible for reporting progress of same.
Develop, prioritize and direct programs to ensure the efficient and cost-effective operation and utilization of the warehouse.
Handle escalations of challenging issues related to clients of all sizes; ensure client needs are met or exceeded while also protecting the interests of the company
Accountable for ensuring the appropriate processes are followed when identifying and investigating the root cause of Nonconformance Reports; ensures the implementation of Corrective Actions, if needed.
Responsible for the preparation of budgets, revenue projections, and account analysis.
Utilize measurement systems to evaluate productivity, quality and variance from standards.
Develop space utilization plan to optimize facility storage to minimize the inefficient utilization of space.
Provide for good stewardship of the assets of the business and understands the importance of relationship building and maintaining clear lines of communication with customers and employees
Establish productive relationships with internal partners, including but not limited to Regional Vice President of Operations, Strategic Account Management, Business Process Optimization, Customer Service, Finance, and Human Resources, to identify business opportunities and resolve issues.
Attract, develop and retain high performing, diverse talent within the business; build future leaders through mentoring and serving as a role model
Develop and communicate clear goals and expectations for their leadership team; provide ongoing training and development opportunities.
Support the hiring, onboarding, training and development of all warehouse staff.
Ensure daily goals, pertinent facility information and company-wide communications are clearly communicated to all staff members in a timely, effective manner.
Champion the GGOB program in the facility. This includes the effective communication of GGOB targets and results and the oversight of mini games to improve productivity and/or to improve our customer’s experience.
Foster a culture of continuous improvement and support improvement initiatives by encouraging collaboration and teamwork amongst all staff members.
Ensure compliance with OSHA and MSDS regulations.
Monitor warehouse operations continually to ensure the warehouse is neat, secure, safe, and well organized
Maintain physical condition of warehouse by planning, inspecting and issuing work order requests for repair or replacements
Perform other related duties as needed.

Education

Bachelor’s degree in Business Administration, Logistics, Engineering, or other industry-related field required. Master’s preferred. (May consider 15+ years of industry related experience in lieu of college degree)

Experience

10+ years’ experience in senior leadership roles in a large - single or multi-client - omni-channel distribution facility.
Experience in eCommerce fulfillment utilizing varying degrees of automation including robotics (Goods to Person or Person to Goods), large-scale conveyance solutions, etc.
Familiar with servicing large Retail and Wholesale customers ie, Amazon, Walmart, DSG, etc. with full understanding of vendor compliance requirements.
Facility start-up experience implementing new technologies to service large scale distribution solutions.
Demonstrated track record of developing high functioning teams in new facility start up.
Working knowledge of Inventory control, cycle counts, and a proven track record of inventory accuracy.
Proficient with all Microsoft applications. Working knowledge of 3PL warehouse operations, supply chain and transportation preferred. Previous experience with Synapse WMS system preferred.
Ability to read, write, and communicate effectively in English (Bilingual Spanish/English skills preferred).
Must demonstrate high level of interpersonal and communication skills with ability to work well under pressure and problem solve across a variety of business processes. Able to balance competing priorities, complex situations, and tight deadlines. Strong emphasis on organizational skills and attention to detail.

The above statements are intended to describe the general nature and level of work performed by employees assigned to this classification. They are not to be construed as an exhaustive list of all job duties performed by the personnel so classified.

Barrett Distribution Centers is an equal opportunity employer. All qualified applicants will receive consideration for employment without regard to race, color, religious creed, retaliation, national origin, ancestry, sexual orientation, gender, gender identity/expression, mental or physical disability, genetic information, choice of health insurance, marital status, age, veteran status or any other basis protected by law.
Show less ",1,0,0.1
44,Management and Manufacturing,"Transportation, Logistics, Supply Chain and Storage",Mid-Senior level,"R.A.S. Logistics is a provider of final mile delivery services and a growing leader in the logistics industry. Our success is thanks, in part, to our exceptional team of professionals with the desire to exceed customer expectations! If you are looking for a great opportunity in the Jacksonville, FL area, we are currently hiring for an Operations Manager to lead our team!




The Operations Manager works with our office administrators, warehouse associates, and delivery teams to ensure the consumer has the best possible final mile experience through the following responsibilities.




Support daily operations and workflow processes.
Manage multiple teams of dedicated carrier delivery drivers in addition to office administrators and warehouse associates
Ensure operations is performing efficiently and meeting customer expectations
Develop and maintain relationships with customers in the Albany market
Resolve operational issues in an efficient, fair and expeditious manner




Final mile experience is preferred but not required. RAS Logistics employees enjoy competitive pay and great benefits including medical, dental, vision, free life insurance, free disability insurance, excellent 401k match, Paid Time Off and Floating Holidays!
Show less ",1,0,0
45,Distribution and Supply Chain,Truck Transportation,Entry level,"General Laborer PeopleReady ofÂ Naples, FLÂ is now hiring General Laborers!Â As a General Laborer, you will do a variety of work in different industries.Â Â

Apply today and you could start as soon as tomorrow. No resume or interview required â€“ yep, you read that right. As a PeopleReady associate you'll benefit from:

The freedom to work where you want, when you want and as often as you want.
Next-day pay* for many of our open positions.
The ability to choose long-term positions for steady work or short-term positions if you just want some extra cash.
The ability to sign up for jobs right from our mobile app, JobStack! Pay Rate: The pay rate for this job is $11 - $12 / Hour What you'll be doing as a General Laborer:
Perform general site clean-upÂ
Move, load, or unload materialsÂ
Assist in light construction if necessaryÂ Â
Remove debris and trash from work siteÂ
Some specialized tasks may require on-the job trainingÂ
Use equipment, depending on the jobsite/assignmentÂ

Available shifts: Shift timings -Â 1st Shift (Day) Job requirements:

Strong work ethicÂ
Able to stand on your feet for long periods of timeÂ
Able to work in all weather conditionsÂ
Able to lift light to heavy objectsÂ Â
Some assignments have additional screening requirements, such as background checks and/or drug testsÂ

Ready to take control of the way you work? Complete our application to join the PeopleReady team today. In case you missed it, no resumes or interviews are required! \#TIER1 PeopleReady is an equal opportunity employer, and we value diversity. We do not discriminate based on race, religious affiliation, color, national origin, gender, age, marital status, sexual orientation, gender identity, veteran status, disability, or any other basis protected by law. We will get to know you and connect you with jobs that match your skills, experience and preferences. We work hard every single day to find jobs so each employee has opportunity and variety in their work.
Show less ",1,0,0
46,Management and Manufacturing,Truck Transportation,Internship,"Job Description




Do you want to change the world? It’s a question we take seriously at TMC Transportation where everything we do is focused on providing what we call “Destination Excellence”. Through a people-first culture that thrives on collaboration, creativity, and commitment we engage the world’s best companies’ supply chains differently.




Are you a forward-thinker, a lead innovator, are you driven by success and achievements? Do you believe in doing things right the first time? Do you believe in fair and ethical business practices? Do you have the desire to become successful in a sales position that is built on sustainable partnerships with long-lasting customers?




If you answered yes, then our Logistics Sales Development Internship Program could be the right fit for you.




Here at TMC Transportation everything we do is focused on providing what we call Destination




Excellence.




Destination Excellence has many applications as it is cultural to our employee-owned company, but at its core it means we believe in the constant pursuit of continuous improvement. We are not satisfied with greatness. Our Destination is Excellence.




As the newest Logistics Sales Intern here at TMC logistics you will be integral to our success while having the opportunity to work with the most talented supply chain professionals in the industry.




What You Will Be Working On




Uphold TMC’s Core values of Integrity, Quality and Dedication to Excellence
Research new leads, uncover new opportunities and work with prospective customers to utilize




TMC’s world class logistics offerings.




Leverage outbound leads thru cold calling, email, and sales prospects.
Collaborate with our internal teams to craft and propose best in class brokerage solutions.
Meet and exceed sales goals as you are surrounded by experience and support.
Use Salesforce and other sales tools, build prospect lists, and share results with the sales team.
Develop a strong pipeline working with Account Executives via phone and email communications.
Learn and maintain in-depth knowledge of TMC’S platform, industry trends, and competition.
Have a great time in a hard-working yet casual environment and be the face of TMC.




Most importantly, you will receive an education in Sales, learn about Transportation, and build self-confidence in an industry that has a multitude of opportunities for great careers.




All TMC's internships are educational where you will be in a position to make a difference to the company.




You will be doing real work each day and learn values associated with sustainable business built on good ethics and great customer service
Show less ",1,0,0
47,Management and Manufacturing,"Transportation, Logistics, Supply Chain and Storage",Mid-Senior level,"R.A.S. Logistics is a provider of final mile delivery services and a growing leader in the logistics industry. Our success is thanks, in part, to our exceptional team of professionals with the desire to exceed customer expectations! If you are looking for a great opportunity in the Allentown, PA area, we are currently adding an Operations Manager to our team.




The Operations Manager works with our office staff and delivery teams to ensure the consumer has the best possible final mile experience through the following responsibilities.




Support daily operations and workflow processes.
Manage multiple teams of dedicated carrier delivery drivers in addition to office staff
Ensure operations is performing efficiently and meeting customer expectations
Develop and maintain relationships with customers in the Allentown market
Resolve operational issues in an efficient, fair and expeditious manner




Final mile experience is preferred but not required for a candidate with strong customer service and team building skills. RAS Logistics employees enjoy competitive pay and great benefits including medical, dental, vision, free life insurance, free disability insurance, excellent 401k match, Paid Time Off and Floating Holidays!




R.A.S. Logistics is proud to be an Equal Opportunity employer.
Show less ",1,0,0
