,Job Function,Industry,Seniority,Job Description,Segment,female,male
21,Administrative,"Transportation, Logistics, Supply Chain and Storage and Internet Publishing",Not Applicable,"Our Story




Complex conditions like COPD and congestive heart failure (CHF) are incredibly challenging to manage. People who are already struggling with isolation and the burden of these conditions become increasingly frustrated and disengaged, eventually falling through the cracks and landing in the ER. This cycle perpetuates poor health outcomes and excessive medical costs.




At NuvoAir we believe people deserve a better healthcare experience.




Our team embraces the challenges that others can’t or won’t - by integrating our clinical team with technology, NuvoAir creates a highly empathetic and personalized experience for each patient. This model not only helps patients in their homes, it also supports patients through our clinical trial partners.




Living our Company Values




Patient obsessed: Every decision is made with our main focus in mind - improving the lives of patients
Act like an owner: Ownership means we speak up, share ideas, give feedback, and are all accountable for growth
Focus on what matters: Creating meaningful solutions to challenging healthcare problems requires simplicity, clarity, and using our unique leverage
Build to learn: Failing courageously is a virtue that drives learning and stems from an innovative spirit
Practice confident humility: We aim to hold ourselves to the highest standards of humility, curiosity, transparency, and personal development





Where you’ll see your impact:




Reporting directly to Director, People Operations, you'll have a great deal of exposure to senior leadership and have a direct impact on the business.




What you’ll be responsible for:




Scheduling sales / revenue calls for Senior Leadership team
Maintains a master calendar of appointments, meetings and other important dates
Sorting and scanning mail
Book conference rooms / reservations at specific locations
Monitoring email and calendar management for specific senior leadership members
Assisting Senior Leadership team with administrative tasks, travel arrangements, ect





This may be a fit if you have:




Strong written and verbal communication skills
Experience working in a fast paced environment while multi-tasking
Ability to work in a fast-paced environment
Looking for part time hours 3 days per week ideally M/W/TH, 4 hours/day
Located in the Boston area to come to the office





You’ll love us because:




Mission driven culture that’s recognized by “Best Places to Work” awards
A global, diverse team that works hard without taking ourselves too seriously
Competitive salary - an annual market rate review ensures our compensation bands align with Series A market salaries
Flexible work environment - there’s no “standard” 9-5 here
Unlimited PTO - take time to recharge when you need it
Equity that’s venture-backed by top, global VCs - when we win, we win together
Medical, Dental, and Vision benefits - so you can take care of yourself and your family
Retirement plan + company match
Annual Learning & Development stipend - your professional growth is important!
As a remote-first company with hybrid options, we are set up to hire in the following states: MA, GA, NJ, PA, NH, FL, TX, CO, CA





Building a diverse team is critical to our success:




At NuvoAir, building a diverse team isn't a lofty statement or goal, it's a necessity, and it's something we actively practice and talk about. We do not tolerate discrimination or harassment based on race, color, age, religion, sex, gender, disability status, sexual orientation, gender identity or expression, or any other basis covered by appropriate law. NuvoAir will provide reasonable accommodations for qualified individuals with documented disabilities.




What to expect from our interview process:




Our team’s impact is felt globally as we help patients with cardiopulmonary diseases better understand and manage their health. Every member of our team adds value as we work towards a better healthcare experience for all. Because of this, it’s not enough that we hire mission-oriented people who are self motivated. We also need to grow a team that aligns with our company values (listed above!) and who will be successful in startup life… it’s not for everyone and that’s okay!




Show less ",1,0.16,0
22,Administrative,"Transportation, Logistics, Supply Chain and Storage",Mid-Senior level,"Are you detail oriented with killer follow-up skills? Do you love projects and processes and find yourself being called the resident guru on all the things? Do you thrive in a role that offers variety and a fast pace? Are you a confident, proactive self starter who is always thinking ahead? ELITE Transit Solutions is looking for an experienced Executive Assistant to join us in our Scottsdale office!

About The Role-executive Assistant

The primary function of the Executive Assistant is to ensure that the office and offsite office properties (condominiums, etc.) function in a smooth and efficient manner. The Executive Assistant will also provide administrative and operational support to the CEO. It is also the duty of the Executive Assistant to exhibit positivity and approachability in all daily operations as it relates to overseeing the general administrative function and activities of the office.

This is a fully in-office role with a schedule of Monday-Friday 8:00am-5:00pm

About Us

ELITE Transit Solutions is a rapidly growing third-party logistics (3PL) company with an office in the heart of Scottsdale's dynamic Old Town neighborhood. Surround yourself with highly motivated individuals who bring hustle and heart to work every day! At ELITE, we match our shipping partners with the best carriers possible to push the supply chain forward and provide the top customer service in the biz.

Our proprietary technology is pushing us forward & there are big things on the horizon!

Come be part of our team and build something Distinctly ELITE .

Perks

Benefits (medical, dental and vision) start the first of the month following your start date!
Student Loan Reimbursement (up to $1200/year)
9 Paid Holidays
Mental Health Floating Holiday
Diversity Floating Holiday-take time for unique celebrations!
401(k) with match
Parental Leave
Door DashPass for Work
Working Advantage Discount Program
Dell Discount Program
Employee Referral Program

Atmosphere

Modern comforts -open air with couches, lounges, and natural light…no cubicles here!
Competitive spirit -take a break and challenge your neighbor to an office competition (pool or ping pong anyone?)
Casual dress -You do your best work when you’re comfortable. Our offices have a casual dress code.
Free Bevvys- Fuel up with free coffee, tea, and snacks throughout the day. After your shift, pour a pint from our draft beer selection.
Growth opportunity -ELITE is rapidly expanding! Get yourself on the fast track to management.
Collaborate- We work in teams, toward one goal. Bring your best ideas to the front!

Roles And Responsibilities

Performs a broad range of professional and personal administrative support duties to ensure executive administrative work is being managed timely and efficiently.
Assists the CEO with the following tasks: calendar management and scheduling, reviewing, prioritizing, and responding to emails, taking notes at meetings, and providing summaries.
Prints, assembles, files, and organizes documents for executive staff.
Performs duties such as ordering office supplies, opening packages, preparing packages for shipping, and opening general company mail for appropriate distribution.
Ensures office visitors are welcomed and provided with all the items needed to easily access the office and corporate condo during their travels.
Serves as a leader and planner on office committees related to special events, i.e., Culture Club.
Promotes an engaging, positive, and fun office environment.
Makes travel arrangements for staff members including communication of confirmations and travel instructions; maintains travel reporting
Manages the business and relationship of any assigned external vendors.
Ad hoc projects varying from small to large scale, which could involve assembling furniture to organizing office outings
New hire concierge-print/assemble new hire training materials, welcome new hires, and provide an office tour, order new hire lunch, be a resource to new employees as they transition into the organization

Skills And Requirements

Excellent verbal and written communication skills.
Excellent interpersonal and customer service skills.
Organizational skills, attention to detail and the ability to multi-task
Time management skills with a proven ability to meet deadlines.
Takes initiative on projects/tasks and completes with minimal direction
Is a Go-To Person while also being a team player
Previous office manager or administrative assistant experience is preferred.
Proficient with Microsoft Office or related software.
Ability to lift up to 50 lbs.
High school diploma or equivalent required.

We are an Equal Opportunity Employer

Elite Transit Solutions, and its subsidiaries, are proud to be equal opportunity employers that evaluate qualified applicants without regard to race, color, national origin, religion, sex (including pregnancy), age, marital status, sexual orientation, veteran status, gender identity or expressions, or other characteristics protected by law. Elite Transit Solutions also makes reasonable accommodations for individuals with disabilities who are otherwise qualified to perform a job unless such accommodations would impose an undue hardship.
Show less ",1,0,0
23,Administrative,"Transportation, Logistics, Supply Chain and Storage",Entry level,"R.A.S. Logistics is a leader in the logistics industry providing final mile delivery services. We are currently recruiting for an Office Administrator in our Richfield, WI facility. R.A.S. partners with multiple name brand companies in diverse markets and we pride ourselves on exceeding customer expectations.




Office Administrator responsibilities include but are not limited to the following.




Maintain organization of the office and delivery documents
Assist where needed with office tasks
Contact customers and notify of product availability
Reschedule customer deliveries when required
Assemble route paperwork
Communicate with delivery teams




Office Administrator requirements include the following.




Ability to remain professional and courteous with customers and co-workers
Excellent verbal and written communication skills
Exceptional team player with the confidence and integrity to earn customer and internal confidence quickly
Previous customer service experience preferred
Knowledge of Microsoft Office and Windows based applications
Strong organizational skills
Flexibility to work additional hours, if needed




Office Administrator benefits include the following.




Excellent base wage
Insurance available 1 st of month after 60 days; Retirement plan available 1 st of month after 90 days; Retirement match provided after 1 year
Affordable Anthem BCBS Medical, Dental and Vision Insurance.
Company provided life insurance and additional voluntary life insurance available.
Company provided short and long term disability.
Excellent 401k match of 100% on first 3% then 50% on next 2%




R.A.S. Logistics is proud to be an Equal Opportunity employer.
Show less ",1,0,0
24,Administrative,Truck Transportation,Entry level,"Mission Assignment

The Data Entry Specialist is responsible for ensuring that loads are correctly entered through HubTran software in a timely and accurate fashion to meet cut-off times and performance targets.

Key Roles & Responsibilities

Review and correctly label, group and enter documents in Hubtran to meet daily workload and targets.
Utilize TBS software in accordance with HubTran to identify and correctly process potential duplicate loads.
Meet or exceed all daily, weekly and department goals.
Provide feedback to lead and team on how you will accomplish weekly goals.
Use all the resources and software TBS provides to better accomplish tasks.
Maintain communication with Team Lead and members through Teams chat daily.
Promotes and fosters a positive and supportive environment that is committed to the success of the department, peers and the overall goals of TBS.
Understand and keep current on the latest procedures for department and company.

Personal Attributes & Requirements

Excellent customer service and people skills meaning polite, responsive, knowledgeable and follows through with tasks.
Outstanding communication skills (both written and verbal) regardless of organizational level.
High level problem solver and multi-tasker with the ability to independently prioritize and complete tasks.
High level of attention to detail.
Dependable with exceptional attendance and time management skills.
Flexible and highly self-motivated team player.
Willing to work overtime if required.
Strong willingness to respect and support the hierarchy of the company.

Qualifications, Education & Special Requirements

High School Diploma or Equivalent, College Degree Preferred.
Industry knowledge of transportation, factoring and finance preferred.
Highly skilled in computer, electronic communication, and technology proficiencies with ability to quickly learn new software, applications, systems, and operate office equipment.
Strong knowledge of Excel (spreadsheets), Microsoft Outlook, Word, and Power Point.
Ability to move in and out and around the office, including furniture and ability to access file cabinets, office machinery, etc.
Capable of constantly (i) operating a computer, keyboard, and mouse; (ii) viewing monitors, and (iii) working other office equipment, such as a calculator, copy machine, computer printer, fax machine, overhead project systems.
Ability to type efficiently and effectively without excessive errors.
Capacity to learn quickly and accurately apply and communicate the knowledge.
Show less ",1,0,0
25,Management and Manufacturing,"Transportation, Logistics, Supply Chain and Storage",Executive,"We are seeking an organized and detail-oriented Warehouse Manager to oversee our warehouse operations. You will schedule warehouse staff and delegate tasks to ensure efficient receiving and shipment of goods. When shipments arrive or before deliveries leave the warehouse, you will check inventory with orders to check that the shipment is complete. It will be vital for you to input inventory and maintain current records into our database. Our ideal candidate has at least seven years of experience in a warehouse, with at least one year in a supervisory role. Warehouse Manager Duties and Responsibilities * Create and manage receiving, warehousing, and distribution processes and procedures, and confirm staff compliance. * Conduct physical counts of products and reconcile with data to maintain adequate inventory levels. * Develop and monitor procedures for safety and security of warehouse environment and all goods. * Inspect all warehouse equipment and order repairs and replacements when required. * Prepare an annual budget, plan out expenses, analyze any variances, and make necessary corrections to help company achieve financial objectives. * Recruit, hire, and train new warehouse employees * Oversee all warehouse employees, including creating schedules, providing coaching and mentoring, and issuing corrective action when required. Warehouse Manager Requirements and Qualifications * High school diploma or equivalent; associate or bachelor's degree preferred * 7+ years of experience in a warehouse * Familiarity with inventory control and management * Knowledge of proper safety procedures, equipment maintenance, and warehouse best practices * Strong leadership and interpersonal communication skills, with the ability to manage and develop a team. * Flexible schedule Company Description At TH Logistics, our team serves as packaging and supply chain experts with an operational edge. As a minority-owned packaging, third-party (3PL) and fourth party (4PL) service provider, our team is made up of seasoned experts who deeply understand supply chain management. Our Network: We have offices along the East Coast, but our footprint expands across the entire United States. Whether you need warehousing and distribution services, transportation management, transload services or contract packaging, our team can deliver. Our Mission: We improve the efficiency and outcomes of all of your projects across the supply chain network. Everything we do should enhance your brand and get it into the eyes and hands of your customers.




At TH Logistics, our team serves as packaging and supply chain experts with an operational edge. As a minority-owned packaging, third-party (3PL) and fourth party (4PL) service provider, our team is made up of seasoned experts who deeply understand supply chain management. Our Network: We have offices along the East Coast, but our footprint expands across the entire United States. Whether you need warehousing and distribution services, transportation management, transload services or contract packaging, our team can deliver. Our Mission: We improve the efficiency and outcomes of all of your projects across the supply chain network. Everything we do should enhance your brand and get it into the eyes and hands of your customers.
Show more ",1,0,0.21
26,Human Resources,"Transportation, Logistics, Supply Chain and Storage",Not Applicable,"Overview

Human Resources Generalist

See yourself at Wallenius Wilhelmsen. We collaborate, we care, we challenge every day to keep the world in motion and transform logistics into a zero- emissions, carbon-free industry. Join us and make it happen!

Are you a highly collaborative HR generalist? Ready to take on a new role that promises to never be boring? Apply today!

Responsibilities

WHAT YOU'LL DO

Manage benefits administration and reporting; communicate benefits information to employees
Support recruitment and talent acquisition,
Oversee new employee orientation and training including onboarding, sexual harassment prevention
Guide career exploration with managers and employees

Qualifications

WHAT YOU'LL NEED

A solid understanding of employee investigations to resolve issues
three to five years of HR experience, or seven years of experience in the HR field, or any similar combination of education and experience
Ability to communicate clearly and effectively
System savvy - able to quickly learn our HR systems

EVEN BETTER IF YOU HAVE

Experience with HRIS, iCIMS, and Payroll systems; Kronos is a plus

About You

You're an experienced HR professional who thrives on leading change and partnering with the business to achieve results

About Us

At Wallenius Wilhelmsen and across our businesses, salaries are determined by position, level, location, and similar factors. The pay or salary range listed on each job posting reflects the minimum and maximum projected rate of pay for the specific position across our United States locations. Equally as important, as a team member, individual earnings may consider knowledge, skills, abilities, work location and related factors. The current salary range for this position is $60,000-$80,000. Wallenius Wilhelmsen team members are also eligible for annual merit-based salary adjustments, and participation in competitive benefit programs. Some roles in the company may offer an additional annual bonus. Additional details on salary or pay ranges and benefits will be available through the interview and employment process. Salary or pay ranges are separate from bonus opportunities and/or benefit plans. At Wallenius Wilhelmsen benefits and perks listed here may vary depending on the nature of employment with Wallenius Wilhelmsen and the country work location. This role will have access to medical, dental, and vision insurance, a 401(k) plan with company match, short-term and long-term disability coverage, basic and supplemental life insurance, and wellbeing benefits, among others. Full-Time U.S. based employees also receive scheduled paid holidays, floating holidays determined each year, as well as paid vacation and sick time.

Wallenius Wilhelmsen is an iconic shipping and logistics company with premium end-to-end supply chain management. Our vision is to empower people and markets through a sustainable flow of goods and services.

We transport and handle cars, tractors, trains, windmills, or even whole factories for some of the most well-known companies in the world. Our eyes will always be on supreme quality in everything we do, while moving towards zero-emission logistics. We are powered by nearly 8200 people, working on vessels and at ports, at vehicle and equipment processing centers, and offices in nearly 45 countries. When added up, the effort of our global workforce keeps the world moving.

OUR COMMITMENT TO DIVERSITY, EQUITY, & INCLUSION

We are a global group of people from diverse backgrounds and lifestyles. Wallenius Wilhelmsen is proud to be an equal opportunity employer committed to building a workplace where all contributors feel they can bring their best selves every day, learn from each other, and be appreciated. We recognize that Diversity, Equity, and Inclusion is central to our business outcomes because it touches every part of our operations and strategy. Our journey towards sustainable and integrated logistics compels us to attract people with diverse experiences, skills, and abilities.
Show less ",1,0,0
27,Management and Manufacturing,Truck Transportation,Executive,"We are seeking a experienced Vice President of Manufacturing. The ideal candidate will have a strong business mind, attention to detail, and proven experience building, managing and scaling a manufacturing organization based on strategic business requirements. ESSENTIAL FUNCTIONS: * Build, lead and develop a highly motivated and world-class team to achieve the goals of the company's manufacturing initiatives. * Champion a culture of continuous improvement to identify and implement efficiency and product enhancement opportunities. * Monitor supplier performance to assess ability to meet quality and delivery requirements. * Manage manufacturing process through product life cycle process including transfer to manufacturing, pilot build process scale-up and production manufacturing. * Develop and manage relationships with key suppliers and potential outsource manufacturers where appropriately aligned with commercialization plans. * Define and drive the operating approach to transition new products from R&D to manufacturing and build product transfer team. * Ownership of Bill of Materials including changes through the product life-cycle management Engineering Change Order process * Oversee the leadership of supply chain management, including negotiation, strategic planning and forecasting, cost reduction initiatives, quality control and consistent supply chain operations. * Lead the process to track in-process manufacturing performance including batch records, in-process component failures and analysis. * Ensure implementation of Quality Management Systems and document control in support of manufacturing including Complaint Review process * Partner with Development teams to ensure product manufacturability, develop process validation plans, and create process instructions and methods for all products and subassemblies. EDUCATION, SKILLS, & EXPERIENCE: * 12 years of progressive manufacturing leadership experience * Strong problem-solving, strategic-thinking, and critical analysis ability; able to make effective decisions and execute an appropriate course of action that complies with quality and regulatory requirements while supporting business objectives * Experience leading an in-house manufacturing team, required * Excellent negotiation, interpersonal and communication skills * Ability to travel 10-20% time both domestically and internationally * Strong understanding of supply chain cost and accounting principles required resumes to: resumesatpermantechcom Company Description The Best career move you'll ever make.




The Best career move you'll ever make.
Show less ",1,0,0
