,Job Function,Industry,Seniority,Job Description
29,Human Resources,Government Administration,Entry level,"Help Help Requirements Conditions of Employment

You must be a U.S. citizen to be considered for this position.
You must successfully pass a background investigation.
Travel will be required.
You must be able to obtain and maintain a Government credit card.
Selective service registration is required for males born after 12/31/59.
Please review ""Other Information"" section for additional key requirements.

To ensure the accomplishment of our mission, DHS requires every employee to be reliable and trustworthy. To meet those standards, all selected applicants must undergo, successfully pass, and maintain a background investigation for Public Trust as a condition of placement into this position. This may include a credit check after initial job qualifications are determined, a review of financial issues, such as delinquency in the payment of debts, child support and/or tax obligations, as well as certain criminal offenses and illegal use or possession of drugs (please visit: Mythbuster on Federal Hiring Policies for additional information). For more information on background investigations for Federal jobs please visit OPM Investigations .

Please ensure you meet the qualification requirements described below.

Qualifications

The qualification requirements listed below must be met within 30 days of the closing date of the announcement.

You qualify for this position at the IC-05 level (starting salary $42,870) if you possess the following: One full year of specialized experience equivalent to the next lower grade (IC-04) in the Federal Service. This experience may have been gained in the federal government, a state or local government, a non-profit organization, the private sector, or as a volunteer; however, your resume must clearly describe at least one year of specialized experience.

Specialized Experience For This Position Includes

Identifying and resolving recurring problems, discrepancies, and administrative errors recommending solutions to address recurring problems; AND
Advising employees on the completion of forms, deadlines and preparing recuring reports; AND
Reviewing, coding, and processing personnel requests/forms relevant to the specialty area(s);

OR

4 years education above high school

Experience refers to paid and unpaid experience, including volunteer work done through National Service programs (e.g., Peace Corps, AmeriCorps) and other organizations (e.g., professional, philanthropic, religious, spiritual, community, student, social). Volunteer work helps build critical competencies, knowledge, and skills and can provide valuable training and experience that translates directly to paid employment. You will receive credit for all qualifying experience, including volunteer experience.

Your application must show that you meet all requirements for this position. You may be found “not qualified” if you do not possess the minimum competencies required for the position.

NOTE: Qualifications are based on breadth/level of experience. In addition to describing duties performed, applicants must provide the exact dates of each period of employment (from MM/DD/YY to MM/DD/YY) and the number of hours worked per week if part time. As qualification determinations cannot be made when resumes do not include the required information, failure to provide this information may result in disqualification. Applicants are encouraged to use the USAJOBS Resume Builder to develop their federal resume. For a brief video on How to Create a Federal Resume, click here. NOTE: If you are using the USAJOBS Resume Builder, please insert the dates of employment in MM/DD/YY format at the top of the “Duties, Accomplishments, and Related Skills” text field for each period of employment included on your resume.

Current or former FEMA Reservists/DAE employees: To accurately credit your experience for these intermittent positions, make sure to list the dates (from MM/DD/YY to MM/DD/YY) of each deployment, along with the job title and specific duties you were responsible for during each deployment. Failure to provide this information may result in disqualification.

Education

NOTE: If you are qualifying based on education and/or are selected for a position which requires a college degree to meet minimum qualification requirements, you will be required to submit your official college transcript(s) at time of selection.

Additional Information

If you receive a conditional offer of employment for this position, you will be required to complete an Optional Form 306, Declaration for Federal Employment , and to sign and certify the accuracy of all information in your application, prior to entry on duty. False statements on any part of the application may result in withdrawal of offer of employment, dismissal after beginning work, fine, or imprisonment.
DHS uses E-verify, an internet based system, to confirm the eligibility of all newly hired employees to work in the United States. Learn more about E-Verify , including your rights and responsibilities.
This announcement may be used to fill one or more vacancies.
STAFFORD ACT EXCEPTED SERVICE APPOINTMENTS: Cadre On Call Response Employee (CORE) is an appointment type granted under the Robert T. Stafford Disaster Relief and Emergency Assistance Act, Section 306 (b), which authorizes FEMA to appoint such temporary employees as necessary to accomplish work authorized under the Act. Appointments under this authority within FEMA are made to the excepted service and are nonpermanent in nature.
All candidates must be able to deploy with little or no advance notice to anywhere in the United States and its territories for an extended period of time. Deployments may include working in excess of eight hours a day, or in excess of 40 hours per week, including weekends and holidays, and under stressful, physically demanding, and austere conditions. When activated and deployed, you serve in a federal travel status and are entitled to lodging, transportation and per diem reimbursements for authorized expenses in accordance with federal travel regulations.
If selected for this position, and you have not previously completed these requirements, you are subject to (1) completion of a 2 day onboarding program at your primary duty location; and, (2) completion of a subsequent, multiple day orientation program within 90-120 days of hire, at a location to be determined. Travel associated with the orientation portion of this requirement may be at FEMA’s expense.
If this position has been identified as a Testing Designated Position (TDP) because of its security, public health, and/or public safety sensitivity, you are subject to random drug testing under FEMA's Drug-Free Workplace Plan (DWP). Refusal to be tested will result in disciplinary action up to and including removal from federal service.
Applying to this announcement certifies that you give permission for DHS to share your application with others in DHS for similar positions.

Read more

Help Help A career with the U.S. government provides employees with a comprehensive benefits package. As a federal employee, you and your family will have access to a range of benefits that are designed to make your federal career very rewarding. Opens in a new window Learn more about federal benefits .

DHS offers competitive salaries and an attractive benefits package, including: health, dental, vision, life, and long-term care insurance; retirement plan; Thrift Savings Plan [similar to a 401(k)]; Flexible Spending Account; Employee Assistance Program; personal leave days; and paid federal holidays. Other benefits may include: flexible work schedules; telework; tuition reimbursement; transportation subsidies; uniform allowance; health and wellness programs; and fitness centers. DHS is committed to employee development and offers a variety of employee training and developmental opportunities. For more information, go to the DHS Careers website and select “Benefits.” Disabled veteran leave will be available to any Federal employee hired on or after November 5, 2016, who is a veteran with a service-connected disability rating of 30 percent or more.

Review our benefits

Eligibility for benefits depends on the type of position you hold and whether your position is full-time, part-time or intermittent. Contact the hiring agency for more information on the specific benefits offered.
Show less "
30,Other,Government Administration,Associate,"Description

High energy, professional, administrative support to Program Managers needed for this position to assist with programmatic duties in patient focused and operational areas, including payroll, data entry, systems management, patient and staff support. Problem-solving, critical thinking and ability to communicate effectively with internal and external customers desired.

HIRING HOURLY: $18.22

Continuation of employment in this position is contingent upon availability of funding from service, program and agency earnings. OPEN UNTIL FILLED - APPLICATION REVIEW BEGINS IMMEDIATELY

Duties And Responsibilities

This position provides clerical and administrative support to Program Managers responsible for patient focused and operational programs. A high level of personal organization, ability to prioritize, change and effective communication skills desired to fulfill the following duties, including, but not limited to:

Creating and maintaining data tracking systems, including developing Excel spreadsheets
Entering data and maintaining Inventory control systems,
Composing correspondence from designated personnel,
Collecting timesheets and processing bi-weekly payroll batch,
Entering agency work orders into County-wide system,
Filing and maintaining hard copy records for audits,
Arranging internal and external meetings,
Ordering and purchasing of office and program supplies,
Assisting with budget processes,
Working across agency departments to gather information and provide reports,
Assisting internal and external customers in a timely and professional manner,
And other duties as assigned to support the programs and agency.
This position may be designated to report to work during hazardous weather or emergency conditions.

Minimum Qualifications

Position requires: Graduation from High School or possession of a GED, with an Associate's Degree, some college, or other additional training preferred; and three (3) or more years of experience in general office operations, including experience with public contact; or any equivalent combination of experience and training which provides the knowledge, skills, and abilities necessary to perform the work.

Knowledge, Skills And Abilities

In addition, the chosen candidate must possess the following skills:

Excellent interpersonal and written communication,

Effective verbal communication,
The ability to work independently,
The ability to handle sensitive and confidential information in a professional manner,
Strong understanding of Microsoft Office (Word, Excel, Access, PowerPoint) and personal computing.
Closing Date/Time:
Show less "
31,Other,Government Administration,Entry level,"Summary Statement

An incumbent is this class assists and supports the case management function by providing clerical assistance and routine services to clients such as transportation and appointment scheduling.

Essential Functions

Essential functions are fundamental, core functions common to all positions in the class series and are not intended to be an exhaustive list of all job duties for any one position in the class. Since class specifications are descriptive and not restrictive, incumbents can complete job duties of similar kind not specifically listed here.

Schedules appointments for clients and transports to required location (hospital, court, therapy session) provides coaching and assists client; provides support and encouragement to obtain desired outcome.
Provides office and telephone coverage in absence of case manager and refers problem to appropriate party.
Visits clients in a variety of environments such as home, school, observing behavior, and reporting to Case Manager.
Prepares and maintains a variety of records and forms required by case manager to provide the necessary services to the client.
Monitors behavior of child and parents on parental visits and insures safe interaction.
May interview and obtain basic information from clients such as dates of birth or social security numbers of family members.

Job Requirements

JOB REQUIREMENTS for Family Service Assistant I

Applicants must have education, training and/or experience demonstrating competence in each of the following areas:

Six months experience in record keeping.
Six months experience in using an automated information system to enter, update, modify, delete, retrieve/inquire and report on data.
Six months experience in applying laws, rules, regulations, standards, policies and procedures.
Knowledge of health or human services support such as interviewing clients and assessing personal, health, social or financial needs in accordance with program requirements or coordinating with community resources to obtain client services.
Possession of a valid Driver's License (not suspended, revoked or cancelled, or disqualified from driving).

Conditions of Hire

Applicants must be legally authorized to work in the United States. The State of Delaware Executive Branch participates in the Federal E-Verify system where the State will provide the federal government with each new hires Form I-9 information to confirm that you are authorized to work in the U.S. For more information refer to our job seeker resources.

This position is a classification organized under an exclusive bargaining representative (labor organization) that has been elected by employees as their representative for collective bargaining and other applicable terms and conditions of employment, in accordance with Title 29, Chapter 59 and Title 19, Chapter 13 and 16. This position is covered by a collective bargaining agreement based on its individual terms.

Pre-employment Drug Testing: Upon a conditional offer, you must undergo pre-employment drug testing as part of the hiring process. Criminal background check: A satisfactory criminal background check is required as a condition of hire. The recruiting agency may require the applicant to pay for the criminal background check as part of the conditional offer of hire.

Benefits

To learn more about the comprehensive benefit package please visit our website at https://dhr.delaware.gov/benefits/

Selection Process

The application and supplemental questionnaire are evaluated based upon a rating of your education, training and experience as they relate to the job requirements of the position. It is essential that you provide complete and accurate information on your application and the supplemental questionnaire to include dates of employment, job title and job duties. For education and training, list name of educational provider, training course titles and summary of course content. Narrative information supplied in response to the questions must be supported by the information supplied on the application including your employment, education and training history as it relates to the job requirements.

Once you have submitted your application on-line, all future correspondence related to your application will be sent via email. Please keep your contact information current. You may also view all correspondence sent to you by the State of Delaware in the “My Applications” tab at StateJobs.Delaware.gov .

Accommodations

Accommodations are available for applicants with disabilities in all phases of the application and employment process. To request an auxiliary aid or service please call (302) 739-5458. TDD users should call the Delaware Relay Service Number 1-800-232-5460 for assistance.

The State of Delaware is an Equal Opportunity employer and values a diverse workforce. We strongly encourage and seek out a workforce representative of Delaware including race, color, religion, age, sex, national origin, disability status, genetics, protected veteran status, sexual orientation, gender identity or expression.
Show less "
32,Other,Government Administration,Entry level,"Help Help Requirements Conditions of Employment




Must be a U.S. Citizen or National.
Males born after 12-31-59 must be registered for Selective Service or exempt.
Subject to satisfactory adjudication of background investigation and/or fingerprint check.
Successful completion of one-year probationary period, unless previously served.
Per Public Law 104-134 all Federal employees are required to have federal payments made by direct deposit to their financial institution.
Successfully pass the E-Verify employment verification check. To learn more about E-Verify, including your rights and responsibilities, visit E-Verify.
This position is required to work swing shift and night shift when determined by the needs of the Center.
This is a Test Designated Position. You will be tested for illegal drugs prior to appointment and randomly thereafter. Appointment and continued employment is conditional on negative results. This announcement constitutes 30 days advance notice.




Qualifications




In order to qualify, you must meet the eligibility and qualifications requirements as defined below by the closing date of the announcement. For more information on the qualifications for this position, visit the Office of Personnel Management's General Schedule Qualification Standards.




Your application and resume must clearly show that you possess the experience requirements. Transcripts must be provided for qualifications based on education. Provide course descriptions as necessary.




For the GS-4 level: Applicants must have six months of any type of work that demonstrated the ability to perform the work of the position, or experience that provided a familiarity with the subject matter or processes of the broad subject area of the occupation AND six months of specialized experience equivalent to at least the GS-3 grade level;




OR




Successful completion of 2 years of study that (a) included at least 12 semester hours of subjects directly related to the work of the position such as social behavior, human behavior, or health care, or (b) was supplemented by experience in activities that afforded the opportunity to acquire and demonstrate the skills required by the position;




OR




Combinations of successfully completed post-high school education and experience. The education must have been obtained in an accredited business, secretarial or technical school, junior college, college or university.




General Experience - Providing childcare, performing volunteer work at a youth camp, or performing community service with disadvantaged youths.




Specialized Experience for the GS-3 Level is defined as most of the following: Assisted youths in various types of organizational activities such as sport teams or tutoring; Volunteered as a community work crew member. Assisted in providing guidance in a community or residential recreation program; Assisted in providing crew members instruction in safety rules and regulations in living and working situations.




For the GS-5 level: Applicants must have one year of specialized experience equivalent to at least GS-4 grade level;




OR




Successful completion of a full 4-year course of study leading to a bachelor's degree that (a) included at least 24 semester hours in any combination of subjects directly related to the work of the position; (b) included a major in social behavior, human behavior, or health care or; (c) was supplemented by specialized experience as described below;




OR




Specialized experience for the GS-4 Level is defined as most of the following: Group leader in community or residential recreation program; Instructor in a training program for the development of job skills; Work that demonstrated the ability to be responsible for and to lead and train members of a job crew; Unit leader-monitor-proctor for a dormitory group or a boarding school or other residential facility.




Experience refers to paid and unpaid experience, including volunteer work done through National Service programs (e.g., Peace Corps, AmeriCorps) and other organizations (e.g., professional; philanthropic; religious; spiritual; community, student, social). Volunteer work helps build critical competencies, knowledge, and skills and can provide valuable training and experience that translates directly to paid employment. You will receive credit for all qualifying experience, including volunteer experience.




Additional Information




THIS IS AN OPEN CONTINUOUS ANNOUNCEMENT. This type of announcement provides the Forest Service with a readily available source of applicants when vacancies occur. Eligibility and qualifications will be verified when there is a vacancy for the location and grade for which you applied. Information on specific locations where jobs are being filled and the dates when applications are due for these locations can be found at https://fsoutreach.gdcii.com/Outreach.




The USDA Forest Service has legislative authority to recruit and fill Permanent (Career/Career-Conditional), Temporary, and Term Appointments under the USDA Demonstration Project. Under this authority, any U.S. citizen may apply.




Career Transition Assistance Plan (CTAP), Reemployment Priority List (RPL), or Interagency Career Transition Assistance Plan (ICTAP) : To exercise selection priority for this vacancy, CTAP/RPL/ICTAP candidates must meet the basic eligibility requirements and all selective factors. CTAP/ICTAP eligibles must meet the agency's definition for a quality candidate as provided in the How You Will Be Evaluated section of this announcement to be considered.




If you are selected for a position with further promotion potential, you will be placed under a career development plan, and may be non-competitively promoted if you successfully complete the requirements and if recommended by management. However, promotion is not guaranteed.




The Forest Service may use certain incentives and hiring flexibilities, currently offered by the Federal government, to attract highly qualified candidates. Additional information is available at https://www.opm.gov/policy-data-oversight/pay-leave/pay-and-leave-flexibilities-for-recruitment-and-retention/




This position is NOT eligible for telework.




Positions filled from this announcement may be a bargaining or a non-bargaining unit position represented by either NFFE, AFGE or NAGE.




Forest Service daycare facilities are NOT available.




Government Housing MAY be available.




Read more




Help Help A career with the U.S. government provides employees with a comprehensive benefits package. As a federal employee, you and your family will have access to a range of benefits that are designed to make your federal career very rewarding. Opens in a new window Learn more about federal benefits .




Eligibility for benefits depends on the type of position you hold and whether your position is full-time, part-time or intermittent. Contact the hiring agency for more information on the specific benefits offered.
Show less "
