,Job Function,Industry,Seniority,Job Description
0,Human Resources,Public Policy Offices,Not Applicable,"Company Description




About us: Equal Justice USA (EJUSA) is a national organization working to transform the justice system by promoting responses to violence that break cycles of trauma. We work at the intersection of criminal justice, public health, and racial justice to elevate healing and safety over retribution, advance racial equity, and meet the needs of survivors.




How we do it: Our programs work to end the death penalty, expand community-based healing and violence prevention programs in impacted communities, reduce the scope of policing, and change the national narrative on violence and accountability. EJUSA has a bold vision for healing and equity that directly aligns with this urgent national moment – making this an exciting time to join our team and design the next phase of EJUSA’s strategy!




Our team members: EJUSA is a team of fierce organizers and advocates, many of whom have been touched by violence and the justice system. We bring a broad span of perspectives to our work, united by one common belief that everyone deserves safety, healing, equity, and well-being.




What it’s like to work here: EJUSA is a special place to work. Our team is made up of passionate and collaborative leaders who treat each other as whole people. Our organizational culture is rooted in the values that drive our mission, so we work to ensure that equity, partnership, transcending divides, and healing are embedded into every aspect of our daily operations, from staff policies to salaries. We are an entirely remote organization and have been honing ways of building and maintaining trust across our team virtually since long before the rest of the world had to.




Job Description




About this role: We seek an energetic, creative, highly organized relationship builder with strong communication and workplace culture development skills with a race equity lens to support our People Department. This position will work closely with the Director of Talent and Equity to manage our employee life cycle, which includes recruitment, hiring, on-boarding, employee engagement & retention, and offboarding. This is an excellent opportunity to hone alternative Human Resource practices as part of a dynamic people-centered team that is working to bring a community and healing-centered lens to traditional Human Resource practices. The ideal candidate will be passionate about connecting in meaningful ways with people who want to make a difference in Social Justice. As one of three dedicated People Department staff members, you will gain insight into every aspect of the department and organization.




EJUSA has 34 staff members throughout the country and a small national office in Brooklyn, NY. This is a remote position that will report to the Director of Talent and Equity.




Qualifications




Excellent written, and verbal communication, organizational skills and meticulous attention to detail and deadlines.
Robust customer service approach; gets joy out of helping others.
Knowledge of human resources regulations, policies, and procedures.
Ability to anticipate challenges and problem-solve in advance.
Shows great personal discretion and handling the most sensitive employee information.
Flexibility; able to plan and organize work to meet changing priorities and deadlines.
A logistical mindset; enjoys building plans behind the scenes and seeing projects through.
Ability to work with and adapt to a diverse set of audiences.
Proficient with Microsoft 365, Google Suite applications, DropBox, HR Information Systems, etc.
Resourceful, diligent, creative, friendly personality, sense of humor, and the ability to work with different personalities.
Commitment to the mission and core values of Equal Justice USA.
PHR or SHRM certification preferred.




Responsibilities:




People and Collaboration




Support talent acquisition activities for open positions, such as market intelligence research, recruitment, interviewing, on-boarding, and 90-day check-ins.
Lead and manage systems and processes for staff on-boarding and off-boarding.
Lead and manage EJUSA’s Internship and fellowship program.
Actively engage and participate in team and department activities that contribute to the achievement of team/department goals and visions.
Grow as an individual who is committed to being an antiracist.
Actively contribute to creating a culture of respect, inclusion, and collaboration.




Culture and Resources




Conduct employee satisfaction surveys, stay interviews, and other activities to measure employee views and implement programs to enhance employee engagement.
Lead quarterly staff appreciation events.
Foster a culture of open, honest, and transparent communication, as well as belonging.
Incorporate Diversity, Equity, Inclusion, Belonging, & Accessibility into all aspects of our people activities.
Collaborate with the Director of Talent & Equity to make mental health resources accessible to staff.
Standing Member in the retreat team and wellness team.
Ensuring that all organizational and staff-related training guides, policy manuals, and HR resources are maintained and up to date.
Serve as a resource to staff with workplace-related questions, comments, feedback, and/or challenges.
Keep updated with the latest HR trends, best practices, and employment laws and regulations nationwide.
Other special projects and duties as needed.




Additional Information




Location: Remote




Compensation: $70k- $74k commensurate with experience. Excellent benefits including employer-paid medical and dental care, retirement plan, paid vacation, sick days, holidays, disability insurance, and professional development allowance.




Other Perks:




While we have 40-hour work weeks, employees of EJUSA also enjoy human-first wellness-focused schedules because we understand that life happens and the impact of the work is more important than strict adherence to structures.
We come together as a group in person twice a year for week-long staff retreats to bond, plan, learn, and hang together at different locations throughout the country. Past destinations include Newark, Tampa, Philadelphia, and Puerto Rico.
We have structures to support and back up our organizational values, ranging from benefits that help cover home office set-up, cell phone bills, and caregiving emergencies.
Staff members also have the opportunity to join affinity-based caucuses, a wellness team dedicated to centering the physical and mental health of all staff, the retreat team to help plan our semi annual convening, and our race equity leadership team that contributes to our organizational commitment to becoming an anti-racist community.




Target start date: July 2023




To apply:




Visit www.ejusa.org/jobs to apply online
Upload a resume AND complete the screening questionnaire
Incomplete applications will not be considered
Applications will be reviewed immediately on a rolling basis
No calls, please




EJUSA is an Equal Opportunity Employer. We encourage a diverse pool of candidates to apply, including those impacted by the issues we work on. We consider all applicants on the basis of their ability to perform the job, without regard to race, color, religion, creed, sex, sexual orientation, gender identity, marital status, pregnancy, national or ethnic origin, genetic information, physical appearance, age, mental or physical disability, credit history, veteran status, uniform service member status, justice system involvement, survivor of domestic violence, stalking, or other crimes, political affiliation, or any other legally protected class. EJUSA does not tolerate discrimination or harassment against any of the above-listed classes.
Show less "
1,"Marketing, Public Relations, and Writing/Editing",Government Administration,Entry level,"The Virginia Aquarium & Marine Science Center is seeking a proactive public relations professional to serve as the primary point of contact with the media, to develop and execute internal and external communication messages and strategies, and to assist with social media strategy and implementation.

Responsibilities

Own, manage and execute all Public Relations activities, including developing the Virginia Aquarium release/pitch calendar, proactive pitches, news releases, partner quotes, metrics, and other external-facing statements
Work with internal stakeholders to identify and build unique stories based on VAQ goals and initiatives
Manage media monitoring and analysis, including the creation of reports related to monthly media coverage.
Draft and edit communication materials including press releases, media pitches, editorial pieces, media statements, topline messages, press kits, speeches/presentations, and other communication materials for various targeted audiences.
Collaborate with marketing team and Virginia Aquarium leadership on story development, advocacy strategies and issues management, as needed.
Coordinate all media interviews (virtual and on-site), determine talking points, and prepare interview subjects. Serve as spokesperson as appropriate.
Accommodate media requests for specific content, photography, videography, logos, etc.
Host on-site photo and video shoots in accordance with the City’s Special Events Office policies and procedures.
Supervise Digital Marketing Manager and assist with social media content strategy and implementation.
Facilitate reputation management, drafting responses to guest reviews and feedback received through the Virginia Aquarium’s social and digital channels
Provide crisis communication support as needed to the City Manager's office during emergencies. May work in the Emergency Operations Center - Joint Information Center as needed.
Show less "
2,Other,Government Administration,Not Applicable,"Equal Opportunity Employer




The State of California is an equal opportunity employer to all, regardless of age, ancestry, color, disability (mental and physical), exercising the right to family care and medical leave, gender, gender expression, gender identity, genetic information, marital status, medical condition, military or veteran status, national origin, political affiliation, race, religious creed, sex (includes pregnancy, childbirth, breastfeeding and related medical conditions), and sexual orientation.




It is an objective of the State of California to achieve a drug-free work place. Any applicant for state employment will be expected to behave in accordance with this objective because the use of illegal drugs is inconsistent with the law of the State, the rules governing Civil Service, and the special trust placed in public servants.




Position Details




Job Code #:




JC-361003




Position #(s):




538-205-7500-691




Working Title




Area District Deputy




Classification




C. E. A.




$9,471.00 - $19,557.00




# of Positions:




1




Work Location:




Kern County




Job Type




Career Executive Assignment - Non Tenured, Full Time




Department Information




With a team of scientists and other dedicated professionals, the Department of Conservation (DOC) administers a variety of programs vital to California's public safety, environment, and economy. The services DOC provides are designed to balance today's needs with tomorrow's obligations by fostering the wise use and conservation of energy, land, and mineral resources.




All employees are responsible for contributing to an inclusive, safe, and secure work environment that values diverse cultures, perspectives, and experiences, and is free from discrimination.




Department Website: http://www.conservation.ca.gov




Job Description And Duties




Are you interested in working for a department that oversees the operations of land conservation, mining, earthquakes and oil & gas regulations for the State of California?




Then this may be the job for you!




Under the direction of the State Oil and Gas Supervisor and Chief Deputy, the incumbent will function as the Inland Area District Deputy in the Division's Bakersfield office. The incumbent will direct and have charge of the work plans, goals, and objectives for the Division’s Central Area District. The position supervises the oil and gas drilling and production, freshwater protection, enhanced recovery, underground injection control, production tank and pipeline integrity, and the environmental protection programs of the California Geologic Energy Management Division in the District.




IMPORTANT INFORMATION: This position requires a Statement of Qualifications (SOQ). Applications submitted without an SOQ or an SOQ that does not answer the items/questions, and/or does not follow formatting instructions will be considered not interested in this position and will be eliminated from the selection process. Resumes and cover letters do not take the place of the SOQ. Please see the Desirable Qualifications section below for instructions.




You will find additional information about the job in the Duty Statement .




Special Requirements




This position is designated under the Conflict-of-Interest (COI) Code. The position is responsible for making or participating in the making of governmental decisions that may potentially have a material effect on personal financial interests. The incumbent is required to complete form 700 within 30 days of appointment. Failure to comply with the COI Code requirements may void the appointment.




Application Instructions




Dates printed on Mobile Bar Codes, such as the Quick Response (QR) Codes available at the USPS, are not considered Postmark dates for the purpose of determining timely filing of an application.




Final Filing Date: Until Filled




Who May Apply




Individuals who are eligible to be appointed to this Career Executive Assignment (CEA) by the State of California.




How To Apply




If You Choose To Not Apply Electronically, a Hard Copy Application Package May Be Submitted Through An Alternative Method Listed Below




Complete Application Packages (including your Examination/Employment Application (STD 678) and applicable or required documents) must be submitted to apply for this Job Posting. Application Packages may be submitted electronically through your CalCareer Account at www.CalCareers.ca.gov. When submitting your application in hard copy, a completed copy of the Application Package listing must be included.




Address for Mailing Application Packages




You may submit your application and any applicable or required documents to:




Department of Conservation




Attn: Tara Hirst




715 P Street, MS 1806




Sacramento , CA 95814




Address for Drop-Off Application Packages




You may drop off your application and any applicable or required documents at:




Department of Conservation




Tara Hirst




715 P Street, MS 1806




Sacramento , CA 95814




08:00 AM - 05:00 PM




Required Application Package Documents




Required




Applicants who do not submit the required items timely may not be considered for this job




The following items are required to be submitted with your application.




Current version of the State Examination/Employment Application STD Form 678 (when not applying electronically), or the Electronic State Employment Application through your Applicant Account at www.CalCareers.ca.gov. All Experience and Education relating to the Minimum Qualifications listed on the Classification Specification should be included to demonstrate how you meet the Minimum Qualifications for the position.
Statement of Qualifications - Please address and number the Desirable Qualifications in the same order as listed on this bulletin under the Desirable Qualifications section; do not consolidate the responses. The SOQ must be typed and no more than two (2) pages in length. Applicants who do not follow these requirements may be disqualified from the examination. Cover letters and resumes do not take the place of SOQs.




Applicants requiring reasonable accommodations for the hiring interview process must request the necessary accommodations if scheduled for a hiring interview. The request should be made at the time of contact to schedule the interview. Questions regarding reasonable accommodations may be directed to the EEO contact listed on this job posting.
Show less "
3,Administrative,Government Administration,Entry level,"Help Help Requirements Conditions of Employment




You must be a US Citizen or US National.
Males born after 12/31/1959 must be Selective Service registered or exempt.
Subject to satisfactory adjudication of background investigation and/or fingerprint check.
Successful completion of one-year probationary period, unless previously served.
Direct Deposit - Per Public Law 104-134 all Federal employees are required to have federal payments made by direct deposit to their financial institution.
Successfully pass the E-Verify employment verification check. To learn more about E-Verify, including your rights and responsibilities, visit E-Verify at https://www.e-verify.gov/.
The documentation you present for purposes of completing the Department Homeland Security (DHS) Form I-9 on your entry-on-duty date will be verified through the DHS ""E-VERIFY"" system.
You may need to complete a Declaration for Federal Employment (OF-306).
More than one selection can be made from this announcement.




Qualifications




Applicants must meet all qualifications and eligibility requirements by the closing date of the announcement including time-in-grade restrictions, specialized experience and/or education, as defined below.




Time in grade: Applicants must have one year of specialized experience at the next lower grade to be considered for the next higher grade (e.g. one year at the GS-09 grade level for consideration for the GS-11 grade level).




GS-11: One year of specialized experience,equivalent to the GS-09 level in the Federal service or equivalent responsibility in the private sector/pay systems which demonstrates 6 of the 11 following competencies/knowledge to successfully perform as an Administrative Officer. Specialized experience is defined as considerable experience with:




Developing, recommending, and implementing policies relating to the full range of administrative management.
Directing and administering a budget and fiscal activities.
Interpreting and applying regulations, policies, and procedures to a wide variety of administrative matters.
Developing operating procedures, policies, and instructions to facilitate and improve effectiveness of the administrative activities.
Ability to multi-task from multiple supervisors/clients while staying highly organized and timely.
Experience developing and implementing procedures for efficient and effective file and records management.
Experience identifying and responding to requests for information or requests for services, initiates and processes required paperwork.
Proficient at managing, reviewing, and distributing all incoming correspondence, including documents of a confidential legal and administrative nature.
Proficient at using software applications, databases, and automated systems to help manage administrative functions.
Ability to coordinate necessary arrangements for different functions including logistical items, i.e. space, materials, and notifications.
Experience overseeing and coordinating a wide range of human resources (HR) management actions including: employee appraisals, performance plans, individual development plans, time and attendance, and/or awards.
Experience refers to paid and unpaid experience, including volunteer work done through National Service programs (e.g., Peace Corps, AmeriCorps) and other organizations (e.g., professional; philanthropic; religious; spiritual; community, student, social). Volunteer work helps build critical competencies and can provide valuable training and experience that translates directly to paid employment. You will receive credit for all qualifying experience, including volunteer experience.




Education




If qualifying based on education: Ph.D. or equivalent doctoral degree OR 3 full years of progressively higher-level graduate education leading to such a degree OR LL.M., if related.




Combining Education and Experience: Combinations of successfully completed post-high school education and experience may be used to meet total qualification requirements for the grade levels specified in the table, and may be computed by first determining the applicant's total qualifying experience as a percentage of the experience required for the grade level; then determining the applicant's education as a percentage of the education required for the grade level; and then adding the two percentages. The total percentages must equal at least 100 percent to qualify an applicant for that grade level. Only graduate education in excess of the amount required for the next lower grade level may be used to qualify applicants for positions at grades GS-9 and GS-11. (When crediting education that requires specific course work, prorate the number of hours of related courses required as a proportion of the total education to be used.)




Additional Information




Career Transition Assistance Plan (CTAP), Reemployment Priority List (RPL), or Interagency Career Transition Assistance Plan (ICTAP): Visit the OPM website for information on how to apply as a CTAP, RPL, or ICTAP eligible. To exercise selection priority for this vacancy, CTAP/RPL/ICTAP candidates must meet the basic eligibility requirements and all selective factors. CTAP/ICTAP candidates must be rated and determined to be well qualified (or above) based on an evaluation of the competencies listed in the How You Will Be Evaluated section. When assessed through a score-based category rating method, CTAP/ICTAP applicants must receive a rating of at least 85 out of a possible 100.




Veterans who are preference eligible or who have been separated from the armed forces under honorable conditions after three years or more of continuous active service are eligible for consideration under the Veteran's Employment Opportunity Act (VEOA).




For more information on applying under special hiring authorities such as the Veteran's Recruitment Act (VRA), 30 percent disabled veterans, certain military spouses, Schedule A Disabled, etc., explore the different Hiring Paths on the USAJOBS website .




Farm Service Agency (FSA) County Employees: Permanent County employees without prior Federal tenure who are selected for a Civil Service position under Public Law 105-277 will be given a career-conditional appointment and must serve a 1-year probationary period.




Land Management Workforce Flexibility Act (LMWFA) provides current or former temporary or term employees of federal land management agencies opportunity to compete for permanent competitive service positions. Individuals must have more than 24 months of service without a break between appointments of two or more years. Service must be in the competitive service and have been at a successful level of performance or better. Refer to PUBLIC LAW 114-47-AUG. 7, 2015 for more information.




E-Verify: Federal law requires agencies to use the E-Verify system to confirm the employment eligibility of all new hires. If you are selected as a newly hired employee, the documentation you present for purposes of completing the Department of Homeland Security (DHS) Form I-9 on your entry-on-duty date will be verified through the DHS 'E-VERIFY' system. Under the system, the new hire is required to resolve any identified discrepancies as a condition of continued employment.




Direct Deposit - Per Public Law 104-134 all Federal employees are required to have federal payments made by direct deposit to a financial institution of your choosing.




Special Hiring Authorities Information: Click here for more information regarding applying under the Veteran's Recruitment Act (VRA), 30 percent disabled veterans, certain military spouses, and Schedule A Disabled.




EEO Policy Statement: Click here




Reasonable Accommodation Policy Statement: Click here




Veterans Information: Click here




Read more




Help Help A career with the U.S. government provides employees with a comprehensive benefits package. As a federal employee, you and your family will have access to a range of benefits that are designed to make your federal career very rewarding. Opens in a new window Learn more about federal benefits .




Eligibility for benefits depends on the type of position you hold and whether your position is full-time, part-time or intermittent. Contact the hiring agency for more information on the specific benefits offered.
Show less "
